DTA-Tag	TT-Tag	MM-TAg	Perceptron-Tag	Lemma	newtag	Prefix	Wort	Suffix	Sentence_neighborhood	sentence_index	index	filename
PAV	PROAV		PROAV	dabei		Alles , was geschieht , für herrlich und wunderschön zu halten – die Moralisten erklärte ich	dabei	auch für komische Figuren – und die Ägypter gaben mir Recht – ich aber gab ihnen schließlich meine Mückenphantasie .	Uhr langsam hin und her ticken .Alles , was geschieht , für herrlich und wunderschön zu halten – die Moralisten erklärte ich dabei auch für komische Figuren – und die Ägypter gaben mir Recht – ich aber gab ihnen schließlich meine Mückenphantasie .« Die Helden sprachen lange kein Wort	2153	16	95107-Scheerbart__Paul.tsv
PAV	PROAV		PROAV	dabei		ladet er mich ein , es mit ihm zu teilen ; ironisch lächelnd , aber	dabei	skrupulös die Form wahrend , entgegne ich , daß er mir eine große Ehre erweise ; wir setzen uns und essen ; er gießt ein , zitternd , ich sage : zitternd !	Triumph , und wurde noch höflicher .ladet er mich ein , es mit ihm zu teilen ; ironisch lächelnd , aber dabei skrupulös die Form wahrend , entgegne ich , daß er mir eine große Ehre erweise ; wir setzen uns und essen ; er gießt ein , zitternd , ich sage : zitternd !Ha !	31	15	25320-Ernst__Paul.tsv
PAV	PROAV		PROAV	daher		Wir waren inzwischen zu einer selbständigen Lebensstellung gelangt und konnten	daher	ohne Demütigung heimkehren .	unserer Verbannung ging ihrem Ende entgegen .Wir waren inzwischen zu einer selbständigen Lebensstellung gelangt und konnten daher ohne Demütigung heimkehren .Nur der Paragraph über die obligatorischen Fälle	1505	10	102347-Suttner__Bertha_von.tsv
PAV	PDS		ADV	daher		Ist	dahero	nicht besser gethan , als daß man ihnen bey Zeiten die Hälse breche , und ist sonst kein ander Unglück zu besorgen , als daß man nun ins künfftige wenig Eyer mehr von solchen Hünern bekomme , und solchergestalt ihnen das Futter umsonst geben werde .	und der Prophetin der Halß abgeschnitten .Ist dahero nicht besser gethan , als daß man ihnen bey Zeiten die Hälse breche , und ist sonst kein ander Unglück zu besorgen , als daß man nun ins künfftige wenig Eyer mehr von solchen Hünern bekomme , und solchergestalt ihnen das Futter umsonst geben werde .Wenn man von einem Orte hinweg gehet	4478	1	97156-Schmidt__Johann_Georg.tsv
PAV	PROAV		PROAV	damit		Sind Sie	damit	zufrieden ?	der Undankbarkeit sich schuldig zu machen .Sind Sie damit zufrieden ?« Nun folgt der Schluß des Briefes	2149	2	15087-Bruckbr_u__Friedrich_Wilhelm.tsv
PAV	PROAV		PROAV	darauf			Darauf	traten die beiden zurück , die Tür schloß sich und kein neugieriges Gesicht erschien an den Fenstern , als hätte das Haus nur mit Herablassung die Ehre angenommen , welche ihm die Bürger erwiesen .	derselben ihn wie ein Mantel umhüllten .Darauf traten die beiden zurück , die Tür schloß sich und kein neugieriges Gesicht erschien an den Fenstern , als hätte das Haus nur mit Herablassung die Ehre angenommen , welche ihm die Bürger erwiesen .Stolz stand er da , trotz seiner	24350	0	27046-Freytag__Gustav.tsv
PAV	PROAV		PROAV	darauf		Nichts erfolget	darauf	; denn nichts gewinnet nichts , und wer keinen Fuß auf die Schwelle setzt , der verlieret nichts .	wie die meisten zu thun pflegen ?Nichts erfolget darauf ; denn nichts gewinnet nichts , und wer keinen Fuß auf die Schwelle setzt , der verlieret nichts .Jedoch meyne ich , des Glücks ,	2108	2	97156-Schmidt__Johann_Georg.tsv
PAV	PROAV		PROAV	darauf		Als die Glocke Elf schlug , wollte er es wieder anziehen um nach Hause zu gehn , da sah er zu seinem Schrecken , daß eine Schlange	darauf	lag .	aller Frühe ins Feld zur Arbeit .Als die Glocke Elf schlug , wollte er es wieder anziehen um nach Hause zu gehn , da sah er zu seinem Schrecken , daß eine Schlange darauf lag .‹ Da war sie ganz außer sich	22	27	110586-Wolf__Johann_Wilhelm.tsv
PAV	PROAV		PROAV	darauf		Staunend über diese neuen Entdeckungen , die sie	darauf	sich gegenseitig machten , verloren sie zwar die Spur des plötzlich wie verschwundenen flüchtigen Fremden , aber sie sagten doch : Siegbert , erstaunend über die Aufregung des Bruders , konnte nichts als , alle Gegenrede vermeidend , ihn bitten , deutlicher zu werden und in Ruhe zu erzählen , was er ihm anzuvertrauen hätte .	Priesterrock und Weihe , wahre Ruhe .Staunend über diese neuen Entdeckungen , die sie darauf sich gegenseitig machten , verloren sie zwar die Spur des plötzlich wie verschwundenen flüchtigen Fremden , aber sie sagten doch : Siegbert , erstaunend über die Aufregung des Bruders , konnte nichts als , alle Gegenrede vermeidend , ihn bitten , deutlicher zu werden und in Ruhe zu erzählen , was er ihm anzuvertrauen hätte .Das Bedürfniß der Beichte ist der Wahrheitsdrang	35527	8	56355-Gutzkow__Karl.tsv
PAV	PDS		PROAV	darauf		4 Als man daselbst asse / und aber kein Saltz vorhanden war / habe er solches begehret mit harter Müh auch erhalten / und	darauff	gesaget : Gott sey gelobet / itzt komt Saltz ; so bald aber dieses geredt / sey alles verschwunden / und seyn die Liechter erloschen .	mit vielen andern Exempeln bewehret werden .4 Als man daselbst asse / und aber kein Saltz vorhanden war / habe er solches begehret mit harter Müh auch erhalten / und darauff gesaget : Gott sey gelobet / itzt komt Saltz ; so bald aber dieses geredt / sey alles verschwunden / und seyn die Liechter erloschen .Verwundern müssen wir uns zwar über der	1065	24	85699-Praetorius__Johannes.tsv
PAV	ADV		VVFIN	darum		Alles	drum	' rum ist finster , und nur das Annedorle und ihr Schiebkarren sind hell .	Ja , jetzt im Mondschein .Alles drum ' rum ist finster , und nur das Annedorle und ihr Schiebkarren sind hell .» Aber das ist sie endlich doch	932	1	78050-Ludwig__Otto.tsv
PAV	ADV		ADV	daselbst		4 Als man	daselbst	asse / und aber kein Saltz vorhanden war / habe er solches begehret mit harter Müh auch erhalten / und darauff gesaget : Gott sey gelobet / itzt komt Saltz ; so bald aber dieses geredt / sey alles verschwunden / und seyn die Liechter erloschen .	mit vielen andern Exempeln bewehret werden .4 Als man daselbst asse / und aber kein Saltz vorhanden war / habe er solches begehret mit harter Müh auch erhalten / und darauff gesaget : Gott sey gelobet / itzt komt Saltz ; so bald aber dieses geredt / sey alles verschwunden / und seyn die Liechter erloschen .Verwundern müssen wir uns zwar über der	1065	3	85699-Praetorius__Johannes.tsv
PAV	PROAV		PROAV	davon			Davon	rissen die Reuter aus und ließen nicht allein das eroberte Rindviehe zurück , sondern warfen auch Sack und Pack von sich , schlugen also ihre ganze Beute in Wind , damit sie nicht selbst den Bauren zur Beute würden ; doch kamen ihnen teils in die Hände , mit denen sie leiden übel umgiengen .	man in ein Wespennest gestochen hätte .Davon rissen die Reuter aus und ließen nicht allein das eroberte Rindviehe zurück , sondern warfen auch Sack und Pack von sich , schlugen also ihre ganze Beute in Wind , damit sie nicht selbst den Bauren zur Beute würden ; doch kamen ihnen teils in die Hände , mit denen sie leiden übel umgiengen .« N. N .	2312	0	50637-Grimmelshausen__Hans_Jakob_Christoffel_von.tsv
PAV	PROAV		PROAV	davon		Bald riet man mir jedoch	davon	ab , der Gnade des Herzogs von Nassau für meine Spekulation weiter nachzugehen , da jenes Schlößchen seiner feuchten Lage wegen durchaus ungesund für mich sein würde .	Zeit einem Bildhauer als Atelier diente .Bald riet man mir jedoch davon ab , der Gnade des Herzogs von Nassau für meine Spekulation weiter nachzugehen , da jenes Schlößchen seiner feuchten Lage wegen durchaus ungesund für mich sein würde .Doch hatte ich eine heimliche Absicht ,	3722	5	107728-Wagner__Richard.tsv
PAV	PROAV		PROAV	davon		« rief Summy Skim , der , sich zusammenduckend , in seinen Lehnstuhl niedersank wie einer , der entschlossen ist , nie wieder	davon	aufzustehen .	– » Nein .... nein !« rief Summy Skim , der , sich zusammenduckend , in seinen Lehnstuhl niedersank wie einer , der entschlossen ist , nie wieder davon aufzustehen .Um keine nutzlose Auseinandersetzung hierüber aufkommen zu	3115	23	107542-Verne__Jules.tsv
PAV	PROAV		PROAV	davon		« Sie ahnte , daß draußen in der Nachteinsamkeit des vertrauten Sees die Scheu von ihm weichen müßte , die ihn jetzt noch	davon	abhielt , der Mutter zu gestehen , was ihm widerfahren war .	: » Du sollst mir erzählen .« Sie ahnte , daß draußen in der Nachteinsamkeit des vertrauten Sees die Scheu von ihm weichen müßte , die ihn jetzt noch davon abhielt , der Mutter zu gestehen , was ihm widerfahren war .« fragte er schwach .	802	23	97226-Schnitzler__Arthur.tsv
PAV	PROAV		PROAV	dazu		« Unendlich wohlwollend sah er sich um ; aber er pfiff leider auf eine sonderliche Weise	dazu	, und dann ging er langsam weiter , immerfort nach rechts und links ausschauend und mit heimwehtrunkener Seele die lange entbehrten Düfte von Krodebeck einschlürfend .	Antonie lachte wieder ganz lustig .« Unendlich wohlwollend sah er sich um ; aber er pfiff leider auf eine sonderliche Weise dazu , und dann ging er langsam weiter , immerfort nach rechts und links ausschauend und mit heimwehtrunkener Seele die lange entbehrten Düfte von Krodebeck einschlürfend .Davon will sie zwar nichts hören ;	4015	16	86997-Raabe__Wilhelm.tsv
PAV	PROAV		PROAV	dazu		Das Oberlandesgericht auf Paphos hat mich	dazu	erkoren , weil sie keinen Menschen finden konnte , der gewisse geheime magische Eigenschaften – nun , nun , Schnüspelpoldchen , schwatze nicht aus der Schule !	holden Griechin über ihr Schicksal gebiete .Das Oberlandesgericht auf Paphos hat mich dazu erkoren , weil sie keinen Menschen finden konnte , der gewisse geheime magische Eigenschaften – nun , nun , Schnüspelpoldchen , schwatze nicht aus der Schule !– Aber , wo ist , fünftens	611	6	62363-Hoffmann__E__T__A_.tsv
PAV	PROAV		PROAV	dazu		Und hier standen so viele Zimmer leer und waren nur	dazu	da , um hohl zu klingen , wenn man an die Tür schlug .	versperrt und die Räume offenbar unbewohnt .Und hier standen so viele Zimmer leer und waren nur dazu da , um hohl zu klingen , wenn man an die Tür schlug .Karl war schon an großen Strecken der	2489	10	64917-Kafka__Franz.tsv
PAV	PROAV		PROAV	dazu		Ich bestrebte mich vergeblich , mit diesem entzückenden Gegenstände die Vorstellung des abscheulichen Gespenstes , das ich gesehen , zu verbinden : die erste Erscheinung diente nur	dazu	, den Reiz der letztem zu erhöhen .	Etwas anzunehmen .Ich bestrebte mich vergeblich , mit diesem entzückenden Gegenstände die Vorstellung des abscheulichen Gespenstes , das ich gesehen , zu verbinden : die erste Erscheinung diente nur dazu , den Reiz der letztem zu erhöhen .Darauf will ich dem Pächter danken und	1247	27	17682-Cazotte__Jacques.tsv
PAV	PROAV		PROAV	dazu		Die beiden Comantschen waren gar nicht einmal	dazu	gekommen , den geringsten Laut auszustoßen .	hatte er ihm den Skalp genommen .Die beiden Comantschen waren gar nicht einmal dazu gekommen , den geringsten Laut auszustoßen .Bärenherz ergriff den einen von hinten bei	9084	7	79314-May__Karl.tsv
PAV	PROAV		PROAV	demnach		Weigre Dich	demnach	nicht ferner .	damit , ohne Widerrede und Umstände .Weigre Dich demnach nicht ferner .» Bringst Du Geld ?	11355	2	99030-Spindler__Carl.tsv
PAV	NE		PROAV	hierauf			Hierauf	nahm der Soldat seine Verwandlung vor und entfernte sich ; zu der Königstochter aber kam Seelenlos , der Menschenfresser , und brachte ihr treffliche Speisen und Getränke , damit sie sich gut nähre , bis er die Zeit ersehen würde , sie zu verspeisen .	müsse ausfindig gemacht werden .Hierauf nahm der Soldat seine Verwandlung vor und entfernte sich ; zu der Königstochter aber kam Seelenlos , der Menschenfresser , und brachte ihr treffliche Speisen und Getränke , damit sie sich gut nähre , bis er die Zeit ersehen würde , sie zu verspeisen .Jedenfalls müsse Herrn Seelenlos ' Seele doch	49	0	10239-Bechstein__Ludwig.tsv
PAV	ADV		PROAV	hierauf		Dann verließ , und	hierauf	richte ich besonders Ihre Aufmerksamkeit , sein Lieutenant Creswell , der die Kranken begleitete , die Mercy-Bai , erreichte Winter-Harbour , und von da , nach einer Reise von vierhundertundsiebenzig Meilen über das Eis , am 2. Juni die Insel Beechey , wenige Tage nachher aber schiffte er sich mit einem Dutzend Mann an Bord des › Phönix ‹ ein .	und kehrte nach seinem Schiffe zurück .Dann verließ , und hierauf richte ich besonders Ihre Aufmerksamkeit , sein Lieutenant Creswell , der die Kranken begleitete , die Mercy-Bai , erreichte Winter-Harbour , und von da , nach einer Reise von vierhundertundsiebenzig Meilen über das Eis , am 2. Juni die Insel Beechey , wenige Tage nachher aber schiffte er sich mit einem Dutzend Mann an Bord des › Phönix ‹ ein .Doch weiter .	86	4	107490-Verne__Jules.tsv
PAV	VVFIN		PROAV	hiernach		Unter der Erde lag alles noch durcheinander , und obwohl auch hier jede Stein- , Kristall- und Metallart ihre Beschaffenheit von dem Lande nimmt , in dem sie wuchs , und	hiernach	die eigensten Verschiedenheiten giebet , so ist man doch in diesem Reich des Pluto noch lange nicht zu der allgemeinen geographischen Übersicht und zu den ordnenden Grundsätzen gekommen als im schönen Reich der Flora .	Aussichten und Gesetzen der Natur vorbereitet .Unter der Erde lag alles noch durcheinander , und obwohl auch hier jede Stein- , Kristall- und Metallart ihre Beschaffenheit von dem Lande nimmt , in dem sie wuchs , und hiernach die eigensten Verschiedenheiten giebet , so ist man doch in diesem Reich des Pluto noch lange nicht zu der allgemeinen geographischen Übersicht und zu den ordnenden Grundsätzen gekommen als im schönen Reich der Flora .Noch ist also , bei der gegenwärtigen	5159	31	61281-Herder__Johann_Gottfried.tsv