DTA-Tag	TT-Tag	MM-TAg	Perceptron-Tag	Lemma	newtag	Prefix	Wort	Suffix	Sentence_neighborhood	sentence_index	index	filename
ART	ART		ART	d		Chor : Nicht hilf den Menschen fürder über alles Maß , Des eignen Unheils unbekümmert ; denn ich bin	Der	festen Hoffnung , daß du einst noch , dieser Qual Entfesselt , nicht von mindrer Macht wirst sein denn Zeus .	dem Götterknecht , kein Wort gegönnt !Chor : Nicht hilf den Menschen fürder über alles Maß , Des eignen Unheils unbekümmert ; denn ich bin Der festen Hoffnung , daß du einst noch , dieser Qual Entfesselt , nicht von mindrer Macht wirst sein denn Zeus .Drum wirst du Hüter dieses öden Felsens	239	19	aischylo_promethe_promethe.tsv
ART	NN		NN	d		Chor : Nicht hilf den Menschen fürder über alles Maß ,	Des	eignen Unheils unbekümmert ; denn ich bin Der festen Hoffnung , daß du einst noch , dieser Qual Entfesselt , nicht von mindrer Macht wirst sein denn Zeus .	dem Götterknecht , kein Wort gegönnt !Chor : Nicht hilf den Menschen fürder über alles Maß , Des eignen Unheils unbekümmert ; denn ich bin Der festen Hoffnung , daß du einst noch , dieser Qual Entfesselt , nicht von mindrer Macht wirst sein denn Zeus .Drum wirst du Hüter dieses öden Felsens	239	11	aischylo_promethe_promethe.tsv
ART	ART		ART	d		Sie hätte gern die Neugier gestillt , die in ihr lebendig wurde , aber Wicho schob sie vor den Hag hinaus und schloß hinter ihr	das	Tor .	kam Heilwig von den Ställen her .Sie hätte gern die Neugier gestillt , die in ihr lebendig wurde , aber Wicho schob sie vor den Hag hinaus und schloß hinter ihr das Tor .Wicho sprang hinaus auf die offene Lände	5152	25	ganghofe_martinsk_martinsk.tsv
ART	PDS		ART	d		Ich habe Dich in meinem Brief um häufige und ausführliche Nachricht gebeten über alles , was im Hauptquartier vorgeht ; schreibe mir oft , aber ich beschwöre Dich , schreibe mir nie die Wahrheit , schreibe mir nichts von dem , was wirklich dort geschieht , nichts von dem , was ihr hofft und fürchtet – nur	das	eine , daß Du lebst und meiner gedenkst .	die Hände des abgehenden Kuriers legt .Ich habe Dich in meinem Brief um häufige und ausführliche Nachricht gebeten über alles , was im Hauptquartier vorgeht ; schreibe mir oft , aber ich beschwöre Dich , schreibe mir nie die Wahrheit , schreibe mir nichts von dem , was wirklich dort geschieht , nichts von dem , was ihr hofft und fürchtet – nur das eine , daß Du lebst und meiner gedenkst .« rief Pawjel , seinen Handjar weit	2491	57	meding_plewna_plewna.tsv
ART	ART		ART	d		– Aber ich würde doch lieber ein Dutzend Burschen zum Frühstück peitschen lassen , bis ihnen	das	Blut in die Schuhe läuft , als daß ich Euch erschrecken wollte , Täubchen .	ist ein heiliger Derwisch der Christen !– Aber ich würde doch lieber ein Dutzend Burschen zum Frühstück peitschen lassen , bis ihnen das Blut in die Schuhe läuft , als daß ich Euch erschrecken wollte , Täubchen .Sie haben Mahadrö und dich gerettet !	3843	16	retcliff_sonora_sonora.tsv
ART	PDS		PDS	d		Ich habe Dich in meinem Brief um häufige und ausführliche Nachricht gebeten über alles , was im Hauptquartier vorgeht ; schreibe mir oft , aber ich beschwöre Dich , schreibe mir nie die Wahrheit , schreibe mir nichts von	dem	, was wirklich dort geschieht , nichts von dem , was ihr hofft und fürchtet – nur das eine , daß Du lebst und meiner gedenkst .	die Hände des abgehenden Kuriers legt .Ich habe Dich in meinem Brief um häufige und ausführliche Nachricht gebeten über alles , was im Hauptquartier vorgeht ; schreibe mir oft , aber ich beschwöre Dich , schreibe mir nie die Wahrheit , schreibe mir nichts von dem , was wirklich dort geschieht , nichts von dem , was ihr hofft und fürchtet – nur das eine , daß Du lebst und meiner gedenkst .« rief Pawjel , seinen Handjar weit	2491	39	meding_plewna_plewna.tsv
ART	PDS		PDS	d		Ich habe Dich in meinem Brief um häufige und ausführliche Nachricht gebeten über alles , was im Hauptquartier vorgeht ; schreibe mir oft , aber ich beschwöre Dich , schreibe mir nie die Wahrheit , schreibe mir nichts von dem , was wirklich dort geschieht , nichts von	dem	, was ihr hofft und fürchtet – nur das eine , daß Du lebst und meiner gedenkst .	die Hände des abgehenden Kuriers legt .Ich habe Dich in meinem Brief um häufige und ausführliche Nachricht gebeten über alles , was im Hauptquartier vorgeht ; schreibe mir oft , aber ich beschwöre Dich , schreibe mir nie die Wahrheit , schreibe mir nichts von dem , was wirklich dort geschieht , nichts von dem , was ihr hofft und fürchtet – nur das eine , daß Du lebst und meiner gedenkst .« rief Pawjel , seinen Handjar weit	2491	48	meding_plewna_plewna.tsv
ART	ART		ART	d		Bei	dem	Vorgebirg Vincent Steht ein Turm mit Marmorschwellen ; Eine helle Fackel brennt Dort , den Erdball zu erhellen .	uns stets zu hören sie verlanget .Bei dem Vorgebirg Vincent Steht ein Turm mit Marmorschwellen ; Eine helle Fackel brennt Dort , den Erdball zu erhellen .Kein Fischer am Gestad , Kein Licht	891	1	freiligr_band1-3_band1-3.tsv
ART	ART		ART	d		Chor : Nicht hilf	den	Menschen fürder über alles Maß , Des eignen Unheils unbekümmert ; denn ich bin Der festen Hoffnung , daß du einst noch , dieser Qual Entfesselt , nicht von mindrer Macht wirst sein denn Zeus .	dem Götterknecht , kein Wort gegönnt !Chor : Nicht hilf den Menschen fürder über alles Maß , Des eignen Unheils unbekümmert ; denn ich bin Der festen Hoffnung , daß du einst noch , dieser Qual Entfesselt , nicht von mindrer Macht wirst sein denn Zeus .Drum wirst du Hüter dieses öden Felsens	239	4	aischylo_promethe_promethe.tsv
ART	ART		ART	d		Bei dem Vorgebirg Vincent Steht ein Turm mit Marmorschwellen ; Eine helle Fackel brennt Dort ,	den	Erdball zu erhellen .	uns stets zu hören sie verlanget .Bei dem Vorgebirg Vincent Steht ein Turm mit Marmorschwellen ; Eine helle Fackel brennt Dort , den Erdball zu erhellen .Kein Fischer am Gestad , Kein Licht	891	16	freiligr_band1-3_band1-3.tsv
ART	ART		ART	d		Nichts desto weniger dürfen wir nicht vergessen , daß er nur eine	der	verschiedenen bevorzugten Formen der Primaten ist .	dem Menschen die Entstehung gegeben habe .Nichts desto weniger dürfen wir nicht vergessen , daß er nur eine der verschiedenen bevorzugten Formen der Primaten ist .Dagegen werden die menschenähnlichen Affen , nämlich	1801	12	strauss_glaube_glaube.tsv
ART	ART		ART	d		Nichts desto weniger dürfen wir nicht vergessen , daß er nur eine der verschiedenen bevorzugten Formen	der	Primaten ist .	dem Menschen die Entstehung gegeben habe .Nichts desto weniger dürfen wir nicht vergessen , daß er nur eine der verschiedenen bevorzugten Formen der Primaten ist .Dagegen werden die menschenähnlichen Affen , nämlich	1801	16	strauss_glaube_glaube.tsv
ART	ART		ART	d		Als er in die Nähe des Hotels » Preußische Krone « gekommen war , wurde die Tür aufgerissen , und	der	Kreisbaumeister Mulvert sprang als Anführer einiger Männer torkelnd auf die Straße .	auch etwas wie kalter Triumph enthielt .Als er in die Nähe des Hotels » Preußische Krone « gekommen war , wurde die Tür aufgerissen , und der Kreisbaumeister Mulvert sprang als Anführer einiger Männer torkelnd auf die Straße .Die Witwe des Umgekommenen saß wie entgeistert	1369	20	stehr_maechler_maechler.tsv
ART	ART		ART	d		Als er in die Nähe	des	Hotels » Preußische Krone « gekommen war , wurde die Tür aufgerissen , und der Kreisbaumeister Mulvert sprang als Anführer einiger Männer torkelnd auf die Straße .	auch etwas wie kalter Triumph enthielt .Als er in die Nähe des Hotels » Preußische Krone « gekommen war , wurde die Tür aufgerissen , und der Kreisbaumeister Mulvert sprang als Anführer einiger Männer torkelnd auf die Straße .Die Witwe des Umgekommenen saß wie entgeistert	1369	5	stehr_maechler_maechler.tsv
ART	ART		ART	d		Ich habe Dich in meinem Brief um häufige und ausführliche Nachricht gebeten über alles , was im Hauptquartier vorgeht ; schreibe mir oft , aber ich beschwöre Dich , schreibe mir nie	die	Wahrheit , schreibe mir nichts von dem , was wirklich dort geschieht , nichts von dem , was ihr hofft und fürchtet – nur das eine , daß Du lebst und meiner gedenkst .	die Hände des abgehenden Kuriers legt .Ich habe Dich in meinem Brief um häufige und ausführliche Nachricht gebeten über alles , was im Hauptquartier vorgeht ; schreibe mir oft , aber ich beschwöre Dich , schreibe mir nie die Wahrheit , schreibe mir nichts von dem , was wirklich dort geschieht , nichts von dem , was ihr hofft und fürchtet – nur das eine , daß Du lebst und meiner gedenkst .« rief Pawjel , seinen Handjar weit	2491	32	meding_plewna_plewna.tsv
ART	ART		ART	d		Du gehst , wie ein Geist ohne Leib , dir selber zum kalten und staunenden Grauen , Wie	die	Wolken , die unter dir sich fußlos an Abgründen halten .	Eisländer sich wie weiße indische Pfauen .Du gehst , wie ein Geist ohne Leib , dir selber zum kalten und staunenden Grauen , Wie die Wolken , die unter dir sich fußlos an Abgründen halten .Als ob im hohen , blauen Nichts	1188	18	dauthend_geflerde_geflerde.tsv
ART	ART		ART	d		– Aber ich würde doch lieber ein Dutzend Burschen zum Frühstück peitschen lassen , bis ihnen das Blut in	die	Schuhe läuft , als daß ich Euch erschrecken wollte , Täubchen .	ist ein heiliger Derwisch der Christen !– Aber ich würde doch lieber ein Dutzend Burschen zum Frühstück peitschen lassen , bis ihnen das Blut in die Schuhe läuft , als daß ich Euch erschrecken wollte , Täubchen .Sie haben Mahadrö und dich gerettet !	3843	19	retcliff_sonora_sonora.tsv
ART	ART		ART	d		Als er in	die	Nähe des Hotels » Preußische Krone « gekommen war , wurde die Tür aufgerissen , und der Kreisbaumeister Mulvert sprang als Anführer einiger Männer torkelnd auf die Straße .	auch etwas wie kalter Triumph enthielt .Als er in die Nähe des Hotels » Preußische Krone « gekommen war , wurde die Tür aufgerissen , und der Kreisbaumeister Mulvert sprang als Anführer einiger Männer torkelnd auf die Straße .Die Witwe des Umgekommenen saß wie entgeistert	1369	3	stehr_maechler_maechler.tsv
ART	ART		ART	d		Als er in die Nähe des Hotels » Preußische Krone « gekommen war , wurde	die	Tür aufgerissen , und der Kreisbaumeister Mulvert sprang als Anführer einiger Männer torkelnd auf die Straße .	auch etwas wie kalter Triumph enthielt .Als er in die Nähe des Hotels » Preußische Krone « gekommen war , wurde die Tür aufgerissen , und der Kreisbaumeister Mulvert sprang als Anführer einiger Männer torkelnd auf die Straße .Die Witwe des Umgekommenen saß wie entgeistert	1369	15	stehr_maechler_maechler.tsv
ART	ART		ART	eine		Bei dem Vorgebirg Vincent Steht ein Turm mit Marmorschwellen ;	Eine	helle Fackel brennt Dort , den Erdball zu erhellen .	uns stets zu hören sie verlanget .Bei dem Vorgebirg Vincent Steht ein Turm mit Marmorschwellen ; Eine helle Fackel brennt Dort , den Erdball zu erhellen .Kein Fischer am Gestad , Kein Licht	891	10	freiligr_band1-3_band1-3.tsv
ART	ART		ART	eine		Bei dem Vorgebirg Vincent Steht	ein	Turm mit Marmorschwellen ; Eine helle Fackel brennt Dort , den Erdball zu erhellen .	uns stets zu hören sie verlanget .Bei dem Vorgebirg Vincent Steht ein Turm mit Marmorschwellen ; Eine helle Fackel brennt Dort , den Erdball zu erhellen .Kein Fischer am Gestad , Kein Licht	891	5	freiligr_band1-3_band1-3.tsv
ART	ART		ART	eine		Du gehst , wie	ein	Geist ohne Leib , dir selber zum kalten und staunenden Grauen , Wie die Wolken , die unter dir sich fußlos an Abgründen halten .	Eisländer sich wie weiße indische Pfauen .Du gehst , wie ein Geist ohne Leib , dir selber zum kalten und staunenden Grauen , Wie die Wolken , die unter dir sich fußlos an Abgründen halten .Als ob im hohen , blauen Nichts	1188	4	dauthend_geflerde_geflerde.tsv
ART	ART		ART	eine		– Aber ich würde doch lieber	ein	Dutzend Burschen zum Frühstück peitschen lassen , bis ihnen das Blut in die Schuhe läuft , als daß ich Euch erschrecken wollte , Täubchen .	ist ein heiliger Derwisch der Christen !– Aber ich würde doch lieber ein Dutzend Burschen zum Frühstück peitschen lassen , bis ihnen das Blut in die Schuhe läuft , als daß ich Euch erschrecken wollte , Täubchen .Sie haben Mahadrö und dich gerettet !	3843	6	retcliff_sonora_sonora.tsv
ART	ART		PIS	eine		Ich habe Dich in meinem Brief um häufige und ausführliche Nachricht gebeten über alles , was im Hauptquartier vorgeht ; schreibe mir oft , aber ich beschwöre Dich , schreibe mir nie die Wahrheit , schreibe mir nichts von dem , was wirklich dort geschieht , nichts von dem , was ihr hofft und fürchtet – nur das	eine	, daß Du lebst und meiner gedenkst .	die Hände des abgehenden Kuriers legt .Ich habe Dich in meinem Brief um häufige und ausführliche Nachricht gebeten über alles , was im Hauptquartier vorgeht ; schreibe mir oft , aber ich beschwöre Dich , schreibe mir nie die Wahrheit , schreibe mir nichts von dem , was wirklich dort geschieht , nichts von dem , was ihr hofft und fürchtet – nur das eine , daß Du lebst und meiner gedenkst .« rief Pawjel , seinen Handjar weit	2491	58	meding_plewna_plewna.tsv
ART	ART		PIS	eine		Nichts desto weniger dürfen wir nicht vergessen , daß er nur	eine	der verschiedenen bevorzugten Formen der Primaten ist .	dem Menschen die Entstehung gegeben habe .Nichts desto weniger dürfen wir nicht vergessen , daß er nur eine der verschiedenen bevorzugten Formen der Primaten ist .Dagegen werden die menschenähnlichen Affen , nämlich	1801	11	strauss_glaube_glaube.tsv