DTA-Tag	TT-Tag	MM-TAg	Perceptron-Tag	Lemma	newtag	Prefix	Wort	Suffix	Sentence_neighborhood	sentence_index	index	filename
ADV	ADV		ADV	aber		Wehe	aber	, wenn die Gesellschaft , die sich da im Weinhaus zusammenfand , ihm nicht genehm war , wenn beschränkte , spießige Köpfe an der Tafelrunde ihn störten , dann muß er vollständig unerträglich gewesen sein , einen ganz fürchterlichen Gebrauch von seiner Kunst , Fratzen zu schneiden , Leute in Verlegenheit zu bringen , zu erschrecken , gemacht haben .	nichts tun als nippen und gähnen .Wehe aber , wenn die Gesellschaft , die sich da im Weinhaus zusammenfand , ihm nicht genehm war , wenn beschränkte , spießige Köpfe an der Tafelrunde ihn störten , dann muß er vollständig unerträglich gewesen sein , einen ganz fürchterlichen Gebrauch von seiner Kunst , Fratzen zu schneiden , Leute in Verlegenheit zu bringen , zu erschrecken , gemacht haben .Im Grunde ist natürlich immer Hoffmann selbst	976	1	benjamin_radio_radio.tsv
ADV	ADV		ADV	bald		Von dem einsamen Zimmer aus flogen seine Gedanken in entgegengesetzter Richtung ,	bald	nach den Sanddünen , zwischen denen das einsame Gut des Großvaters lag , bald nach dem lebhaften Edelhofe auf Fühnen , wo die neuen Freunde wohnten .	dem Theater eine wirklich reizende Erscheinung .Von dem einsamen Zimmer aus flogen seine Gedanken in entgegengesetzter Richtung , bald nach den Sanddünen , zwischen denen das einsame Gut des Großvaters lag , bald nach dem lebhaften Edelhofe auf Fühnen , wo die neuen Freunde wohnten .» Denkt euch nur , mitten in	644	12	andersen_oz_oz.tsv
ADV	ADV		ADV	bald		Von dem einsamen Zimmer aus flogen seine Gedanken in entgegengesetzter Richtung , bald nach den Sanddünen , zwischen denen das einsame Gut des Großvaters lag ,	bald	nach dem lebhaften Edelhofe auf Fühnen , wo die neuen Freunde wohnten .	dem Theater eine wirklich reizende Erscheinung .Von dem einsamen Zimmer aus flogen seine Gedanken in entgegengesetzter Richtung , bald nach den Sanddünen , zwischen denen das einsame Gut des Großvaters lag , bald nach dem lebhaften Edelhofe auf Fühnen , wo die neuen Freunde wohnten .» Denkt euch nur , mitten in	644	26	andersen_oz_oz.tsv
ADV	ADV		ADV	bloß		Wie kann sie's nur wagen , anständige Personen um ihren Besuch zu bitten , alles	bloß	, um ihnen etwas von ihrer Unschuld vorzuklagen ?	hat , ist kaum zu glauben .Wie kann sie's nur wagen , anständige Personen um ihren Besuch zu bitten , alles bloß , um ihnen etwas von ihrer Unschuld vorzuklagen ?.	1292	15	fontane_5schloes_5schloes.tsv
ADV	ADV		ADV	da		Wehe aber , wenn die Gesellschaft , die sich	da	im Weinhaus zusammenfand , ihm nicht genehm war , wenn beschränkte , spießige Köpfe an der Tafelrunde ihn störten , dann muß er vollständig unerträglich gewesen sein , einen ganz fürchterlichen Gebrauch von seiner Kunst , Fratzen zu schneiden , Leute in Verlegenheit zu bringen , zu erschrecken , gemacht haben .	nichts tun als nippen und gähnen .Wehe aber , wenn die Gesellschaft , die sich da im Weinhaus zusammenfand , ihm nicht genehm war , wenn beschränkte , spießige Köpfe an der Tafelrunde ihn störten , dann muß er vollständig unerträglich gewesen sein , einen ganz fürchterlichen Gebrauch von seiner Kunst , Fratzen zu schneiden , Leute in Verlegenheit zu bringen , zu erschrecken , gemacht haben .Im Grunde ist natürlich immer Hoffmann selbst	976	9	benjamin_radio_radio.tsv
ADV	ADV		ADV	dann			Dann	ging der Jäger hinaus und schnitt sehr süßes Zuckerrohr ab .	und steckte es in seine Schultertasche .Dann ging der Jäger hinaus und schnitt sehr süßes Zuckerrohr ab .Der Jäger kochte den Honig mit Wasser	4842	0	frobeniu_dekaschw_dekaschw.tsv
ADV	ADV		ADV	dann		Wehe aber , wenn die Gesellschaft , die sich da im Weinhaus zusammenfand , ihm nicht genehm war , wenn beschränkte , spießige Köpfe an der Tafelrunde ihn störten ,	dann	muß er vollständig unerträglich gewesen sein , einen ganz fürchterlichen Gebrauch von seiner Kunst , Fratzen zu schneiden , Leute in Verlegenheit zu bringen , zu erschrecken , gemacht haben .	nichts tun als nippen und gähnen .Wehe aber , wenn die Gesellschaft , die sich da im Weinhaus zusammenfand , ihm nicht genehm war , wenn beschränkte , spießige Köpfe an der Tafelrunde ihn störten , dann muß er vollständig unerträglich gewesen sein , einen ganz fürchterlichen Gebrauch von seiner Kunst , Fratzen zu schneiden , Leute in Verlegenheit zu bringen , zu erschrecken , gemacht haben .Im Grunde ist natürlich immer Hoffmann selbst	976	30	benjamin_radio_radio.tsv
ADV	ADV		ADV	denn		‹ » Kind , Würmle , « suchte sie die Kleine zu trösten , » was fallt dir	denn	ein – wer wird so weine , dummes Dingele – « Sie schöpfte Atem : » Jetz isch 's Kätterle lang tot ; ihr ältster Bub hat's Häusle und e Stub voller Kinder .	« bat die Frau .‹ » Kind , Würmle , « suchte sie die Kleine zu trösten , » was fallt dir denn ein – wer wird so weine , dummes Dingele – « Sie schöpfte Atem : » Jetz isch 's Kätterle lang tot ; ihr ältster Bub hat's Häusle und e Stub voller Kinder .Es ist nicht auszudenken , was aus	459	18	villinge_rebaechl_rebaechl.tsv
ADV	ADV		ADV	doch		– Aber ich würde	doch	lieber ein Dutzend Burschen zum Frühstück peitschen lassen , bis ihnen das Blut in die Schuhe läuft , als daß ich Euch erschrecken wollte , Täubchen .	ist ein heiliger Derwisch der Christen !– Aber ich würde doch lieber ein Dutzend Burschen zum Frühstück peitschen lassen , bis ihnen das Blut in die Schuhe läuft , als daß ich Euch erschrecken wollte , Täubchen .Sie haben Mahadrö und dich gerettet !	3843	4	retcliff_sonora_sonora.tsv
ADV	ADV		ADV	ganz		Wehe aber , wenn die Gesellschaft , die sich da im Weinhaus zusammenfand , ihm nicht genehm war , wenn beschränkte , spießige Köpfe an der Tafelrunde ihn störten , dann muß er vollständig unerträglich gewesen sein , einen	ganz	fürchterlichen Gebrauch von seiner Kunst , Fratzen zu schneiden , Leute in Verlegenheit zu bringen , zu erschrecken , gemacht haben .	nichts tun als nippen und gähnen .Wehe aber , wenn die Gesellschaft , die sich da im Weinhaus zusammenfand , ihm nicht genehm war , wenn beschränkte , spießige Köpfe an der Tafelrunde ihn störten , dann muß er vollständig unerträglich gewesen sein , einen ganz fürchterlichen Gebrauch von seiner Kunst , Fratzen zu schneiden , Leute in Verlegenheit zu bringen , zu erschrecken , gemacht haben .Im Grunde ist natürlich immer Hoffmann selbst	976	39	benjamin_radio_radio.tsv
ADV	ADV		ADV	hier		Und ihr kam die Frage , warum der Geliebte nicht	hier	sein könnte , in diesen Räumen , statt des anderen , für den ihr Herz längst erstorben war .	stieg ihr unwillkürlich Stassingks Bild auf .Und ihr kam die Frage , warum der Geliebte nicht hier sein könnte , in diesen Räumen , statt des anderen , für den ihr Herz längst erstorben war .Dann , Maria , wirft Du vielleicht	483	10	ompteda_maria_maria.tsv
ADV	ADV		ADV	lange		Beide , Selmann und Tobias , waren vor allen Dingen geschäftig , ihn loszumachen , und schnitten mit Messern so	lange	, bis alle Bande entzwei waren .	« – Tobias Knaut !Beide , Selmann und Tobias , waren vor allen Dingen geschäftig , ihn loszumachen , und schnitten mit Messern so lange , bis alle Bande entzwei waren .Ein so unbeweglicher lange anhaltender Blick mußte	4068	20	wezel_knaut_knaut.tsv
ADV	ADV		ADV	lieber		– Aber ich würde doch	lieber	ein Dutzend Burschen zum Frühstück peitschen lassen , bis ihnen das Blut in die Schuhe läuft , als daß ich Euch erschrecken wollte , Täubchen .	ist ein heiliger Derwisch der Christen !– Aber ich würde doch lieber ein Dutzend Burschen zum Frühstück peitschen lassen , bis ihnen das Blut in die Schuhe läuft , als daß ich Euch erschrecken wollte , Täubchen .Sie haben Mahadrö und dich gerettet !	3843	5	retcliff_sonora_sonora.tsv
ADV	ADV		ADV	längst		Und ihr kam die Frage , warum der Geliebte nicht hier sein könnte , in diesen Räumen , statt des anderen , für den ihr Herz	längst	erstorben war .	stieg ihr unwillkürlich Stassingks Bild auf .Und ihr kam die Frage , warum der Geliebte nicht hier sein könnte , in diesen Räumen , statt des anderen , für den ihr Herz längst erstorben war .Dann , Maria , wirft Du vielleicht	483	26	ompteda_maria_maria.tsv
ADV	PIS		ADV	mehr		Du bist es	mehr	vielleicht als ich .	Ein sechsfüßiger jambischer Vers .Du bist es mehr vielleicht als ich .V. 6 .	1449	3	plautus_menaechm_menaechm.tsv
ADV	ADV		ADV	nie		« Erstes Kapitel Womit meine Lebensgeschichte eingeleitet wird Meine vielfachen Bitten , mir die Angabe der Ursache zu einer an ihr vorher	nie	bemerkten Gemüthsaufregung nicht länger vorzuenthalten , fanden nach langem Widerstande Eingang in ihr Ohr , und ich erfuhr Folgendes : daß ihr Verlobter ihr am Morgen begegnet habe , als sie von einer Standesperson aus unserer Kundschaft auf dem Wege Behufs neuer Bestellungen angesprochen worden .	Kauflustiger , so leicht verirren konnte .« Erstes Kapitel Womit meine Lebensgeschichte eingeleitet wird Meine vielfachen Bitten , mir die Angabe der Ursache zu einer an ihr vorher nie bemerkten Gemüthsaufregung nicht länger vorzuenthalten , fanden nach langem Widerstande Eingang in ihr Ohr , und ich erfuhr Folgendes : daß ihr Verlobter ihr am Morgen begegnet habe , als sie von einer Standesperson aus unserer Kundschaft auf dem Wege Behufs neuer Bestellungen angesprochen worden .Bedeutende Summen an die verschiedenen Behörden gespendet	1055	22	kohn_jgilblas_jgilblas.tsv
ADV	ADV		ADV	nur		Nichts desto weniger dürfen wir nicht vergessen , daß er	nur	eine der verschiedenen bevorzugten Formen der Primaten ist .	dem Menschen die Entstehung gegeben habe .Nichts desto weniger dürfen wir nicht vergessen , daß er nur eine der verschiedenen bevorzugten Formen der Primaten ist .Dagegen werden die menschenähnlichen Affen , nämlich	1801	10	strauss_glaube_glaube.tsv
ADV	ADV		ADV	nur		Wie kann sie's	nur	wagen , anständige Personen um ihren Besuch zu bitten , alles bloß , um ihnen etwas von ihrer Unschuld vorzuklagen ?	hat , ist kaum zu glauben .Wie kann sie's nur wagen , anständige Personen um ihren Besuch zu bitten , alles bloß , um ihnen etwas von ihrer Unschuld vorzuklagen ?.	1292	3	fontane_5schloes_5schloes.tsv
ADV	ADV		ADV	sehr		Dann ging der Jäger hinaus und schnitt	sehr	süßes Zuckerrohr ab .	und steckte es in seine Schultertasche .Dann ging der Jäger hinaus und schnitt sehr süßes Zuckerrohr ab .Der Jäger kochte den Honig mit Wasser	4842	7	frobeniu_dekaschw_dekaschw.tsv
ADV	ADV		ADV	so		Beide , Selmann und Tobias , waren vor allen Dingen geschäftig , ihn loszumachen , und schnitten mit Messern	so	lange , bis alle Bande entzwei waren .	« – Tobias Knaut !Beide , Selmann und Tobias , waren vor allen Dingen geschäftig , ihn loszumachen , und schnitten mit Messern so lange , bis alle Bande entzwei waren .Ein so unbeweglicher lange anhaltender Blick mußte	4068	19	wezel_knaut_knaut.tsv
ADV	ADV		ADV	so		‹ » Kind , Würmle , « suchte sie die Kleine zu trösten , » was fallt dir denn ein – wer wird	so	weine , dummes Dingele – « Sie schöpfte Atem : » Jetz isch 's Kätterle lang tot ; ihr ältster Bub hat's Häusle und e Stub voller Kinder .	« bat die Frau .‹ » Kind , Würmle , « suchte sie die Kleine zu trösten , » was fallt dir denn ein – wer wird so weine , dummes Dingele – « Sie schöpfte Atem : » Jetz isch 's Kätterle lang tot ; ihr ältster Bub hat's Häusle und e Stub voller Kinder .Es ist nicht auszudenken , was aus	459	23	villinge_rebaechl_rebaechl.tsv
ADV	ADV		ADV	vielleicht		Du bist es mehr	vielleicht	als ich .	Ein sechsfüßiger jambischer Vers .Du bist es mehr vielleicht als ich .V. 6 .	1449	4	plautus_menaechm_menaechm.tsv
ADV	ADV		ADV	vorher		« Erstes Kapitel Womit meine Lebensgeschichte eingeleitet wird Meine vielfachen Bitten , mir die Angabe der Ursache zu einer an ihr	vorher	nie bemerkten Gemüthsaufregung nicht länger vorzuenthalten , fanden nach langem Widerstande Eingang in ihr Ohr , und ich erfuhr Folgendes : daß ihr Verlobter ihr am Morgen begegnet habe , als sie von einer Standesperson aus unserer Kundschaft auf dem Wege Behufs neuer Bestellungen angesprochen worden .	Kauflustiger , so leicht verirren konnte .« Erstes Kapitel Womit meine Lebensgeschichte eingeleitet wird Meine vielfachen Bitten , mir die Angabe der Ursache zu einer an ihr vorher nie bemerkten Gemüthsaufregung nicht länger vorzuenthalten , fanden nach langem Widerstande Eingang in ihr Ohr , und ich erfuhr Folgendes : daß ihr Verlobter ihr am Morgen begegnet habe , als sie von einer Standesperson aus unserer Kundschaft auf dem Wege Behufs neuer Bestellungen angesprochen worden .Bedeutende Summen an die verschiedenen Behörden gespendet	1055	21	kohn_jgilblas_jgilblas.tsv
ADV	PTKZU		ADV	zu		Wehe aber , wenn die Gesellschaft , die sich da im Weinhaus zusammenfand , ihm nicht genehm war , wenn beschränkte , spießige Köpfe an der Tafelrunde ihn störten , dann muß er vollständig unerträglich gewesen sein , einen ganz fürchterlichen Gebrauch von seiner Kunst , Fratzen zu schneiden , Leute in Verlegenheit zu bringen ,	zu	erschrecken , gemacht haben .	nichts tun als nippen und gähnen .Wehe aber , wenn die Gesellschaft , die sich da im Weinhaus zusammenfand , ihm nicht genehm war , wenn beschränkte , spießige Köpfe an der Tafelrunde ihn störten , dann muß er vollständig unerträglich gewesen sein , einen ganz fürchterlichen Gebrauch von seiner Kunst , Fratzen zu schneiden , Leute in Verlegenheit zu bringen , zu erschrecken , gemacht haben .Im Grunde ist natürlich immer Hoffmann selbst	976	56	benjamin_radio_radio.tsv
ADV	ADV		ADV	zusammen		« Ein Schauer überlief Espel ; er schob alles	zusammen	mit einer hastigen Bewegung heftig von sich in die dunkelste Ecke seines Schreibtisches unter das darüber angebrachte Büchergestell .	Wer von euch führt mich hin ?« Ein Schauer überlief Espel ; er schob alles zusammen mit einer hastigen Bewegung heftig von sich in die dunkelste Ecke seines Schreibtisches unter das darüber angebrachte Büchergestell .Wo wohnt er ?	131	9	herbert_rufnacht_rufnacht.tsv