DTA-Tag	TT-Tag	MM-TAg	Perceptron-Tag	Lemma	newtag	Prefix	Wort	Suffix	Sentence_neighborhood	sentence_index	index	filename
ITJ	NN		ITJ	ach			Ach	!	» O Gott !Ach !Die Haare stunden ihm zu Berge ,	2009	0	97160-Schnabel__Johann_Gottfried.tsv
ITJ	NE		ITJ	ach		Redet man von Dingen , die grade nicht ihr persönliches Interesse tangiren , so gerathen sie in Geistesabwesenheit und pfeifen »	Ach	du lieber Augustin , alles ist weg .	an einer Art Auszehrung selbstverzehrenden Größenwahns .Redet man von Dingen , die grade nicht ihr persönliches Interesse tangiren , so gerathen sie in Geistesabwesenheit und pfeifen » Ach du lieber Augustin , alles ist weg .Diese Kerle würden ihren Vater todtschlagen und	15469	21	13731-Bleibtreu__Karl.tsv
ITJ	NN		ITJ	ach			Ach	, es ist sehr traurig , wie ungeschickt uns unsre Erziehung macht ; unsre Seele wird vom bürgerlichen Leben , wie von einem Tanzmeister , in eine wunderbare steife Konsequenz und eine auswendig gelernte Mannigfaltigkeit geschraubt , die , sobald wir in die Natur treten , zu höchstverderblicher Ungeschmeidigkeit und Einseitigkeit führen .	von Flametta « , sagte ich .Ach , es ist sehr traurig , wie ungeschickt uns unsre Erziehung macht ; unsre Seele wird vom bürgerlichen Leben , wie von einem Tanzmeister , in eine wunderbare steife Konsequenz und eine auswendig gelernte Mannigfaltigkeit geschraubt , die , sobald wir in die Natur treten , zu höchstverderblicher Ungeschmeidigkeit und Einseitigkeit führen .Sie kam von einer Reise aus Italien	3016	0	14636-Brentano__Clemens.tsv
ITJ	NE		NN	ach		« Die Lady konnte die Ankunft ihres geliebten Töchterchens kaum erwarten , und sagte : »	Ach	das engelgute Kind !	von denen der Saal erfüllt war .« Die Lady konnte die Ankunft ihres geliebten Töchterchens kaum erwarten , und sagte : » Ach das engelgute Kind !Jetzt aber trat eine Gesellschaft Italiener herein	230	16	108016-Waiblinger__Wilhelm.tsv
ITJ	NE		NN	ach		–	Ach	, der Herr Referendar !	dem Publikum zu viel gewesen war .– Ach , der Herr Referendar !Das sei nun freilich zuviel gesagt ,	2046	1	11850-Bierbaum__Otto_Julius.tsv
ITJ	NE		NN	ach		–	Ach	, Baumann , ich wollte , ich wäre todt !	weiß , wo er übermorgen ist .– Ach , Baumann , ich wollte , ich wäre todt !Aber an Morgen denkt das junge Volk	2786	1	99023-Spielhagen__Friedrich.tsv
ITJ	NN		NN	ach		Nach glücklicher Verrichtung ihres Amts redete mitleidend das Weibchen : »	Ach	, liebe Frau , nun jammert mich , daß Ihr hierbleiben müßt bis an den Jüngsten Tag , nehmt Euch wohl in acht ; mein Mann wird Euch jetzt eine ganze Mulde voll Dukaten vorsetzen , nehmt nicht mehr , als Euch auch andre Leute zu geben pflegen für Eure Mühwaltung .	, worin ein niedliches Weiblein lag .Nach glücklicher Verrichtung ihres Amts redete mitleidend das Weibchen : » Ach , liebe Frau , nun jammert mich , daß Ihr hierbleiben müßt bis an den Jüngsten Tag , nehmt Euch wohl in acht ; mein Mann wird Euch jetzt eine ganze Mulde voll Dukaten vorsetzen , nehmt nicht mehr , als Euch auch andre Leute zu geben pflegen für Eure Mühwaltung .Sie gedachte an Gott , der würde	16	11	51113-Grimm__Jacob_und_Wilhelm.tsv
ITJ	NE		NN	ach		»	Ach	, sind die Treppen steil !	rief der Famulus begeistert .» Ach , sind die Treppen steil !ganz vorzüglich !	172	1	107554-Verne__Jules.tsv
ITJ	NE		NN	ach		– Sie haben Mitleid mit mir – Sie kennen meine Lage – Wenn Sie meine Empfindungen theilen , so entziehen Sie mir nicht den Trost « – – »	Ach	mein englisches Gustelchen !	– Ich vermuthe beynahe .– Sie haben Mitleid mit mir – Sie kennen meine Lage – Wenn Sie meine Empfindungen theilen , so entziehen Sie mir nicht den Trost « – – » Ach mein englisches Gustelchen !– Ob er die Fräulein am Tanzen	151	29	25804-Fischer__Christian_August.tsv
ITJ	NE		NE	ha		« »	Ha	!	gilt , muß man alles wagen .« » Ha !« » Alter Mann !	2189	2	58300-Hauff__Wilhelm.tsv
ITJ	NE		NE	ha			Ha	ha ha ha – – auch eine Art , Vervollkommnungen zu träumen !	spüre ich das ganze Liebes-Leid Isolden's !Ha ha ha ha – – auch eine Art , Vervollkommnungen zu träumen !So reinigst Du Dich von Dir selber	11	0	1025-Altenberg__Peter.tsv
ITJ	VVFIN		NE	ha		Ha	ha	ha ha – – auch eine Art , Vervollkommnungen zu träumen !	spüre ich das ganze Liebes-Leid Isolden's !Ha ha ha ha – – auch eine Art , Vervollkommnungen zu träumen !So reinigst Du Dich von Dir selber	11	1	1025-Altenberg__Peter.tsv
ITJ	XY		NE	ha		Ha ha	ha	ha – – auch eine Art , Vervollkommnungen zu träumen !	spüre ich das ganze Liebes-Leid Isolden's !Ha ha ha ha – – auch eine Art , Vervollkommnungen zu träumen !So reinigst Du Dich von Dir selber	11	2	1025-Altenberg__Peter.tsv
ITJ	ADJA		NE	ha		Ha ha ha	ha	– – auch eine Art , Vervollkommnungen zu träumen !	spüre ich das ganze Liebes-Leid Isolden's !Ha ha ha ha – – auch eine Art , Vervollkommnungen zu träumen !So reinigst Du Dich von Dir selber	11	3	1025-Altenberg__Peter.tsv
ITJ	NE		VVFIN	he		»	He	, Ignaschka !	er liebte die Bequemlichkeit und Freiheit .» He , Ignaschka !Die Aussicht auf den Fluß ... Sie	12460	1	48338-Gon_arov__Ivan_Aleksandrovi_.tsv
ITJ	NE		VVFIN	he		« »	He	nun so dann « , sagte Änneli , » geschehe nichts Böseres , die Ruhe ist mir auch zu gönnen , daran einmal stoße dich nicht .	es Wetter gibt zwischen den Menschen .« » He nun so dann « , sagte Änneli , » geschehe nichts Böseres , die Ruhe ist mir auch zu gönnen , daran einmal stoße dich nicht .« Eines Tages wars , als ob	1567	2	48351-Gotthelf__Jeremias.tsv
ITJ	NE		NE	ho		»	Hoo	, hoo !	sie in Gedanken zu fest gehalten .» Hoo , hoo !– Also auch dieses Zeugnis seines Schaffens	9292	1	85692-Polenz__Wilhelm_von.tsv
ITJ	XY		NE	ho		» Hoo ,	hoo	!	sie in Gedanken zu fest gehalten .» Hoo , hoo !– Also auch dieses Zeugnis seines Schaffens	9292	3	85692-Polenz__Wilhelm_von.tsv
ITJ	ADV		ITJ	ja		Klaproth betrachtet sie als sarmatische Meder , nicht nur auf Grund dieses Namens , der ihn an Iran erinnert , sondern auch wegen ihrer Sprache , » welche besser als historische Documente ,	ja	, sogar zweifellos beweist , daß jene mit den Medern und Persern von einerlei Abkunft sind « .	zum Stamme der indogermanischen Völker gehören .Klaproth betrachtet sie als sarmatische Meder , nicht nur auf Grund dieses Namens , der ihn an Iran erinnert , sondern auch wegen ihrer Sprache , » welche besser als historische Documente , ja , sogar zweifellos beweist , daß jene mit den Medern und Persern von einerlei Abkunft sind « .Sie könnten sich recht wohl befinden ,	2791	33	107559-Verne__Jules.tsv
ITJ	NE		NE	na		« »	Na	fahr i eini ... « » Was willst d' sag 'n ?	wenn's aa scho lang her is .« » Na fahr i eini ... « » Was willst d' sag 'n ?» Sagst ihr an schön Gruaß von	3392	2	104499-Thoma__Ludwig.tsv
ITJ	NE		NE	na		So bleiben nur zwei Wege : eine offene Depesche an seinen Vater – « »	Na	, sei gut , ich war ja nicht lange droben !	die Summe geht über unsere Kräfte .So bleiben nur zwei Wege : eine offene Depesche an seinen Vater – « » Na , sei gut , ich war ja nicht lange droben !Der arme Junge ist in böser Klemme	7132	15	27054-Ganghofer__Ludwig.tsv
ITJ	FM		ITJ	na		– Im Schwarzwalde ändert sich der Gruß je nach dem öffentlichen Thun : gehst du den Berg hinab , so sagt dir der Begegnende : » Weant ( wollt ) Ihr au do '	na	?	als ob er ein Mensch wäre .– Im Schwarzwalde ändert sich der Gruß je nach dem öffentlichen Thun : gehst du den Berg hinab , so sagt dir der Begegnende : » Weant ( wollt ) Ihr au do ' na ?Man irrt sich gar gewaltig , wenn	219	34	5236-Auerbach__Berthold.tsv
ITJ	NE		ADJD	oh			Oh	, er wird noch da sein , « fuhr er fort , indem er auf eine scheußliche grüngestrichene und mit vergoldeten Leisten versehene Holzuhr blickte .	und lassen Sie sie morgen wiederkommen .Oh , er wird noch da sein , « fuhr er fort , indem er auf eine scheußliche grüngestrichene und mit vergoldeten Leisten versehene Holzuhr blickte .» Das ist wohl genug .	6362	0	6204-Balzac__Honor__de.tsv
ITJ	NE		NN	oh			Oh	!	nahmen sie betrübt von mir Abschied .Oh !Als ich hierher reiste , begleiteten mich	23	0	59693-Heine__Heinrich.tsv
ITJ	NE		NE	schwapp			Schwapp	, sind wir auf der andern Seite .	bißchen mehr , ein bißchen weniger .Schwapp , sind wir auf der andern Seite .Aber schlechte Musikanten .	3206	0	26861-Fontane__Theodor.tsv