DTA-Tag	TT-Tag	MM-TAg	Perceptron-Tag	Lemma	newtag	Prefix	Wort	Suffix	Sentence_neighborhood	sentence_index	index	filename
KOUS	NN		KOUS	als			Als	nun jhr Führer das Hörnlein hörete / rieff er den seinen zu : Auff / auff / ihr Brüder auff !	schier ein unwiederbringliches übel verursachet hätte .Als nun jhr Führer das Hörnlein hörete / rieff er den seinen zu : Auff / auff / ihr Brüder auff !Nun hatte gleichwol Markus ursach gnug /	2590	0	15210-Buchholtz__Andreas_Heinrich.tsv
KOUS	KOUS		KOUS	als		«	Als	sie darauf bejahend nickte , fragte er höflich : » Sind Sie schon lange in Jalta ?	besucht , « dachte er sich .« Als sie darauf bejahend nickte , fragte er höflich : » Sind Sie schon lange in Jalta ?Man wußte nicht , wohin man sich	101	1	17686-_echov__Anton_Pavlovi_.tsv
KOUS	KOUS		KOUS	als		Warum war aber meine Seele nicht von ebenso tiefen Gefühlen ergriffen ,	als	ich jüngst zum ersten Male über den entsetzlichen Platz ging , wo Ludwig XVI. gestorben ?	mals mit ihren heitersten Farben geschmückt .Warum war aber meine Seele nicht von ebenso tiefen Gefühlen ergriffen , als ich jüngst zum ersten Male über den entsetzlichen Platz ging , wo Ludwig XVI. gestorben ?Da liegt sie , die Herrlichkeit des	63	12	59696-Heine__Heinrich.tsv
KOUS	KOUS		KOUS	als		Diese Frau « , fuhr der Pursche im Reden fort , » heißt man nur die glückselige Margaretha , sie ist aber seit etwa einem Jahre her zur Wittbe worden , weil ihr Mann ,	als	er von einem gewissen Herrn von Padua aus mit Briefen weggeschickt , unterweges von einem Banditen dergestalt tödlich verwundet worden , daß er etliche Tage hernach an den empfangenen Blessuren sterben müssen .	ohnstreitig die vornehmste zu nennen ist .Diese Frau « , fuhr der Pursche im Reden fort , » heißt man nur die glückselige Margaretha , sie ist aber seit etwa einem Jahre her zur Wittbe worden , weil ihr Mann , als er von einem gewissen Herrn von Padua aus mit Briefen weggeschickt , unterweges von einem Banditen dergestalt tödlich verwundet worden , daß er etliche Tage hernach an den empfangenen Blessuren sterben müssen .« » Ach nein !	3746	35	97160-Schnabel__Johann_Gottfried.tsv
KOUS	ADV		KOUS	da		Lange , nachdem sie Frau geworden , hatte sie nicht verstanden , woher ihr gegen den Mann , den sie frei gewählt hatte , wie er sie , oftmals dieses grollende Gefühl kam , dieser sprungbereite Haß , der sich in tausend kleinen Szenen entlud , –	da	es zur großen Aussprache zwischen ihnen niemals kam , – der hundert eingebildete und konstruierte Vorwände heftiger Entladungen er fand , – bis der wahre Grund ihrer geheimen Feindschaft , ihrem bohrenden Spähen , ihrer wachgehetzten Weibheit klargeworden war : die Versprechungen ihres Körpers schienen für diesen Mann erfüllt .	, welche Juden untereinander oft abstößt .Lange , nachdem sie Frau geworden , hatte sie nicht verstanden , woher ihr gegen den Mann , den sie frei gewählt hatte , wie er sie , oftmals dieses grollende Gefühl kam , dieser sprungbereite Haß , der sich in tausend kleinen Szenen entlud , – da es zur großen Aussprache zwischen ihnen niemals kam , – der hundert eingebildete und konstruierte Vorwände heftiger Entladungen er fand , – bis der wahre Grund ihrer geheimen Feindschaft , ihrem bohrenden Spähen , ihrer wachgehetzten Weibheit klargeworden war : die Versprechungen ihres Körpers schienen für diesen Mann erfüllt .Und Frau Edda fuhr dahin , Einkäufe	5360	47	79543-Meisel_Hess__Grete.tsv
KOUS	PROAV		KOUS	damit		82 Dise bekanten / daß sie /	damit	sie dem Großhofmeister Mumold das leben fristeten / des Königs Sohn vmb das leben gebracht hettē .	Jedoch ist diß nichts newes .82 Dise bekanten / daß sie / damit sie dem Großhofmeister Mumold das leben fristeten / des Königs Sohn vmb das leben gebracht hettē .97 Vnd es schemt es hab Plato	2435	7	14106-Bodin__Jean.tsv
KOUS	KOUS		KOUS	daß		Die erfreuliche Tatsache ,	daß	die von Euer Hochgeboren ins Leben gerufene und der unermüdlichen Leitung Euer Hochgeboren unterstehende Gesellschaft der österreichischen Friedensfreunde bereits auf eine zehnjährige Wirksamkeit zurückblicken kann , bewegt mich dazu , Euer Hochgeboren aus diesem Anlaß auf das wärmste zu begrüßen .	Jude der Mörder des kleinen Mannes !Die erfreuliche Tatsache , daß die von Euer Hochgeboren ins Leben gerufene und der unermüdlichen Leitung Euer Hochgeboren unterstehende Gesellschaft der österreichischen Friedensfreunde bereits auf eine zehnjährige Wirksamkeit zurückblicken kann , bewegt mich dazu , Euer Hochgeboren aus diesem Anlaß auf das wärmste zu begrüßen .Auch da waren die Erfolge nur gering	7284	4	102347-Suttner__Bertha_von.tsv
KOUS	KOUS		KOUS	daß		Bald nach meiner Zurückkunft nach Milet gerieth ich auf den Einfall , das berühmte allegorische Mährchen vom Prodikus , den Hercules auf dem Scheidewege , in zwei Seitenstücken zu malen ; so	daß	Lais in dem einen die Tugend , in dem andern die Wollust vorstellt , und ( wie du bereits errathen hast ) der junge Göttersohn im einen der Erstern , im andern ihrer reizenden Gegnerin die Hand reicht .	er nicht sehr lange ausdauern könnte .Bald nach meiner Zurückkunft nach Milet gerieth ich auf den Einfall , das berühmte allegorische Mährchen vom Prodikus , den Hercules auf dem Scheidewege , in zwei Seitenstücken zu malen ; so daß Lais in dem einen die Tugend , in dem andern die Wollust vorstellt , und ( wie du bereits errathen hast ) der junge Göttersohn im einen der Erstern , im andern ihrer reizenden Gegnerin die Hand reicht .Du weißt , in welchem Grade die	6108	32	110273-Wieland__Christoph_Martin.tsv
KOUS	KOUS		KOUS	daß		Früher sollte er auch verheirathet gewesen sein und sollte Familie gehabt haben , aber man hatte nie Kin der in dem alten Hause gesehen und schloß daraus ,	daß	sie gleich der Mutter gestorben sein müßten .	er das alte Haus geerbt hatte .Früher sollte er auch verheirathet gewesen sein und sollte Familie gehabt haben , aber man hatte nie Kin der in dem alten Hause gesehen und schloß daraus , daß sie gleich der Mutter gestorben sein müßten .Dieses Gebäude war so lange ein Gegenstand	2923	28	61564-Hesekiel__George.tsv
KOUS	KOUS		KOUS	daß		Wo steckt denn die wieder ,	daß	s' net hergeht , bals a Arbat gibt ?	» Ja kreizsakra !Wo steckt denn die wieder , daß s' net hergeht , bals a Arbat gibt ?Da fällt ihr die Hanni ein .	4735	6	18352-Christ__Lena.tsv
KOUS	KOUS		KOUS	daß		Diese Frau « , fuhr der Pursche im Reden fort , » heißt man nur die glückselige Margaretha , sie ist aber seit etwa einem Jahre her zur Wittbe worden , weil ihr Mann , als er von einem gewissen Herrn von Padua aus mit Briefen weggeschickt , unterweges von einem Banditen dergestalt tödlich verwundet worden ,	daß	er etliche Tage hernach an den empfangenen Blessuren sterben müssen .	ohnstreitig die vornehmste zu nennen ist .Diese Frau « , fuhr der Pursche im Reden fort , » heißt man nur die glückselige Margaretha , sie ist aber seit etwa einem Jahre her zur Wittbe worden , weil ihr Mann , als er von einem gewissen Herrn von Padua aus mit Briefen weggeschickt , unterweges von einem Banditen dergestalt tödlich verwundet worden , daß er etliche Tage hernach an den empfangenen Blessuren sterben müssen .« » Ach nein !	3746	57	97160-Schnabel__Johann_Gottfried.tsv
KOUS	KOUS		KOUS	daß		105 Dann er macht die gleich in einer guldenen Ketten solcher seltzame weiß von weitem herauß gehen /	daß	sie in sein Hand / wie sie ein ansehen hatte / sich erstreckten / vnn gleichwol die Kett hernachgehends vberall gantz befunden ward .	/ vnnd noch in Leben ist .105 Dann er macht die gleich in einer guldenen Ketten solcher seltzame weiß von weitem herauß gehen / daß sie in sein Hand / wie sie ein ansehen hatte / sich erstreckten / vnn gleichwol die Kett hernachgehends vberall gantz befunden ward .Nach fůnff Stunden / als sie wider	2072	18	14106-Bodin__Jean.tsv
KOUS	KOUS		KOUS	daß		Aber so schnell war dieser Schreck , so groß die Furcht Annas vor ihrem Vater , und so furchtbar sein Anblick ,	daß	sie zu schwanken anfing , und hätte der General sie nicht unterstützt , sie wäre in die Kniee gesunken .	Beschauenden eine dumpfe , wohlbekannte Stimme .Aber so schnell war dieser Schreck , so groß die Furcht Annas vor ihrem Vater , und so furchtbar sein Anblick , daß sie zu schwanken anfing , und hätte der General sie nicht unterstützt , sie wäre in die Kniee gesunken .» Anna !	719	22	58305-Hauff__Wilhelm.tsv
KOUS	KOUS		KOUS	daß		Mit dem Wirt hatte er jedoch abgemacht gehabt ,	daß	er , wenn es die Königstochter sei , ein Zeichen gebe ; wenn sie es aber nicht sei , kein Zeichen mache .	und schickte sie hinein zum Soldaten .Mit dem Wirt hatte er jedoch abgemacht gehabt , daß er , wenn es die Königstochter sei , ein Zeichen gebe ; wenn sie es aber nicht sei , kein Zeichen mache .Er aber antwortete : » Nein ,	45	9	98987-Spiegel__Karl.tsv
KOUS	KOUS		KOUS	nachdem		Lange ,	nachdem	sie Frau geworden , hatte sie nicht verstanden , woher ihr gegen den Mann , den sie frei gewählt hatte , wie er sie , oftmals dieses grollende Gefühl kam , dieser sprungbereite Haß , der sich in tausend kleinen Szenen entlud , – da es zur großen Aussprache zwischen ihnen niemals kam , – der hundert eingebildete und konstruierte Vorwände heftiger Entladungen er fand , – bis der wahre Grund ihrer geheimen Feindschaft , ihrem bohrenden Spähen , ihrer wachgehetzten Weibheit klargeworden war : die Versprechungen ihres Körpers schienen für diesen Mann erfüllt .	, welche Juden untereinander oft abstößt .Lange , nachdem sie Frau geworden , hatte sie nicht verstanden , woher ihr gegen den Mann , den sie frei gewählt hatte , wie er sie , oftmals dieses grollende Gefühl kam , dieser sprungbereite Haß , der sich in tausend kleinen Szenen entlud , – da es zur großen Aussprache zwischen ihnen niemals kam , – der hundert eingebildete und konstruierte Vorwände heftiger Entladungen er fand , – bis der wahre Grund ihrer geheimen Feindschaft , ihrem bohrenden Spähen , ihrer wachgehetzten Weibheit klargeworden war : die Versprechungen ihres Körpers schienen für diesen Mann erfüllt .Und Frau Edda fuhr dahin , Einkäufe	5360	2	79543-Meisel_Hess__Grete.tsv
KOUS	KOUS		KOUS	ob		Nicht als	ob	wir des frommen Glaubens lebten , auch nur eine von Ihnen für uns gewinnen zu können .	machten wir unserem Arzt die Abschiedsvisite .Nicht als ob wir des frommen Glaubens lebten , auch nur eine von Ihnen für uns gewinnen zu können .Aus den vertiertesten Gesichtern brach ein Schein	7934	2	14315-Braun__Lily.tsv
KOUS	KOUS		KOUS	ob		Wer weis denn ,	ob	sie je mir wieder leuchten werden , denn meine Reise ist weit , und mancherlei Gefahren werden Unheil drohend mir entgegen treten .	, die so lange mir leuchteten .Wer weis denn , ob sie je mir wieder leuchten werden , denn meine Reise ist weit , und mancherlei Gefahren werden Unheil drohend mir entgegen treten .So viele wünschen sich einen schnellen Tod	4069	4	97246-Schopenhauer__Johanna.tsv
KOUS	KOUS		KOUS	ob		Dann hielt er inne und ließ seiner Wirthin damit zu der Frage Zeit ,	ob	Vittoria's Eltern noch am Leben wären und wo und wie sein Vater sie kennen gelernt habe .	keinen besseren Freund , als sie !Dann hielt er inne und ließ seiner Wirthin damit zu der Frage Zeit , ob Vittoria's Eltern noch am Leben wären und wo und wie sein Vater sie kennen gelernt habe .Sie sehnte sich , seinen Blick zu	3360	14	73679-Lewald__Fanny.tsv
KOUS	KOUS		KOUS	weil		Es waren aber sechs Dutzet altfränkische silberne Tischbecher , ein groß gulden Pokal , etliche Duplet , vier silberne und ein guldenes Salzfaß , eine altfränkische guldne Kette , unterschiedliche Diamanten , Rubinen , Saphiren und Schmaragden , beides in Ringen und andern Kleinodien gefasset ; item ein ganz Lädlein voll großer Perlen , aber alle verdorben oder abgestanden , und dann in einem versporten ledernen Sack achtzig von den ältisten Joachimstalern aus feinem Silber , sodann 893 Goldstücke mit dem französischen Wappen und einem Adler , welche Münze niemand kennen wollte ,	weil	man , wie sie sagten , die Schrift nicht lesen konnte .	erst durch den Schuß geöffnet hatte .Es waren aber sechs Dutzet altfränkische silberne Tischbecher , ein groß gulden Pokal , etliche Duplet , vier silberne und ein guldenes Salzfaß , eine altfränkische guldne Kette , unterschiedliche Diamanten , Rubinen , Saphiren und Schmaragden , beides in Ringen und andern Kleinodien gefasset ; item ein ganz Lädlein voll großer Perlen , aber alle verdorben oder abgestanden , und dann in einem versporten ledernen Sack achtzig von den ältisten Joachimstalern aus feinem Silber , sodann 893 Goldstücke mit dem französischen Wappen und einem Adler , welche Münze niemand kennen wollte , weil man , wie sie sagten , die Schrift nicht lesen konnte .Als der Schuß geschehen , wieherte mein	4148	93	50637-Grimmelshausen__Hans_Jakob_Christoffel_von.tsv
KOUS	KOUS		KOUS	weil		Diese Frau « , fuhr der Pursche im Reden fort , » heißt man nur die glückselige Margaretha , sie ist aber seit etwa einem Jahre her zur Wittbe worden ,	weil	ihr Mann , als er von einem gewissen Herrn von Padua aus mit Briefen weggeschickt , unterweges von einem Banditen dergestalt tödlich verwundet worden , daß er etliche Tage hernach an den empfangenen Blessuren sterben müssen .	ohnstreitig die vornehmste zu nennen ist .Diese Frau « , fuhr der Pursche im Reden fort , » heißt man nur die glückselige Margaretha , sie ist aber seit etwa einem Jahre her zur Wittbe worden , weil ihr Mann , als er von einem gewissen Herrn von Padua aus mit Briefen weggeschickt , unterweges von einem Banditen dergestalt tödlich verwundet worden , daß er etliche Tage hernach an den empfangenen Blessuren sterben müssen .« » Ach nein !	3746	31	97160-Schnabel__Johann_Gottfried.tsv
KOUS	KOUS		KOUS	weil		Der Kerl fieng vor Schmertzen überlaut an zu schreyen , und ich bekam mittlerweile von einem andern , einen geringen Streiff-Hieb über den Kopff ,	weil	mir der Hut abgefallen war .	ihm denselben ohne besondere Mühe entzwey .Der Kerl fieng vor Schmertzen überlaut an zu schreyen , und ich bekam mittlerweile von einem andern , einen geringen Streiff-Hieb über den Kopff , weil mir der Hut abgefallen war .Jedoch mit einbrechender Nacht wurden wir aufs	6533	25	97159-Schnabel__Johann_Gottfried.tsv
KOUS	KOUS		KOUS	wenn		« »	Wenn	jemand von Schloß Hubertus kommt , um meine Geräte zu holen , « sagte er , » ich habe droben alles bereitgestellt .	winkte er den Diener zu sich .« » Wenn jemand von Schloß Hubertus kommt , um meine Geräte zu holen , « sagte er , » ich habe droben alles bereitgestellt .An der Kruckenstube wurde die Tür aufgerissen	10999	2	27054-Ganghofer__Ludwig.tsv
KOUS	KOUS		KOUS	wenn		Mit dem Wirt hatte er jedoch abgemacht gehabt , daß er ,	wenn	es die Königstochter sei , ein Zeichen gebe ; wenn sie es aber nicht sei , kein Zeichen mache .	und schickte sie hinein zum Soldaten .Mit dem Wirt hatte er jedoch abgemacht gehabt , daß er , wenn es die Königstochter sei , ein Zeichen gebe ; wenn sie es aber nicht sei , kein Zeichen mache .Er aber antwortete : » Nein ,	45	12	98987-Spiegel__Karl.tsv
KOUS	KOUS		KOUS	wenn		Mit dem Wirt hatte er jedoch abgemacht gehabt , daß er , wenn es die Königstochter sei , ein Zeichen gebe ;	wenn	sie es aber nicht sei , kein Zeichen mache .	und schickte sie hinein zum Soldaten .Mit dem Wirt hatte er jedoch abgemacht gehabt , daß er , wenn es die Königstochter sei , ein Zeichen gebe ; wenn sie es aber nicht sei , kein Zeichen mache .Er aber antwortete : » Nein ,	45	22	98987-Spiegel__Karl.tsv
KOUS	KOUS		KOUS	während			Während	der Abwesenheit Bardiks hatte ein Haufen Männer , welche sich die Dunkelheit zu nutze machten , Alles binnen wenig Stunden zerstört .	einen Hammer und zertrümmerte die Sparbüchse .Während der Abwesenheit Bardiks hatte ein Haufen Männer , welche sich die Dunkelheit zu nutze machten , Alles binnen wenig Stunden zerstört .Jedenfalls wollte er über die Sache in's	534	0	107513-Verne__Jules.tsv