DTA-Tag	TT-Tag	MM-TAg	Perceptron-Tag	Lemma	newtag	Prefix	Wort	Suffix	Sentence_neighborhood	sentence_index	index	filename
PWS	PWS		PWS	was		« »	Was	geht Euch mein Hals an !	Ist das wahr , du Schurke ?« » Was geht Euch mein Hals an !Und Old Shatterhand und Old Surehand auch	5023	2	79313-May__Karl.tsv
PWS	PWS		PWS	was			Was	machen Sie da , mein Lieber ?	Bei wem , bei wem ?Was machen Sie da , mein Lieber ?Ihr eßt morgen bei einer Dame zu	4196	0	112135-Zola___mile.tsv
PWS	PWS		PWS	was			Was	nicht einzelnes Atom ist das um sich selber dreht , sondern lebendige Kraft die in sich gebunden und geschlossen nach außen strahlt , das bildet und schließt das durchdringbare nähere oder fernere Wesen sich ein , verselbt es und verinnert es , und da diese Kraft überall einfach und ganz ist , so wird , wie weit sie auch reicht , einfach und ganz was ihr sich eint : nur der Umfang kann wachsen , nicht die Rundheit und die Bindung .	keine Mache , sondern ein Gesetz .Was nicht einzelnes Atom ist das um sich selber dreht , sondern lebendige Kraft die in sich gebunden und geschlossen nach außen strahlt , das bildet und schließt das durchdringbare nähere oder fernere Wesen sich ein , verselbt es und verinnert es , und da diese Kraft überall einfach und ganz ist , so wird , wie weit sie auch reicht , einfach und ganz was ihr sich eint : nur der Umfang kann wachsen , nicht die Rundheit und die Bindung .Die Gotteskunde ist aufgehendes und übergehendes Menschtum	276	0	56347-Gundolf__Friedrich.tsv
PWS	PWS		PWS	was		Bei Tafel forderte er die Frauenzimmer auf , daß sie sich wünschen sollten ,	was	sie nur möchten .	antwortete : » Wie der Wind .Bei Tafel forderte er die Frauenzimmer auf , daß sie sich wünschen sollten , was sie nur möchten .Faustus sagte : » Geh wieder hin	69	14	86834-Pr_hle__Heinrich.tsv
PWS	PWS		PWS	was		– Und	was	er aus seinem Lebensvermögen weitergegeben haben mag an diesen , seinen Sohn Velten Andres – unsern Freund ?	werden , wer kann das wissen ?– Und was er aus seinem Lebensvermögen weitergegeben haben mag an diesen , seinen Sohn Velten Andres – unsern Freund ?Mit den Akten des Vogelsangs hatten sie	68	2	87001-Raabe__Wilhelm.tsv
PWS	PWS		PWS	was		Und	was	sie schnattern und bunt aussehn und lachen übereinander und galern , wie so ein Zug von emigrierte Franzosen !	man auf einer neuen Chaussee rumpelt .Und was sie schnattern und bunt aussehn und lachen übereinander und galern , wie so ein Zug von emigrierte Franzosen !– Und es kommen noch mehr Gäst	3798	1	4089-Arnim__Bettina_von.tsv
PWS	PWS		PWS	was		Zu der inneren Not gesellte sich äußere Bedrängnis ;	was	ihn aufrecht hielt , war ein starkes Gottvertrauen und das bestimmte Gefühl , daß neue Not und neue Kämpfe bevorstünden , gegen die es geboten sei , sich zu waffnen .	ihn doppelt hart am eigenen Herd .Zu der inneren Not gesellte sich äußere Bedrängnis ; was ihn aufrecht hielt , war ein starkes Gottvertrauen und das bestimmte Gefühl , daß neue Not und neue Kämpfe bevorstünden , gegen die es geboten sei , sich zu waffnen .Die Erfahrungen der letzten Monate , die	9940	9	26867-Fontane__Theodor.tsv
PWS	PWS		PWS	was		« Ich erzählte ihr ,	was	Ihr nun auch wißt , sie hörte mir mit Vergnügen zu , und ich wurde so beruhigt , daß ich mir fest vornahm , meine Melancholey künftig besser zu bekämpfen .	mit meinem Leben dafür büßen muß .« Ich erzählte ihr , was Ihr nun auch wißt , sie hörte mir mit Vergnügen zu , und ich wurde so beruhigt , daß ich mir fest vornahm , meine Melancholey künftig besser zu bekämpfen .Das war aber nirgends zu finden ,	91	5	5103-Arnim__Ludwig_Achim_von.tsv
PWS	PWS		PIS	was		» Und	was	geschah ?	sie sich entgegenwüchsen in jugendlichen Begehrungen .» Und was geschah ?Auf jeder Gebärde lag eine Müdigkeit oder	6073	2	58342-Hauptmann__Carl.tsv
PWS	PIS		PWS	was		Ei	was	, Stopfkuchen , alter dicker Freund , und du , Eduard , jetzt bleibt einmal sitzen wie in andern , schönern Zeiten .	« sagte der Staatsanwalt .Ei was , Stopfkuchen , alter dicker Freund , und du , Eduard , jetzt bleibt einmal sitzen wie in andern , schönern Zeiten .» Siehe da , die Herren !	2003	1	87000-Raabe__Wilhelm.tsv
PWS	PRELS		PWS	was			was	ein Naturforscher hier sammeln könnte .	Alter Kupferstich .was ein Naturforscher hier sammeln könnte .( Facsimile .	676	0	107559-Verne__Jules.tsv
PWS	PRELS		PWS	was		Brecht Euch durch und nehmt mit ,	was	Ihr fortbringen könnt .	So seht her .Brecht Euch durch und nehmt mit , was Ihr fortbringen könnt .Fürchtet Euch gar nicht , liebe Zechgenoßen	49	7	71782-L_hr__Johann_Andreas_Christian.tsv
PWS	PWS		PWS	was		Ich weiß nicht ,	was	mich diese Tage von einem Fehler zum andern verleitet !	und meine Sammlung kennen , hinzusetzen .Ich weiß nicht , was mich diese Tage von einem Fehler zum andern verleitet !nicht Ihre Beschreibung , sondern das Beschriebene	395	4	32577-Goethe__Johann_Wolfgang.tsv
PWS	PWS		PIS	was		Ihr habt mich von diesen Menschen befreit , die wer weiß	was	noch angefangen hätten .	einem Ziegenbock in den Morgen hineinreitet ?Ihr habt mich von diesen Menschen befreit , die wer weiß was noch angefangen hätten .» Aber der verfluchte Hut ist mir	3469	11	79314-May__Karl.tsv
PWS	PWS		PWS	was		und	was	denkt sie wohl , daß ich so lange nicht geschrieben ?	Dank schuldig , als du mir .und was denkt sie wohl , daß ich so lange nicht geschrieben ?Nun muß ich ihr aber etwas gestehen	2895	1	25799-Fischer__Caroline_Auguste.tsv
PWS	PWS		PWS	was		Staunend über diese neuen Entdeckungen , die sie darauf sich gegenseitig machten , verloren sie zwar die Spur des plötzlich wie verschwundenen flüchtigen Fremden , aber sie sagten doch : Siegbert , erstaunend über die Aufregung des Bruders , konnte nichts als , alle Gegenrede vermeidend , ihn bitten , deutlicher zu werden und in Ruhe zu erzählen ,	was	er ihm anzuvertrauen hätte .	Priesterrock und Weihe , wahre Ruhe .Staunend über diese neuen Entdeckungen , die sie darauf sich gegenseitig machten , verloren sie zwar die Spur des plötzlich wie verschwundenen flüchtigen Fremden , aber sie sagten doch : Siegbert , erstaunend über die Aufregung des Bruders , konnte nichts als , alle Gegenrede vermeidend , ihn bitten , deutlicher zu werden und in Ruhe zu erzählen , was er ihm anzuvertrauen hätte .Das Bedürfniß der Beichte ist der Wahrheitsdrang	35527	59	56355-Gutzkow__Karl.tsv
PWS	PRELS		PWS	was		Aber ihn ahndete doch in der Folge nichts Gutes : er schlief zuletzt keine zwei Nächte hintereinander in demselben Bette und Zimmer ; und wir sind nicht dabeigewesen , als ihm jenseits widerfuhr ,	was	ihm diesseits ahndete .	Aber dahin kommen wenige !Aber ihn ahndete doch in der Folge nichts Gutes : er schlief zuletzt keine zwei Nächte hintereinander in demselben Bette und Zimmer ; und wir sind nicht dabeigewesen , als ihm jenseits widerfuhr , was ihm diesseits ahndete .Du hast recht , Andres , die	7	34	18647-Claudius__Matthias.tsv
PWS	PWS		PWS	was		Wenn ich jemals mit diesen Damen zusammenkommen sollte , werde ich hören ,	was	sie sagen .	hatte nichts Angenehmes mehr für mich .Wenn ich jemals mit diesen Damen zusammenkommen sollte , werde ich hören , was sie sagen .Einem so verständigen Manne wie du kann	47	13	78055-Lukian.tsv
PWS	PWS		PRELS	was		Die Propheten aber immer im Blik auf 's verheissene Königreich der lezten Zeitdamit Ihnen das bekannt werde ,	was	noch kommen soll ; aber mit einem einfältigen kindlichen Glauben : daß Gott dem Wort nach manches erfüllen könne , was uns thöricht und unmöglich scheint , gleichwie er auch von Anfang an gethan : z.B. in Ansehung der Sündflut , Erscheinungen , und Besuch bei Abraham ; in den Offenbarungen , die dem Moses zu verschiedenenmalen wiederfahren ; ferner bei'm Durchgang durch 's rothe Meer , Speisung eines so großen Volkes in der Wüste , und Tränkung desselben aus einem Felsen , wo vorher kein Wasser floß : u. s.w. welches alles die heutigen Gelehrten vorher , eh es geschehen war , eben so wenig geglaubt , und Gott lieber in den engen Bezirk ihres kurzgefaßten Möglichkeitsystems eingeschlossen , und einen jeden Glaubigen ausgelacht hätten , wie ver mutlich die vor der Sündflut den Noah ausgelacht , als er den Schiffkasten gebaut ; und die zu Sodom den Loth , als er die Zerstörung ihrer Stadt geglaubt .	die nachfolgende Geistesrichtung meines seligen Vaters .Die Propheten aber immer im Blik auf 's verheissene Königreich der lezten Zeitdamit Ihnen das bekannt werde , was noch kommen soll ; aber mit einem einfältigen kindlichen Glauben : daß Gott dem Wort nach manches erfüllen könne , was uns thöricht und unmöglich scheint , gleichwie er auch von Anfang an gethan : z.B. in Ansehung der Sündflut , Erscheinungen , und Besuch bei Abraham ; in den Offenbarungen , die dem Moses zu verschiedenenmalen wiederfahren ; ferner bei'm Durchgang durch 's rothe Meer , Speisung eines so großen Volkes in der Wüste , und Tränkung desselben aus einem Felsen , wo vorher kein Wasser floß : u. s.w. welches alles die heutigen Gelehrten vorher , eh es geschehen war , eben so wenig geglaubt , und Gott lieber in den engen Bezirk ihres kurzgefaßten Möglichkeitsystems eingeschlossen , und einen jeden Glaubigen ausgelacht hätten , wie ver mutlich die vor der Sündflut den Noah ausgelacht , als er den Schiffkasten gebaut ; und die zu Sodom den Loth , als er die Zerstörung ihrer Stadt geglaubt .Klopstok wurde durch mich in Ludwigsburg ,	3587	18	97606-Schubart__Christian_Friedrich_Daniel.tsv
PWS	ADJA		PWS	welches		Melo aber eilte mit seinen vier tausend Reitern /	welches	alles Sicambrische und Tencterische Ritter oder Edelleute waren / dem härtesten Stande zu ; wo der Graf von Oldenburg mehr keinen Athem / wenig Blut / ja nicht einen unverwundeten Soldaten / gleichwohl aber noch das Hertze hatte zwölff tausend Römern durch Hülffe des vortheilhaften Ortes die Stirne zu bieten .	/ und Hoffnung zu überwinden hätten .Melo aber eilte mit seinen vier tausend Reitern / welches alles Sicambrische und Tencterische Ritter oder Edelleute waren / dem härtesten Stande zu ; wo der Graf von Oldenburg mehr keinen Athem / wenig Blut / ja nicht einen unverwundeten Soldaten / gleichwohl aber noch das Hertze hatte zwölff tausend Römern durch Hülffe des vortheilhaften Ortes die Stirne zu bieten .Und ich werde mit iedem vergnügt seyn	681	9	78039-Lohenstein__Daniel_Casper_von.tsv
PWS	PWS		PWS	wer			Wer	hat mich darauf hingewiesen , die Herstellung künstlicher Diamanten zu versuchen ?	fuhr Cyprien fort .Wer hat mich darauf hingewiesen , die Herstellung künstlicher Diamanten zu versuchen ?» Ihnen , nur Ihnen , Fräulein	1176	0	107513-Verne__Jules.tsv
PWS	PWS		PWS	wer			Wer	mit dem Künstler wegen des Kostüms rechten wollte , der dürfte sich nur sagen , es habe eine Geschichte des sechzehnten Jahrhunderts gemalt werden sollen , und so ist alles abgetan .	sind , gegen eine gewisse Miete .Wer mit dem Künstler wegen des Kostüms rechten wollte , der dürfte sich nur sagen , es habe eine Geschichte des sechzehnten Jahrhunderts gemalt werden sollen , und so ist alles abgetan .Übrigens hat Venedig nichts zu besorgen ;	4513	0	32620-Goethe__Johann_Wolfgang.tsv
PWS	PWS		PIS	wer		« Und	wem	gefällt nicht folgendes Gemählde von einem alten Weibe , in dem Neujahrs-Gedichte von 1722 .	warffen sich vorwerts auf die Brust .« Und wem gefällt nicht folgendes Gemählde von einem alten Weibe , in dem Neujahrs-Gedichte von 1722 .Daß die blosse Kunst der Nachahmung ohne	85	2	14325-Breitinger__Johann_Jakob.tsv
PWS	PWS		PWS	wer		Nichts erfolget darauf ; denn nichts gewinnet nichts , und	wer	keinen Fuß auf die Schwelle setzt , der verlieret nichts .	wie die meisten zu thun pflegen ?Nichts erfolget darauf ; denn nichts gewinnet nichts , und wer keinen Fuß auf die Schwelle setzt , der verlieret nichts .Jedoch meyne ich , des Glücks ,	2108	10	97156-Schmidt__Johann_Georg.tsv
PWS	PWS		PWS	wer		Ihr habt mich von diesen Menschen befreit , die	wer	weiß was noch angefangen hätten .	einem Ziegenbock in den Morgen hineinreitet ?Ihr habt mich von diesen Menschen befreit , die wer weiß was noch angefangen hätten .» Aber der verfluchte Hut ist mir	3469	9	79314-May__Karl.tsv