DTA-Tag	TT-Tag	MM-TAg	Perceptron-Tag	Lemma	newtag	Prefix	Wort	Suffix	Sentence_neighborhood	sentence_index	index	filename
TRUNC	TRUNC		TRUNC	aus-		Ihr ganzer	Aus-	und Eingang ist in die Kirche und aus der Kirche , aus ihrem Hause und in ihr Haus zurück .	kann ich das zu danken haben .Ihr ganzer Aus- und Eingang ist in die Kirche und aus der Kirche , aus ihrem Hause und in ihr Haus zurück .» Es ist umsonst .	398	2	96440-Schiller__Friedrich.tsv
TRUNC	TRUNC		TRUNC	berufs-		Langsam sehen wir aus kleinem kreise sich in unsern deutschen mittelpunkten entwickeln was wir seit jahren nur in den nachbarländern bemerken konnten : jenseits einer blossen zusammenrottung gewisser berufsklassen zu	berufs-	und unterhaltungszwecken eine geistige und künstlerische gesellschaft die sich verbunden fühlt durch ganz bestimmte ablehnungen und bejahungen : durch ein besonderes lebensgefühl .	auftragen muss um bemerkt zu werden .Langsam sehen wir aus kleinem kreise sich in unsern deutschen mittelpunkten entwickeln was wir seit jahren nur in den nachbarländern bemerken konnten : jenseits einer blossen zusammenrottung gewisser berufsklassen zu berufs- und unterhaltungszwecken eine geistige und künstlerische gesellschaft die sich verbunden fühlt durch ganz bestimmte ablehnungen und bejahungen : durch ein besonderes lebensgefühl .wir zu ihnen : Seid ihr noch	101	30	29774-George__Stefan.tsv
TRUNC	TRUNC		TRUNC	beschwer-		Denn weil er mit seinem grossen und fürtreflich-ausgerüsteten Schiffe die andern beschirmte / und die Ehre der letzte unter den Fliehenden zu seyn behaupten wolte / ward er durch ein mit Schwefel und Pech gefülltes aber mit einer Königlichen Haupt-Fahne ausgeputztes und vergüldetes Schiff angezündet ; also / daß er / welcher vorher mit so viel tausend Masten dem Meere	beschwer-	und schrecklich war / sich eben so wie der flüchtige Xerxes mit Kummer und Noth auf einem Fischer-Kahne konte ans Land sätzen lassen .	sey einem boßhafften Hexen-Meister zu begegnen .Denn weil er mit seinem grossen und fürtreflich-ausgerüsteten Schiffe die andern beschirmte / und die Ehre der letzte unter den Fliehenden zu seyn behaupten wolte / ward er durch ein mit Schwefel und Pech gefülltes aber mit einer Königlichen Haupt-Fahne ausgeputztes und vergüldetes Schiff angezündet ; also / daß er / welcher vorher mit so viel tausend Masten dem Meere beschwer- und schrecklich war / sich eben so wie der flüchtige Xerxes mit Kummer und Noth auf einem Fischer-Kahne konte ans Land sätzen lassen .Bey welchem Unglücke denn noch diß das	40297	60	78039-Lohenstein__Daniel_Casper_von.tsv
TRUNC	TRUNC		TRUNC	blut-		Im Lateinischen rufum , russum , rubrum , rutilum , rubicundum , spadix , badium , φοινικουν puniceum , ( ponceau , coquelicot , nacarat ) , coccineum Scharlach , ύσγινον , welches nach Plinius zwischen purpureum und coccineum liegt und wahrscheinlich cramoisi Karmesin ist ; zuletzt purpureum πορφυρουν , das vom Rosenroten an durchs	Blut-	und Braunrote bis ins Blaurote άλουργες und Violette übergeht .	Andeutungen , 1738 seine letzten Ausarbeitungen .Im Lateinischen rufum , russum , rubrum , rutilum , rubicundum , spadix , badium , φοινικουν puniceum , ( ponceau , coquelicot , nacarat ) , coccineum Scharlach , ύσγινον , welches nach Plinius zwischen purpureum und coccineum liegt und wahrscheinlich cramoisi Karmesin ist ; zuletzt purpureum πορφυρουν , das vom Rosenroten an durchs Blut- und Braunrote bis ins Blaurote άλουργες und Violette übergeht .Bei seiner Vorliebe für die Schwingungslehre erfreute	3424	55	32618-Goethe__Johann_Wolfgang.tsv
TRUNC	TRUNC		TRUNC	bundes-		Ich habe Deine Unterredung mit Mardochai , meinem früheren	Bundes-	, Studien- und Sündengenossen angehört , nicht aus Neugier – denn ich erliege dieser Schwäche nicht , weil ich allmächtig genug bin , um ihr zu trotzen – sondern durch Zufall .	ihre beiderseitig wankende Gesundheit wieder herzustellen .Ich habe Deine Unterredung mit Mardochai , meinem früheren Bundes- , Studien- und Sündengenossen angehört , nicht aus Neugier – denn ich erliege dieser Schwäche nicht , weil ich allmächtig genug bin , um ihr zu trotzen – sondern durch Zufall .Beruhigt durch meine Antwort fuhr sie fort	6652	9	110547-Willkomm__Ernst_Adolf.tsv
TRUNC	NN		NN	erb-		Diese konnte ich denn freilich nicht in Schutz nehmen : ob ich gleich nicht leugnen will , daß mich das häßliche Zeug manchmal unterhält und der Schadenfreude , dieser	Erb-	und Schoßsünde aller Adamskinder , als eine pikante Speise nicht ganz übel schmeckt .	verschaffen , deren ich bedürfen könnte .Diese konnte ich denn freilich nicht in Schutz nehmen : ob ich gleich nicht leugnen will , daß mich das häßliche Zeug manchmal unterhält und der Schadenfreude , dieser Erb- und Schoßsünde aller Adamskinder , als eine pikante Speise nicht ganz übel schmeckt .Er war freundlich genug , das an	200	29	32577-Goethe__Johann_Wolfgang.tsv
TRUNC	NE		NE	french-		Im Laufe des 13. gingen Baxter , Briant und Moko an die Herrichtung des Kochofens , der auf Walzen bis zum Innern von	French-	den gezogen werden mußte .	fragte Gordon .Im Laufe des 13. gingen Baxter , Briant und Moko an die Herrichtung des Kochofens , der auf Walzen bis zum Innern von French- den gezogen werden mußte .– Und warum ?	603	23	107519-Verne__Jules.tsv
TRUNC	CARD		CARD	fünf-		« San-Fernando wird im höchsten Falle	fünf-	bis sechshundert Einwohner haben .	nicht mehr nachzuweisen war – gesucht .« San-Fernando wird im höchsten Falle fünf- bis sechshundert Einwohner haben .Sobald er aus dieser Bucht hinaus war	1439	6	107530-Verne__Jules.tsv
TRUNC	TRUNC		TRUNC	glück-		Ins gemein würden alle Einrathungen eben so wol / als die Wercke nach derselben	glück-	oder unglücklichem Ausschlage für gut oder böse gehalten / und diß / was durch Zufall geriethe / der vernünfftigsten Meinung vorgezogen / und was fehl schlüge von andern getadelt / welche nichts für klug hielten / was nicht aus ihrem Gehirne entsprossen wäre .	gut / sondern kluge und hertzhaffte .Ins gemein würden alle Einrathungen eben so wol / als die Wercke nach derselben glück- oder unglücklichem Ausschlage für gut oder böse gehalten / und diß / was durch Zufall geriethe / der vernünfftigsten Meinung vorgezogen / und was fehl schlüge von andern getadelt / welche nichts für klug hielten / was nicht aus ihrem Gehirne entsprossen wäre .wir Deutschen hätten nach des Varus Niederlage	17242	14	78039-Lohenstein__Daniel_Casper_von.tsv
TRUNC	TRUNC		NN	harz-		Nach den Aussagen desselben erzeugte die Insel viel Palmenkohl , Cocosnüsse und verschiedene Mandelfrüchte ; ebenso gediehen daselbst der wilde Kaffeebaum , der Ebenholzbaum , der » Tacamaca « , nebst anderen	harz-	, respective gummireichen Baumarten , ferner die Banane , das Zuckerrohr , die Yamswurzel , der Anis und endlich eine , von den Urbewohnern » Binao « genannte Pflanze , deren Früchte bei denselben die Stelle des Brotes vertraten .	Isle de France bestimmte Munition mitnahm .Nach den Aussagen desselben erzeugte die Insel viel Palmenkohl , Cocosnüsse und verschiedene Mandelfrüchte ; ebenso gediehen daselbst der wilde Kaffeebaum , der Ebenholzbaum , der » Tacamaca « , nebst anderen harz- , respective gummireichen Baumarten , ferner die Banane , das Zuckerrohr , die Yamswurzel , der Anis und endlich eine , von den Urbewohnern » Binao « genannte Pflanze , deren Früchte bei denselben die Stelle des Brotes vertraten .An letzterem Tage sah sich die »	681	32	107558-Verne__Jules.tsv
TRUNC	TRUNC		TRUNC	hin-		Es schienen nur einfache Maurer und Steinmetzen , die da sprachen , aber ihre Münster , die sie zu vollenden gedachten , ragten über die Ruine hinaus und von ihrem Wirken in Nord , Süd , Ost , West blitzte es jetzt schon	hin-	und herüber , als sähe man plötzlich eine Hülle von der ganzen Welt genommen und erblickte Säulen eines Zaubertempels , der dem Lauscher die Augen blendete ... Frau von Sänger war eine sehr heitre , eine sehr kokette Frau .	Verlobten für die künftige Ehe hatte .Es schienen nur einfache Maurer und Steinmetzen , die da sprachen , aber ihre Münster , die sie zu vollenden gedachten , ragten über die Ruine hinaus und von ihrem Wirken in Nord , Süd , Ost , West blitzte es jetzt schon hin- und herüber , als sähe man plötzlich eine Hülle von der ganzen Welt genommen und erblickte Säulen eines Zaubertempels , der dem Lauscher die Augen blendete ... Frau von Sänger war eine sehr heitre , eine sehr kokette Frau .Sie konnte nicht Widerstand leisten , daß	41285	43	56355-Gutzkow__Karl.tsv
TRUNC	TRUNC		VVPP	hinüber-		Jawohl , jawohl , hier gehe ich neben dir bis jetzt bloß als der dicke Schaumann durch den Stadtfrieden – wenn sie morgen von ihm aus nach der Roten Schanze	hinüber-	und hinaufsehen , werden sie nur noch vom geheimnisschwangern , sühneträchtigen Schaumann reden und mich den giftgeschwollenen Bauch blähen sehen : Eduard , du ahnst es doch nicht ganz , wie unangenehm mir diese Geschichte mit Kienbaum ist und wie fürchterlich es mir gegen die Natur geht , daß grade mir die endliche Abwickelung der Sache aufgeladen worden ist !	so behaglich – so – unschuldig !Jawohl , jawohl , hier gehe ich neben dir bis jetzt bloß als der dicke Schaumann durch den Stadtfrieden – wenn sie morgen von ihm aus nach der Roten Schanze hinüber- und hinaufsehen , werden sie nur noch vom geheimnisschwangern , sühneträchtigen Schaumann reden und mich den giftgeschwollenen Bauch blähen sehen : Eduard , du ahnst es doch nicht ganz , wie unangenehm mir diese Geschichte mit Kienbaum ist und wie fürchterlich es mir gegen die Natur geht , daß grade mir die endliche Abwickelung der Sache aufgeladen worden ist !Er läßt seine Gefühle in einer langgezogenen	1430	30	87000-Raabe__Wilhelm.tsv
TRUNC	TRUNC		TRUNC	hudsons-		Dann sollte er , wenn er es für angezeigt hielte , nach Neuseeland gehen , bei den Gesellschaftsinseln rasten und daselbst den Tahitier Mai ausschiffen , ferner Neu-England besuchen , aber alle spanischen Besitzungen in Amerika vermeiden und durch das arktische Eismeer nach der	Hudsons-	und Bassins-Bai vordringen , mit anderen Worten , die Nordwest-Passage von Osten her aufsuchen .	sechzig Mann bestehende Abtheilung erfolgt wäre .Dann sollte er , wenn er es für angezeigt hielte , nach Neuseeland gehen , bei den Gesellschaftsinseln rasten und daselbst den Tahitier Mai ausschiffen , ferner Neu-England besuchen , aber alle spanischen Besitzungen in Amerika vermeiden und durch das arktische Eismeer nach der Hudsons- und Bassins-Bai vordringen , mit anderen Worten , die Nordwest-Passage von Osten her aufsuchen .« ( Tacouri hat Marion erschlagen !	1151	44	107558-Verne__Jules.tsv
TRUNC	TRUNC		TRUNC	johannis-		« Drinnen im Garten war alles Duft und Frische , denn , den ganzen Hauptweg hinauf , zwischen den	Johannis-	und Stachelbeersträuchern , standen Levkojen und Reseda , deren feiner Duft sich mit dem kräftigeren der Thymianbeete mischte .	sind wie toll in diesem Jahr .« Drinnen im Garten war alles Duft und Frische , denn , den ganzen Hauptweg hinauf , zwischen den Johannis- und Stachelbeersträuchern , standen Levkojen und Reseda , deren feiner Duft sich mit dem kräftigeren der Thymianbeete mischte .Und laß die Lampe vorn brennen .	1703	19	26854-Fontane__Theodor.tsv
TRUNC	TRUNC		NE	kaiserlich-		Es heißt : Weil ich mich dann nun weder unter	Kaiserlich-	, Schwedisch- noch Hessischen nicht mehr dorfte sehen lassen , ich hätte mich dann mutwillig in Gefahr geben wollen , in der freien Luft arrestiert zu werden , indem ich bei allen dreien ausgerissen , zumal unter den Holländern nicht länger zu bleiben hatte , weil ich ein Mägdlein mit Gewalt entunehrt hatte , welches allem Ansehen nach in Bälde seinen Ausbruch nehmen würde , gedachte ich , meine Zuflucht bei den Spanischen zu haben , der Hoffnung , von denselben heimzugehen und zu sehen , was meine Eltern machten .	durch Wohlverhalten ein General zu werden .Es heißt : Weil ich mich dann nun weder unter Kaiserlich- , Schwedisch- noch Hessischen nicht mehr dorfte sehen lassen , ich hätte mich dann mutwillig in Gefahr geben wollen , in der freien Luft arrestiert zu werden , indem ich bei allen dreien ausgerissen , zumal unter den Holländern nicht länger zu bleiben hatte , weil ich ein Mägdlein mit Gewalt entunehrt hatte , welches allem Ansehen nach in Bälde seinen Ausbruch nehmen würde , gedachte ich , meine Zuflucht bei den Spanischen zu haben , der Hoffnung , von denselben heimzugehen und zu sehen , was meine Eltern machten .Auf diese Weise gilt es gleich ,	729	10	50637-Grimmelshausen__Hans_Jakob_Christoffel_von.tsv
TRUNC	TRUNC		TRUNC	kriegs-		Ein	Kriegs-	und Reisetagebuch mocht' ich gar nicht anrühren .	Geldes , der Manuskripte wieder versichern .Ein Kriegs- und Reisetagebuch mocht' ich gar nicht anrühren .Daß hiebei eine Art Absichtlichkeit durchwalten mußte	910	1	32622-Goethe__Johann_Wolfgang.tsv
TRUNC	TRUNC		TRUNC	kuchen-		« Als ich verwichne Weihnachtmeß in eines vornehmen Herrn Hof mit höchstverdrießlicher Patienz umb eine Resolution zu erlangen aufwartete auf eine Supplikation , darinnen ich gar beweglich umb einen Schreiberdienst gebetten und in derselben meinen hohen Fleiß mit den allerandächtigsten Worten gerühmt , auch die Beständigkeit meiner unvergleichlichen Treu genugsam versichert hatte , gleichwohl aber der gewünschte Bescheid dermaleins nicht kommen wollte , siehe , da wurde ich noch viel ungedultiger , vornehmlich als ich sahe , daß die schmutzige	Kuchen-	und stinkende Stallratzen in ihrer Ästimation passiert , ich aber wie ein ungesalzener Stockfisch , den man auch keiner fernerer Versuchung würdigt , verachtet wurde .	ganze Parteien und Eskadronen unsichtbar machen .« Als ich verwichne Weihnachtmeß in eines vornehmen Herrn Hof mit höchstverdrießlicher Patienz umb eine Resolution zu erlangen aufwartete auf eine Supplikation , darinnen ich gar beweglich umb einen Schreiberdienst gebetten und in derselben meinen hohen Fleiß mit den allerandächtigsten Worten gerühmt , auch die Beständigkeit meiner unvergleichlichen Treu genugsam versichert hatte , gleichwohl aber der gewünschte Bescheid dermaleins nicht kommen wollte , siehe , da wurde ich noch viel ungedultiger , vornehmlich als ich sahe , daß die schmutzige Kuchen- und stinkende Stallratzen in ihrer Ästimation passiert , ich aber wie ein ungesalzener Stockfisch , den man auch keiner fernerer Versuchung würdigt , verachtet wurde .‹ Er versprach , reinen Mund zu	125	80	50640-Grimmelshausen__Hans_Jakob_Christoffel_von.tsv
TRUNC	TRUNC		TRUNC	kunst-		Obbedeuteter Hildebrand in seinem	Kunst-	und Wunder-Buch P. II. p. 132. gibt seine Meinung vom wütenden Heer in folgendem : Nun lasset uns declariren , was da sey das wütende Heer ; das ist eine Versammlung aller derer , oder vieler Hexen , Unholden , Hängsten , Zauberern , die zusammen kommen in einem Rath , ihr Geschäfft zu handlen , richten aus , was sie in ihren Häusern nicht mögen zuweg bringen , zu capituliren , zu unterrichten , zu lernen , zu ertragen , zu conspiriren , einzuschreiben , zu bezeichnen , zu huldigen , Gelübniß geben , und was ihre Bündnus in sich hält , aufzurichten , einander zu befehlen , was Unraths sie stifften wollen , auch was ein jeglicher für sich selber auszurichten habe , und also ihr Laster und Hexen-Werck vollenden .	konte , was er allda gesehen .Obbedeuteter Hildebrand in seinem Kunst- und Wunder-Buch P. II. p. 132. gibt seine Meinung vom wütenden Heer in folgendem : Nun lasset uns declariren , was da sey das wütende Heer ; das ist eine Versammlung aller derer , oder vieler Hexen , Unholden , Hängsten , Zauberern , die zusammen kommen in einem Rath , ihr Geschäfft zu handlen , richten aus , was sie in ihren Häusern nicht mögen zuweg bringen , zu capituliren , zu unterrichten , zu lernen , zu ertragen , zu conspiriren , einzuschreiben , zu bezeichnen , zu huldigen , Gelübniß geben , und was ihre Bündnus in sich hält , aufzurichten , einander zu befehlen , was Unraths sie stifften wollen , auch was ein jeglicher für sich selber auszurichten habe , und also ihr Laster und Hexen-Werck vollenden .3. ) Musten zween Knaben aus der	2328	4	14949-Br_uner__Johann_Jacob.tsv
TRUNC	TRUNC		TRUNC	kunst-		Dies , verbunden mit so vielen andern Begünstigungen , womit Verfassung , Klima , Lebensart und vor allem angestammter Reichthum der Organisation , dem Griechen zu statten kamen , wirkte kräftig und ohne ein zweites , wetteiferndes Beispiel in der Geschichte , zur Ausbildung des Geschmacks , und zur Erzeugung jenes allgemeinen zarten	Kunst-	und Schönheitssinnes , für welchen namentlich der atheniensische Demos so berühmt geworden ist .	uns durch keinen pathognomischen Eindruck unterbricht .Dies , verbunden mit so vielen andern Begünstigungen , womit Verfassung , Klima , Lebensart und vor allem angestammter Reichthum der Organisation , dem Griechen zu statten kamen , wirkte kräftig und ohne ein zweites , wetteiferndes Beispiel in der Geschichte , zur Ausbildung des Geschmacks , und zur Erzeugung jenes allgemeinen zarten Kunst- und Schönheitssinnes , für welchen namentlich der atheniensische Demos so berühmt geworden ist .Die Empfindung , die das Schöne in	4272	53	26873-Forster__Georg.tsv
TRUNC	TRUNC		NE	oliven-		Der Apostel , eine alte Frau und der Knabe schritten stromaufwärts weiter , der kleinere Greis , Ursus und Lygia wandten sich einem engen Vicus zu und betraten , nachdem sie noch ungefähr hundert Schritte gegangen waren , ein Haus , in dem sich zwei Läden , ein	Oliven-	und ein Geflügelladen , befanden .	lachend beim Anblick des schlummernden Petronius .Der Apostel , eine alte Frau und der Knabe schritten stromaufwärts weiter , der kleinere Greis , Ursus und Lygia wandten sich einem engen Vicus zu und betraten , nachdem sie noch ungefähr hundert Schritte gegangen waren , ein Haus , in dem sich zwei Läden , ein Oliven- und ein Geflügelladen , befanden .« » Das wäre schlimm , «	6026	48	98460-Sienkiewicz__Henryk.tsv
TRUNC	TRUNC		ADJA	schwedisch-		Es heißt : Weil ich mich dann nun weder unter Kaiserlich- ,	Schwedisch-	noch Hessischen nicht mehr dorfte sehen lassen , ich hätte mich dann mutwillig in Gefahr geben wollen , in der freien Luft arrestiert zu werden , indem ich bei allen dreien ausgerissen , zumal unter den Holländern nicht länger zu bleiben hatte , weil ich ein Mägdlein mit Gewalt entunehrt hatte , welches allem Ansehen nach in Bälde seinen Ausbruch nehmen würde , gedachte ich , meine Zuflucht bei den Spanischen zu haben , der Hoffnung , von denselben heimzugehen und zu sehen , was meine Eltern machten .	durch Wohlverhalten ein General zu werden .Es heißt : Weil ich mich dann nun weder unter Kaiserlich- , Schwedisch- noch Hessischen nicht mehr dorfte sehen lassen , ich hätte mich dann mutwillig in Gefahr geben wollen , in der freien Luft arrestiert zu werden , indem ich bei allen dreien ausgerissen , zumal unter den Holländern nicht länger zu bleiben hatte , weil ich ein Mägdlein mit Gewalt entunehrt hatte , welches allem Ansehen nach in Bälde seinen Ausbruch nehmen würde , gedachte ich , meine Zuflucht bei den Spanischen zu haben , der Hoffnung , von denselben heimzugehen und zu sehen , was meine Eltern machten .Auf diese Weise gilt es gleich ,	729	12	50637-Grimmelshausen__Hans_Jakob_Christoffel_von.tsv
TRUNC	TRUNC		TRUNC	speditions-		Viktor Störteler , von den Seldwylern nur Viggi Störteler genannt , lebte in behaglichen und ordentlichen Umständen , da er ein einträgliches	Speditions-	und Warengeschäft betrieb und ein hübsches , gesundes und gutmütiges Weibchen besaß .	kicherte , aber keine wollte klopfen .Viktor Störteler , von den Seldwylern nur Viggi Störteler genannt , lebte in behaglichen und ordentlichen Umständen , da er ein einträgliches Speditions- und Warengeschäft betrieb und ein hübsches , gesundes und gutmütiges Weibchen besaß .Unter dem Vordache auf den Steinplatten wimmelte	861	22	66078-Keller__Gottfried.tsv
TRUNC	TRUNC		TRUNC	studien-		Ich habe Deine Unterredung mit Mardochai , meinem früheren Bundes- ,	Studien-	und Sündengenossen angehört , nicht aus Neugier – denn ich erliege dieser Schwäche nicht , weil ich allmächtig genug bin , um ihr zu trotzen – sondern durch Zufall .	ihre beiderseitig wankende Gesundheit wieder herzustellen .Ich habe Deine Unterredung mit Mardochai , meinem früheren Bundes- , Studien- und Sündengenossen angehört , nicht aus Neugier – denn ich erliege dieser Schwäche nicht , weil ich allmächtig genug bin , um ihr zu trotzen – sondern durch Zufall .Beruhigt durch meine Antwort fuhr sie fort	6652	11	110547-Willkomm__Ernst_Adolf.tsv
TRUNC	TRUNC		TRUNC	waffen-		Hierauf versicherte man sich der	Waffen-	und Munitionsvorräthe .	, so wirkt es schnell tödtlich .Hierauf versicherte man sich der Waffen- und Munitionsvorräthe .Hat das Brausen aufgehört und ist die	125	5	79363-May__Karl.tsv
TRUNC	TRUNC		TRUNC	zwei-		Noch	zwei-	oder dreimal statteten wir dem Kraal einen Besuch ab .	, was haben sie dann vor ?Noch zwei- oder dreimal statteten wir dem Kraal einen Besuch ab .– Er war gestern in Benares .	1347	1	107508-Verne__Jules.tsv