DTA-Tag	TT-Tag	MM-TAg	Perceptron-Tag	Lemma	newtag	Prefix	Wort	Suffix	Sentence_neighborhood	sentence_index	index	filename
VMFIN	VMFIN		VMFIN	dürfen		– In faden Harmlosigkeiten freilich	darf	ich mich dabei nicht ergehen , auf einige Verblüffung läuft es immer hinaus – dem Geschmack der Zeit muß man Konzessionen machen ... man muß ... Welcher Künstler ist groß geworden und hat das nicht getan ?	läßt sich darin nicht finden !.. .– In faden Harmlosigkeiten freilich darf ich mich dabei nicht ergehen , auf einige Verblüffung läuft es immer hinaus – dem Geschmack der Zeit muß man Konzessionen machen ... man muß ... Welcher Künstler ist groß geworden und hat das nicht getan ?Jetzt sind Sie 's nicht .	479	5	23119-Ebner_Eschenbach__Marie_von.tsv
VMFIN	VMFIN		VMFIN	dürfen		« Es ist mir nicht erlaubt , eine Beschreibung des Apparates zu geben , doch	darf	ich versichern , daß , als der » junge Adler « uns alles erklärt hatte , wir beide Tatellah-Satah und ich , von der Sicherheit und der Verläßlichkeit des Apparates derart überzeugt waren , daß in uns sofort der Wunsch aufstieg , uns seiner recht bald einmal bedienen zu dürfen .	« » Ah ?« Es ist mir nicht erlaubt , eine Beschreibung des Apparates zu geben , doch darf ich versichern , daß , als der » junge Adler « uns alles erklärt hatte , wir beide Tatellah-Satah und ich , von der Sicherheit und der Verläßlichkeit des Apparates derart überzeugt waren , daß in uns sofort der Wunsch aufstieg , uns seiner recht bald einmal bedienen zu dürfen .Oder doch , oder doch ?	7274	15	79326-May__Karl.tsv
VMFIN	VMFIN		VMFIN	können		Dieser Mann	kann	mich nicht beleidigen .	welcher Horde er wohl gehören mag ?Dieser Mann kann mich nicht beleidigen .Das ist gut , sehr gut !	1217	2	79315-May__Karl.tsv
VMFIN	VMFIN		VMFIN	können		Rette sich , wer	kann	!	in die Kirche hinein : Mörder !Rette sich , wer kann !Alle spähten im ersten Moment ratlos nach	1401	4	62191-Heyse__Paul.tsv
VMFIN	VMFIN		VMFIN	können		Schwimmen	konnten	sie als echte Beduinen nicht .	welche säckevoll bei den Kamelen lagen .Schwimmen konnten sie als echte Beduinen nicht .Der , welcher bis jetzt in ihrem	5446	1	79309-May__Karl.tsv
VMFIN	VMFIN		VMFIN	können		« Der Lange trug sie hin und sprach » ich wollte ihn wohl herausholen , wenn ich ihn nur sehen	könnte	.	geholt werden , nun schafft Rat .« Der Lange trug sie hin und sprach » ich wollte ihn wohl herausholen , wenn ich ihn nur sehen könnte .» Daß du mir einen Ring herbeibringst	31	20	50958-Grimm__Jacob_und_Wilhelm.tsv
VMFIN	VMFIN		VMFIN	mögen		Ich	möchte	gestorben sein – ein Engel – ein Geist von der , die Du so geliebt hast .	« seufzte Elmerice .Ich möchte gestorben sein – ein Engel – ein Geist von der , die Du so geliebt hast .« – » Könnte ich Dir doch	3234	1	83757-Paalzow__Henriette_von.tsv
VMFIN	VMFIN		VMFIN	mögen		Denn wie er keinen Paßport bey dem Gouverneur auf zuweisen hatte / sagte dieser mit einer zwar höflichen doch unanständigen Mine ; er	möchte	sich so lange gedulten / biß auf gethanen Bericht andre Ordre deswegen vor Sr. Majestät einlieffe / weil ihm bey hoher Lebens-Straffe und sonder Betrachtung des Standes gebothen / diesen Befehl genau nachzukommen .	die andern Gefangenen vor Renardens Zimmer .Denn wie er keinen Paßport bey dem Gouverneur auf zuweisen hatte / sagte dieser mit einer zwar höflichen doch unanständigen Mine ; er möchte sich so lange gedulten / biß auf gethanen Bericht andre Ordre deswegen vor Sr. Majestät einlieffe / weil ihm bey hoher Lebens-Straffe und sonder Betrachtung des Standes gebothen / diesen Befehl genau nachzukommen .Wie nun Rosantes seinen Fürstlichen Stand offenbahret	1374	23	64549-Hunold__Christian_Friedrich.tsv
VMFIN	VMFIN		VMFIN	mögen		Serra , ein Meer-Fisch / hat seinen Nahmen von der That / dann Serra heißt ein Sägen : der Fisch aber solle auf dem Rucken so scharpffe Stachlen haben / daß / wann er unter einem Schiff herschwimmt / und sich an selbem sehr starck reibet / es durchschneiden	möge	.	dritten Tag wird er uns auferwecken .Serra , ein Meer-Fisch / hat seinen Nahmen von der That / dann Serra heißt ein Sägen : der Fisch aber solle auf dem Rucken so scharpffe Stachlen haben / daß / wann er unter einem Schiff herschwimmt / und sich an selbem sehr starck reibet / es durchschneiden möge .Und dises ist / was der Prophet	8555	49	68510-Kobolt__Willibald.tsv
VMFIN	VVINF		VMFIN	mögen		Da sagte der Jäger Jürge : › Ach , bittet hier die gute alte Mutter , daß sie doch morgen mit dem Töchterlein ihrer seligen Base bei meinem Rechte zugegen sein	mögen	; das wird mir das Herz stärken in meiner letzten Stunde .	, er wolle mit ihm beten .Da sagte der Jäger Jürge : › Ach , bittet hier die gute alte Mutter , daß sie doch morgen mit dem Töchterlein ihrer seligen Base bei meinem Rechte zugegen sein mögen ; das wird mir das Herz stärken in meiner letzten Stunde .« Er hieß mich zu seiner Köchin	495	31	14643-Brentano__Clemens.tsv
VMFIN	VMFIN		ADJA	müssen		Den so einen	mus	man herschlahgen als wie dich und fileichd erwiesche ich eine bassende Gelehgenheid und lase Dich herum mit einen Oxenfisel das dier die Lumberei fileichd ferget , so lase ich dich herum du hunzheitener Batsi .	begient es weiter drohben beim Main .Den so einen mus man herschlahgen als wie dich und fileichd erwiesche ich eine bassende Gelehgenheid und lase Dich herum mit einen Oxenfisel das dier die Lumberei fileichd ferget , so lase ich dich herum du hunzheitener Batsi .Eigenlich begient das Ausland ieber der Dohnau	164	3	104520-Thoma__Ludwig.tsv
VMFIN	VMFIN		VMFIN	müssen		« » Einmal	muß	aber die Geschichte doch ein End neh men , meinst nicht ?	Uhr vorbei und die Lene hinausgesperrt !« » Einmal muß aber die Geschichte doch ein End neh men , meinst nicht ?Der Hausmeister trabte durch den Hof und	1747	3	18343-Christen__Ada.tsv
VMFIN	VMFIN		VMFIN	müssen		– In faden Harmlosigkeiten freilich darf ich mich dabei nicht ergehen , auf einige Verblüffung läuft es immer hinaus – dem Geschmack der Zeit	muß	man Konzessionen machen ... man muß ... Welcher Künstler ist groß geworden und hat das nicht getan ?	läßt sich darin nicht finden !.. .– In faden Harmlosigkeiten freilich darf ich mich dabei nicht ergehen , auf einige Verblüffung läuft es immer hinaus – dem Geschmack der Zeit muß man Konzessionen machen ... man muß ... Welcher Künstler ist groß geworden und hat das nicht getan ?Jetzt sind Sie 's nicht .	479	24	23119-Ebner_Eschenbach__Marie_von.tsv
VMFIN	VMFIN		VMFIN	müssen		– In faden Harmlosigkeiten freilich darf ich mich dabei nicht ergehen , auf einige Verblüffung läuft es immer hinaus – dem Geschmack der Zeit muß man Konzessionen machen ... man	muß	... Welcher Künstler ist groß geworden und hat das nicht getan ?	läßt sich darin nicht finden !.. .– In faden Harmlosigkeiten freilich darf ich mich dabei nicht ergehen , auf einige Verblüffung läuft es immer hinaus – dem Geschmack der Zeit muß man Konzessionen machen ... man muß ... Welcher Künstler ist groß geworden und hat das nicht getan ?Jetzt sind Sie 's nicht .	479	30	23119-Ebner_Eschenbach__Marie_von.tsv
VMFIN	VMFIN		VMFIN	müssen		Begleitete mich dagegen jenes junge Mädchen , so	müßte	ich ja in Aller Augen weit mehr als der Kaufmann Nicolaus Korpanoff meines Podaroshna erscheinen .	Verdacht wegen meiner Person zu zerstreuen .Begleitete mich dagegen jenes junge Mädchen , so müßte ich ja in Aller Augen weit mehr als der Kaufmann Nicolaus Korpanoff meines Podaroshna erscheinen .» Ja , sagte er sich ,	5271	8	107503-Verne__Jules.tsv
VMFIN	VMFIN		VMFIN	sollen		Will er , daß sie gelöst werden	soll	durch dich , so wird es geschehen .	hinaufgeführt in den Himmelssaal der Christen .Will er , daß sie gelöst werden soll durch dich , so wird es geschehen .Aber vergiß nicht , daß das Weib	8963	7	27046-Freytag__Gustav.tsv
VMFIN	VMFIN		VMFIN	sollen		Serra , ein Meer-Fisch / hat seinen Nahmen von der That / dann Serra heißt ein Sägen : der Fisch aber	solle	auf dem Rucken so scharpffe Stachlen haben / daß / wann er unter einem Schiff herschwimmt / und sich an selbem sehr starck reibet / es durchschneiden möge .	dritten Tag wird er uns auferwecken .Serra , ein Meer-Fisch / hat seinen Nahmen von der That / dann Serra heißt ein Sägen : der Fisch aber solle auf dem Rucken so scharpffe Stachlen haben / daß / wann er unter einem Schiff herschwimmt / und sich an selbem sehr starck reibet / es durchschneiden möge .Und dises ist / was der Prophet	8555	21	68510-Kobolt__Willibald.tsv
VMFIN	VMFIN		VMFIN	sollen		«	sollte	er doch die Antwort nicht schuldig bleiben .	, und lassen es dabei bewenden .« sollte er doch die Antwort nicht schuldig bleiben .Ich übergehe den allgemeinen Vorwurf , der	3357	1	110273-Wieland__Christoph_Martin.tsv
VMFIN	VMFIN		VMFIN	sollen		Quid est – Es verdroß mich , daß ich in einem fremden Lande , wo ich mein Geld und , im Fall der Noth , mein ἀνέχου καὶ ἀπέχου auszugeben Willens war , und wo es keinen was anging , ob ich als Edelmann oder als Bürger äß' und tränke , durchaus Adel oder Unadel documentiren	sollte	– und wie ?	Auch bei Erholungen will man Zweck .Quid est – Es verdroß mich , daß ich in einem fremden Lande , wo ich mein Geld und , im Fall der Noth , mein ἀνέχου καὶ ἀπέχου auszugeben Willens war , und wo es keinen was anging , ob ich als Edelmann oder als Bürger äß' und tränke , durchaus Adel oder Unadel documentiren sollte – und wie ?Sonst aber glaub' ich , je weiter	5513	56	62295-Hippel__Theodor_Gottlieb_von.tsv
VMFIN	NN		VMFIN	wollen			Will	er , daß sie gelöst werden soll durch dich , so wird es geschehen .	hinaufgeführt in den Himmelssaal der Christen .Will er , daß sie gelöst werden soll durch dich , so wird es geschehen .Aber vergiß nicht , daß das Weib	8963	0	27046-Freytag__Gustav.tsv
VMFIN	NE		VMFIN	wollen		»	Will	's schon behalten !	» Keine Antwort !» Will 's schon behalten !« » Ich werde mich dadurch geehrt	11259	1	56361-Hackl_nder__Friedrich_Wilhelm_von.tsv
VMFIN	VMFIN		VMFIN	wollen		Dieser Aberglauben scheinet aber meines Erachtens von einem Schaden-Bräuer erfunden zu seyn / denn wenn zu weilen ein Bräuer das Bier verwarloset / erdencket er Lügen / und bricht Ursach von andern Zäunen / auf daß die Schuld nicht ihm beygemessen werde / davon ich ein Exempel erzehlen	will	.	viel näher gelegene Brodtteige nicht haben ?Dieser Aberglauben scheinet aber meines Erachtens von einem Schaden-Bräuer erfunden zu seyn / denn wenn zu weilen ein Bräuer das Bier verwarloset / erdencket er Lügen / und bricht Ursach von andern Zäunen / auf daß die Schuld nicht ihm beygemessen werde / davon ich ein Exempel erzehlen will .Denn man wolle nur die absurdität erwegen	6590	48	97156-Schmidt__Johann_Georg.tsv
VMFIN	VMFIN		VMFIN	wollen		Ich	will	nachholen und sogleich eine Reihe Folgen hinzusetzen , die aus Theophron's System einer in sich selbst nothwendigen Wahrheit und Güte zu folgen scheinen .	Die Räder der Natur .Ich will nachholen und sogleich eine Reihe Folgen hinzusetzen , die aus Theophron's System einer in sich selbst nothwendigen Wahrheit und Güte zu folgen scheinen .Bedient er sich seiner in seiner reinen	824	1	61282-Herder__Johann_Gottfried.tsv
VMFIN	VMFIN		VMFIN	wollen		» Gewiß , Vater ; ich	will	sogar hinzufügen , daß die letzteren in der Mehrheit waren .	sich in unseren großen Fluß ergießt !» Gewiß , Vater ; ich will sogar hinzufügen , daß die letzteren in der Mehrheit waren .» Ja , « sagte sie .	6602	6	107522-Verne__Jules.tsv
VMFIN	VMFIN		VMFIN	wollen		« Der Lange trug sie hin und sprach » ich	wollte	ihn wohl herausholen , wenn ich ihn nur sehen könnte .	geholt werden , nun schafft Rat .« Der Lange trug sie hin und sprach » ich wollte ihn wohl herausholen , wenn ich ihn nur sehen könnte .» Daß du mir einen Ring herbeibringst	31	10	50958-Grimm__Jacob_und_Wilhelm.tsv