DTA-Tag	TT-Tag	MM-TAg	Perceptron-Tag	Lemma	newtag	Prefix	Wort	Suffix	Sentence_neighborhood	sentence_index	index	filename
VAIMP	NN		VAFIN	sein			Sei	getrost liebe Seele , sei getrost du Welt , dir ist viel vom Herren verheißen .	ich Gericht halte über mich selbst !Sei getrost liebe Seele , sei getrost du Welt , dir ist viel vom Herren verheißen .Kein Leiden , keine Reue , kein	400	0	5131-Arnim__Ludwig_Achim_von.tsv
VAIMP	NE		VAFIN	sein		–	Sei	unbesorgt !	Warum fragst du denn so ängstlich ?– Sei unbesorgt !Ulrike .	6838	1	110118-Wezel__Johann_Karl.tsv
VAIMP	NN		VAFIN	sein			Sei	herzlich bedankt für dein freundliches Gedenken – und für den Topf .	kommt auch ein neues Jahr herangeschlichen .Sei herzlich bedankt für dein freundliches Gedenken – und für den Topf .Ich sehe die Lichter bei euch ,	7	0	17068-Busch__Wilhelm.tsv
VAIMP	NE		VAFIN	sein			Sei	ruhig , der Reinhard hat so lange an mir bittet und zerrt , daß ich jetzt zu euch nach der Stadt geh' .	Dürfet Ihr 's nicht sagen ?Sei ruhig , der Reinhard hat so lange an mir bittet und zerrt , daß ich jetzt zu euch nach der Stadt geh' .« » Nun , was ist 's	1300	0	5246-Auerbach__Berthold.tsv
VAIMP	NE		VAFIN	sein		« – » Gott segne eueren Bund , Kinder « – » Gratuliere herzlichst , Vetter « – »	Sei	glücklich , Schwester « und so weiter und so weiter .	gewaltsam niedergeworfen und mit Grabeserde überschaufelt .« – » Gott segne eueren Bund , Kinder « – » Gratuliere herzlichst , Vetter « – » Sei glücklich , Schwester « und so weiter und so weiter .Nein .	6537	19	102345-Suttner__Bertha_von.tsv
VAIMP	NN		VAIMP	sein		»	Seid	willkommen !	» Zeiten der Prüfung !» Seid willkommen !« Frau Hadwig reichte ihm bewegt vom	1010	1	95187-Scheffel__Joseph_Viktor_von.tsv
VAIMP	NN		VAIMP	sein			Seid	ihr blind geworden , da ihr die Spur eines Menschen nicht mehr zu sehen vermögt ?	Laß uns also wieder vorwärts machen !Seid ihr blind geworden , da ihr die Spur eines Menschen nicht mehr zu sehen vermögt ?Ich weiß jetzt , daß wir den	4855	0	79310-May__Karl.tsv
VAIMP	NN		VAIMP	sein			Seid	Ihr es wirklich , Sihdi ?	erkannte mich und griff zum Yatagan .Seid Ihr es wirklich , Sihdi ?« Bei dem Klange der fremden Stimme	227	0	79378-May__Karl.tsv
VAIMP	NN		VAIMP	sein			Seid	Ihr bei Troste mit Euern Gevattern und Truhen ?	Wo siehst du hier eine Truhe ?Seid Ihr bei Troste mit Euern Gevattern und Truhen ?» Was ist dir ?	105	0	6209-Balzac__Honor__de.tsv
VAIMP	NE		VAIMP	sein		Und dann – was hatte sie der sterbenden Mutter gelobt ?! »	Seid	ruhig , Miriam , und sagt es auch Eurem armen Mann , wenn Ihr ihn drüben wiederseht : aus Eurem Sender wird kein › Schnorrer ‹ , solang die Rosel die Augen offen hat .	sich auch diesen seltsamen Wandertrieb erklären .Und dann – was hatte sie der sterbenden Mutter gelobt ?! » Seid ruhig , Miriam , und sagt es auch Eurem armen Mann , wenn Ihr ihn drüben wiederseht : aus Eurem Sender wird kein › Schnorrer ‹ , solang die Rosel die Augen offen hat .Nicht wahr , Reb Itzig ?	2311	12	26919-Franzos__Karl_Emil.tsv
VAIMP	NN		VAIMP	sein		‹	Seid	ihr dann nach eurem Vorgeben teutsch , warum redet ihr französische Fratzen in eurem Gespräche ?	die alte Glückseligkeit von uns gerücket .‹ Seid ihr dann nach eurem Vorgeben teutsch , warum redet ihr französische Fratzen in eurem Gespräche ?Ach , ihr guten Freunde , ich	1163	1	11286-Beer__Johann.tsv
VAIMP	NN		VAIMP	sein			Seid	Ihr denn Kannibalen , oder habt Ihr Herzen von Stein , daß Euch das schöne Weib nicht rührt , daß in ungeheurer Langenweile mit ihrer bête noire von Mann ihre Rosentage verträumt ?	Das war auch nicht Ihre Meinung .Seid Ihr denn Kannibalen , oder habt Ihr Herzen von Stein , daß Euch das schöne Weib nicht rührt , daß in ungeheurer Langenweile mit ihrer bête noire von Mann ihre Rosentage verträumt ?Der Lauf der Kugeln ist zweifelhaft .	19208	0	966-Alexis__Willibald.tsv
VAIMP	NN		VAFIN	sein			Seid	alle , alle verflucht , und – – – « » Nach der Ain Bahrid , « antwortete ich .	, nur euch , euch allein !Seid alle , alle verflucht , und – – – « » Nach der Ain Bahrid , « antwortete ich .« » Hund , schau nicht her	8151	0	79321-May__Karl.tsv
VAIMP	NN		VAIMP	sein			Seid	nicht demütig , seid nicht blöde , seid nicht schwach !	alle Bürger sollen sich zugleich hervorstellen .Seid nicht demütig , seid nicht blöde , seid nicht schwach !Tut das nicht , setzt euch selbst	9060	0	6289-B_rne__Ludwig.tsv
VAIMP	NN		VAIMP	sein		»	Seid	Ihr treu und verschwiegen , so könnt Ihr auf den Capitain rechnen , bei dem geringsten Zeichen von Verrath aber seit Ihr verloren , dafür ist gesorgt .	Kampf begann nun hier von Neuem .» Seid Ihr treu und verschwiegen , so könnt Ihr auf den Capitain rechnen , bei dem geringsten Zeichen von Verrath aber seit Ihr verloren , dafür ist gesorgt .« » Sinne einmal nach !	1901	1	79367-May__Karl.tsv
VAIMP	NN		VAIMP	sein		»	Seid	ihr denn nicht mit einander fortgelaufen ?	und mittags und abends wieder hinein .» Seid ihr denn nicht mit einander fortgelaufen ?Er gewöhnte sich daran und nahm den	635	1	99445-Stifter__Adalbert.tsv
VAIMP	NE		VAIMP	sein		« »	Seid	Ihr des Teufels !	mit diesem Ausspruche sind , Sir !« » Seid Ihr des Teufels !Die andern Soldaten warfen auch überraschte ,	4431	2	79400-May__Karl.tsv
VAIMP	NN		VAIMP	sein		Da rief Marcus mit starker Stimme : »	Seid	gesegnet , Herr , um dieser Worte willen .	schimmerte im Lichte ein blutroter Stein .Da rief Marcus mit starker Stimme : » Seid gesegnet , Herr , um dieser Worte willen .» Er ist es « , sprach	26511	8	27046-Freytag__Gustav.tsv
VAIMP	NN		VAIMP	sein		Word	Seid	mir alle schönstens gegrüßt !	mal wieder , mein lieber Fritz !Word Seid mir alle schönstens gegrüßt !Word Seid mir alle schönstens gegrüßt !	0	1	16386-Busch__Wilhelm.tsv
VAIMP	NN		VAIMP	sein		»	Seid	gut « ist eine Mahnung , die gewöhnlich mild gesäuselt oder ölig salbadert wird , Egidy donnerte es als Befehl hinaus .	fest , langsam , dröhnend laut .» Seid gut « ist eine Mahnung , die gewöhnlich mild gesäuselt oder ölig salbadert wird , Egidy donnerte es als Befehl hinaus .Ich hörte ihn zum erstenmal sprechen .	337	1	102347-Suttner__Bertha_von.tsv
VAIMP	NE		NE	sein		–	Sey	ruhig , ich beschwöre Dich ; sey ruhig !	, wenn sie zur Gewohnheit würden .– Sey ruhig , ich beschwöre Dich ; sey ruhig !– Ist das edel , wenn man	1075	1	24315-Ehrmann__Marianne.tsv
VAIMP	NE		NE	sein		–	Sey	ruhig , sagte er sanft , es ist nur leicht , und bald sind wir am Ziel .	Ihr seyd verwundet !– Sey ruhig , sagte er sanft , es ist nur leicht , und bald sind wir am Ziel .Er besitzt das Geheimniß , sich alle	184	1	110625-Wolzogen__Caroline_von.tsv
VAIMP	NE		NE	sein		Wunderns würdig ist vielmehr die Göttliche Langmut / daß Sie dem Satan nicht verhengt / solche Hurenhengste / nach vollbrachter Greuelthat / gleich auff Stücken zu zerreissen ; Es ist nicht lange / daß ein ruchloser fremder Trompeter / einem / bey abendlicher Zeit vor den Thüren schöne geistliche Lieder singendem / armen Weibe / mehr / als ein Mal / einige Müntze hinab warff / und endlich / überlaut ruffend / fragte :	Seyd	ihr eine Hur ?	es allhie nicht mit einmengen mag .Wunderns würdig ist vielmehr die Göttliche Langmut / daß Sie dem Satan nicht verhengt / solche Hurenhengste / nach vollbrachter Greuelthat / gleich auff Stücken zu zerreissen ; Es ist nicht lange / daß ein ruchloser fremder Trompeter / einem / bey abendlicher Zeit vor den Thüren schöne geistliche Lieder singendem / armen Weibe / mehr / als ein Mal / einige Müntze hinab warff / und endlich / überlaut ruffend / fragte : Seyd ihr eine Hur ?20 Und hiedurch / sollte man gedencken	6690	74	26907-Francisci__Erasmus.tsv
VAIMP	NE		NE	sein			Seyd	uns gegrüßt , schöne Bertha !	ging dreist in den Hof hinein .Seyd uns gegrüßt , schöne Bertha !Sie ging verschiedne Tage , und ruhte	141	0	11315-Bernhardi__Sophie.tsv
VAIMP	NE		NE	sein			Seyd	hoffnungs- , liebe- , glaubensvoll ; Und wenn gleich meine Mutter drei Hemde-Rubriken mehr während der Zeit erfunden hätte .	, nicht wahr , Herr Pastor ?Seyd hoffnungs- , liebe- , glaubensvoll ; Und wenn gleich meine Mutter drei Hemde-Rubriken mehr während der Zeit erfunden hätte .Man thut darum selbst nichts , und	17606	0	62295-Hippel__Theodor_Gottlieb_von.tsv