DTA-Tag	TT-Tag	MM-TAg	Perceptron-Tag	Lemma	newtag	Prefix	Wort	Suffix	Sentence_neighborhood	sentence_index	index	filename
VMFIN	VMFIN		VMFIN	dürfen		da in einer fabel bei Saxo gramm. p. 48 ein Horvendilus filius Gervendili vorkommt und ahd. der eigenname Kêrwentil ( Schm. 2 , 334 ) und Gêrentil ( trad. fuld. 2 , 106 ) , geir ( hasta ) aber besser zu ör stimmt als zu eyra ( auris ) , so	darf	die letzte erklärung auf beifall rechnenso legt auch Uhland ( über Thor s. 47 ff. ) aus , in Grôa sieht er wachsthum der saat , in Örvandill aufschießen des keims .	ist Wendel ein name des teufels .da in einer fabel bei Saxo gramm. p. 48 ein Horvendilus filius Gervendili vorkommt und ahd. der eigenname Kêrwentil ( Schm. 2 , 334 ) und Gêrentil ( trad. fuld. 2 , 106 ) , geir ( hasta ) aber besser zu ör stimmt als zu eyra ( auris ) , so darf die letzte erklärung auf beifall rechnenso legt auch Uhland ( über Thor s. 47 ff. ) aus , in Grôa sieht er wachsthum der saat , in Örvandill aufschießen des keims .soll Wendel auf die verwandlungen des flöteblasenden	11316	52	grimm_demyth_demyth.tsv
VMFIN	VMFIN		VMFIN	dürfen		Aber man	darf	sich da nicht vermessen , ich weiß , ich weiß .	.Aber man darf sich da nicht vermessen , ich weiß , ich weiß .Es gibt eine Stelle , wo das	6943	2	wasserma_mauriz_mauriz.tsv
VMFIN	VMFIN		VMFIN	können		Hei	kann	jo dor doch nicks vör , dat em Dörchläuchten nich ut sinen Löperdeinst gahn laten will .	dat Einzigste , wat hei kann .Hei kann jo dor doch nicks vör , dat em Dörchläuchten nich ut sinen Löperdeinst gahn laten will .– Ach , wo dat susen deiht	2620	1	reuter_doerchlt_doerchlt.tsv
VMFIN	VMFIN		VMFIN	können		» Mein Papa	kann	dich kaufen « , sagte Eva rasch , » und wenn er dich kauft , wirst du es gut haben .	Tieren über Lizzys Brücke zu reiten .» Mein Papa kann dich kaufen « , sagte Eva rasch , » und wenn er dich kauft , wirst du es gut haben .Master Haley braucht uns jetzt nicht mehr	5026	3	beecher_onkeltom_onkeltom.tsv
VMFIN	VMFIN		VMFIN	können		Dann aber sprach er rasch weiter : » Ich sagte schon , daß ich erst im Zusammenhange mit dieser Tat Kylons von Dingen Kenntnis erhielt , die mein Verstand nicht fassen	kann	.	jetzt das Letzte , das Furchtbarste !Dann aber sprach er rasch weiter : » Ich sagte schon , daß ich erst im Zusammenhange mit dieser Tat Kylons von Dingen Kenntnis erhielt , die mein Verstand nicht fassen kann .« erwiderte der Ephebe .	4040	31	colerus_pythagor_pythagor.tsv
VMFIN	VMFIN		VMFIN	können		Der Ton keines Menschen und keines Thieres	kann	eine Vorstellung von dem Lärmen geben , welches sich in diese Aufregung des Meeres mischte .	Höhe , Fluthen in der Tiefe .Der Ton keines Menschen und keines Thieres kann eine Vorstellung von dem Lärmen geben , welches sich in diese Aufregung des Meeres mischte .Unendlicher Schaum bespritzte alle Felsen .	3855	7	hugo_meerarbe_meerarbe.tsv
VMFIN	VMFIN		VMFIN	können		Leichtfüßig schritt sie den Gang entlang , um ihren Cousin nicht zu wecken ; doch	konnte	sie sich nicht enthalten , vor seiner Tür stehenzubleiben und seinen regelmäßigen Atemzügen zu lauschen .	« sagte Vater Grandet .Leichtfüßig schritt sie den Gang entlang , um ihren Cousin nicht zu wecken ; doch konnte sie sich nicht enthalten , vor seiner Tür stehenzubleiben und seinen regelmäßigen Atemzügen zu lauschen .– nichts !	4296	15	balzac_eugenie_eugenie.tsv
VMFIN	VMFIN		VMFIN	können		Wol verstehe ich nicht , wie ich Dir Schrecken einflößen	konnte	– aber ich habe ja kein Recht , Dir angenehm zu sein – und vielleicht , weil Du mich nicht bei der Fürstin erwartetest – – « Nur einmal führten sie das Gespräch , was jetzt folgte , und deshalb heben wir es aus den täglichen Erzählungen hervor , da es hinreichend zeigt , wie nah sich Guntram den Knaben hatte kommen lassen , wie dieser ihm zum Vertrauten heran gewachsen war .	, daß Du ruhig sein willst .Wol verstehe ich nicht , wie ich Dir Schrecken einflößen konnte – aber ich habe ja kein Recht , Dir angenehm zu sein – und vielleicht , weil Du mich nicht bei der Fürstin erwartetest – – « Nur einmal führten sie das Gespräch , was jetzt folgte , und deshalb heben wir es aus den täglichen Erzählungen hervor , da es hinreichend zeigt , wie nah sich Guntram den Knaben hatte kommen lassen , wie dieser ihm zum Vertrauten heran gewachsen war .« » Aber die , « fuhr	2332	10	paalzow_thyrnau1_thyrnau1.tsv
VMFIN	VMFIN		VMFIN	können		Nur mit Mühe	konnte	ihn der Fürst dazu bewegen , Mascha nichts davon merken zu lassen , daß er über ihren Brief unterrichtet sei .	Herr keine eigenen Leute gehabt hätte !Nur mit Mühe konnte ihn der Fürst dazu bewegen , Mascha nichts davon merken zu lassen , daß er über ihren Brief unterrichtet sei .Notwendig , einen Heiden zum Erzieher zu	1199	3	puschkin_postmeis_postmeis.tsv
VMFIN	VMFIN		VMFIN	können		Es war draußen vor unserm Felseneinschnitte so dunkel , daß wir die beiden Komantschen , obgleich sie höchstens drei Meter von uns entfernt lagen , kaum sehen	konnten	.	wurde der Himmel für uns sichtbar .Es war draußen vor unserm Felseneinschnitte so dunkel , daß wir die beiden Komantschen , obgleich sie höchstens drei Meter von uns entfernt lagen , kaum sehen konnten .» Wo pflegt sie zu schlafen ?	6960	27	may_satan3_0inhalt.tsv
VMFIN	VMFIN		VMFIN	können		» Welch eine grauenhafte Macht diese Furcht im Leben der Heiden bedeutet ,	können	wir , die wir uns in Gottes Hand sicher wissen , nicht ausdenken .	als die Ahnherrin der gotischen Kathedrale .» Welch eine grauenhafte Macht diese Furcht im Leben der Heiden bedeutet , können wir , die wir uns in Gottes Hand sicher wissen , nicht ausdenken .Gottes Wege sind unerforschlich .	2189	13	ernstp_credo_credo.tsv
VMFIN	VMFIN		VMFIN	können		Zuerst müsset Ihr nun Euch nicht überheben und etwa einen hochmütigen Groll auf das Erlittene begründen , welcher Euch für das ganze Leben schädlich sein	könnte	!	wo sein Witz das Bein brach .Zuerst müsset Ihr nun Euch nicht überheben und etwa einen hochmütigen Groll auf das Erlittene begründen , welcher Euch für das ganze Leben schädlich sein könnte !Besonders Dorothea wußte ihn mit der leichtesten	7517	25	keller_heinric1_heinric1.tsv
VMFIN	VMFIN		VMFIN	mögen		» Wahr und wahrhaftig , meine Tugend	mag	nicht zu Fuß gehen .	, die Moral in Handlungen umzusetzen !» Wahr und wahrhaftig , meine Tugend mag nicht zu Fuß gehen .« rief Émile , als er sah	4575	7	balzac_chagrinl_chagrinl.tsv
VMFIN	VMFIN		VMFIN	müssen		Schöneren Gewinn könnte das Kreuz nicht – « Sie warf nur leicht die Achsel zurück : » Wer arm ist ,	muß	dienen « , und ergriff einen der Spielstäbe .	er mit besonderer Liebe daran hänge .Schöneren Gewinn könnte das Kreuz nicht – « Sie warf nur leicht die Achsel zurück : » Wer arm ist , muß dienen « , und ergriff einen der Spielstäbe .Ich bat zur heiligen Jungfrau , mich	1194	21	jensen_hansa3_hansa3.tsv
VMFIN	VMFIN		VMFIN	müssen		16. Denn wo ein Testament ist , da	muß	der Tod geschehen des , der das Testament machte .	ihr , daß ich euch tue ?16. Denn wo ein Testament ist , da muß der Tod geschehen des , der das Testament machte .Sie antworteten und sprachen zum König :	29129	8	luther_bibel_bibel.tsv
VMFIN	VMFIN		VMFIN	müssen		Durch den Geldumlaufszwang , wie ihn das Freigeld bedingt , wird ferner : Ich	muß	gestehen , das Krämergeschäft wird durch das Freigeld gewaltig vereinfacht .	, bedeutet sie Nachfrage nach Geld .Durch den Geldumlaufszwang , wie ihn das Freigeld bedingt , wird ferner : Ich muß gestehen , das Krämergeschäft wird durch das Freigeld gewaltig vereinfacht .Aber das Angebot von Waren hängt ,	2082	14	gesell_freiland_freiland.tsv
VMFIN	VMFIN		VMFIN	müssen		Ich	mußte	ihn bei schönem Wetter auf allen kleinen Lustfahrten begleiten .	bedarf es mehr zu unserm Troste ?Ich mußte ihn bei schönem Wetter auf allen kleinen Lustfahrten begleiten .Und wir sind in Gott , wir	834	1	zschokke_alamont_alamont.tsv
VMFIN	VVFIN		VMFIN	müssen		Zuerst	müsset	Ihr nun Euch nicht überheben und etwa einen hochmütigen Groll auf das Erlittene begründen , welcher Euch für das ganze Leben schädlich sein könnte !	wo sein Witz das Bein brach .Zuerst müsset Ihr nun Euch nicht überheben und etwa einen hochmütigen Groll auf das Erlittene begründen , welcher Euch für das ganze Leben schädlich sein könnte !Besonders Dorothea wußte ihn mit der leichtesten	7517	1	keller_heinric1_heinric1.tsv
VMFIN	VMFIN		VMFIN	sollen		Es handelt sich nur darum , wann und wie es g'macht werden	soll	.	nicht anders als Sejad ifjal genannt .Es handelt sich nur darum , wann und wie es g'macht werden soll .» Den sagt er nicht .	2528	12	may_sklaven_0inhalt.tsv
VMFIN	VMFIN		VMFIN	sollen		» Wie , Väterchen , das	soll	nicht Dubrowskij sein ?	zu erscheinen .» Wie , Väterchen , das soll nicht Dubrowskij sein ?« Der Abend war dunkel , der	1319	6	puschkin_erzaehlg_dubrowsk.tsv
VMFIN	VMFIN		VMFIN	sollen		« » Hätt's lieber auch verkaufen	sollen	, die Liegenschaften von meinem seligen Weib , « sagte er , » die Wirtschaft ist unter fremden Händen nicht besser geworden ; alle Jahr' einmal hinreisen , das ist zu weit .	Der mußte auf der Stelle abdanken .« » Hätt's lieber auch verkaufen sollen , die Liegenschaften von meinem seligen Weib , « sagte er , » die Wirtschaft ist unter fremden Händen nicht besser geworden ; alle Jahr' einmal hinreisen , das ist zu weit .Das Meer lag in matter Bläue ,	1594	6	rosegger_abelsber_abelsber.tsv
VMFIN	VMFIN		VMFIN	sollen		Er tröstete und beruhigte sie , rief die bewaffneten Diener herbei und sagte ihnen nochmals , wie die Reise gehen und wo sie Halt machen , die Nacht ausruhen und nirgend länger verweilen	sollten	, als es , um die Pferde ruhen zu lassen , notwendig sei .	den Unsinn der Alten zu entschuldigen .Er tröstete und beruhigte sie , rief die bewaffneten Diener herbei und sagte ihnen nochmals , wie die Reise gehen und wo sie Halt machen , die Nacht ausruhen und nirgend länger verweilen sollten , als es , um die Pferde ruhen zu lassen , notwendig sei .Labitte hatte indessen in seinem Gefängnisse ,	1630	33	tieck_hexen_hexen.tsv
VMFIN	VMFIN		FM	wollen		Hei kann jo dor doch nicks vör , dat em Dörchläuchten nich ut sinen Löperdeinst gahn laten	will	.	dat Einzigste , wat hei kann .Hei kann jo dor doch nicks vör , dat em Dörchläuchten nich ut sinen Löperdeinst gahn laten will .– Ach , wo dat susen deiht	2620	17	reuter_doerchlt_doerchlt.tsv
VMFIN	VMFIN		VMFIN	wollen		» Schön Dank , « erwiderten einige , und der Jäger fuhr leiser zu Tonele fort : Der Hansjörg hatte sich von dem Erath seinen Finger in einem mit Spiritus gefüllten Glase aufbewahren lassen , er	wollte	dies dem Kätherle schenken ; aber trotz seiner sonstigen Derbheit fürchtete sich das Mädchen davor , wie vor einem Gespenste , es wagte kaum das Glas anzurühren .	die Hände über dem Kopfe zusammen .» Schön Dank , « erwiderten einige , und der Jäger fuhr leiser zu Tonele fort : Der Hansjörg hatte sich von dem Erath seinen Finger in einem mit Spiritus gefüllten Glase aufbewahren lassen , er wollte dies dem Kätherle schenken ; aber trotz seiner sonstigen Derbheit fürchtete sich das Mädchen davor , wie vor einem Gespenste , es wagte kaum das Glas anzurühren .Es sah den blutenden Knaben , nahm	2003	36	auerbach_dorfg01_dorfg01.tsv
VMFIN	VMFIN		VMFIN	wollen		Die Schüler galoppierten hinterdrein und zwangen die Vorübergehenden , sich an die Häuser zu drücken , wenn sie nicht umgeworfen werden	wollten	; die Kaufleute erschienen erschreckt in den Türen , sie meinten , eine Revolution sei ausgebrochen .	und warf sich in die Brandstraße .Die Schüler galoppierten hinterdrein und zwangen die Vorübergehenden , sich an die Häuser zu drücken , wenn sie nicht umgeworfen werden wollten ; die Kaufleute erschienen erschreckt in den Türen , sie meinten , eine Revolution sei ausgebrochen .Die Schar hatte , ohne den Gang	4527	21	zola_kunstwer_kunstwer.tsv