DTA-Tag	TT-Tag	MM-TAg	Perceptron-Tag	Lemma	newtag	Prefix	Wort	Suffix	Sentence_neighborhood	sentence_index	index	filename
$.	$.		$.	!		Die Sucht , recht ätherisch und erhaben zu werden , hat die Flachheit geboren ; es ist Alles kahl , glatt , sogar solid langweilig geworden	!		genommen für innere und äußere Ausbildung ?Die Sucht , recht ätherisch und erhaben zu werden , hat die Flachheit geboren ; es ist Alles kahl , glatt , sogar solid langweilig geworden !Liebe ist nicht denkbar ohne Hingebung ,	5462	26	110547-Willkomm__Ernst_Adolf.tsv
$.	$.		$.	!		Ich beginne zur Ansicht der Männer zu neigen : Was für ein erbärmliches Ding ist doch Frauentugend	!		Stimme des Fleisches die des Geistes ?Ich beginne zur Ansicht der Männer zu neigen : Was für ein erbärmliches Ding ist doch Frauentugend !Vermag so ein plötzliches Aufwallen des Blutes	1786	17	27165-Gautier__Th_ophile.tsv
$.	$.		$.	.		Alt ist die Historie , bekannt ist die Geschicht ' , ausgeschrien ist die Begebenheit , welche sich mit dem guten Alt-Vater Noe zugetragen	.		O wehe , o wehe solchen !Alt ist die Historie , bekannt ist die Geschicht ' , ausgeschrien ist die Begebenheit , welche sich mit dem guten Alt-Vater Noe zugetragen .Volsäus zu Londen , Albericus zu Prag	3249	24	4-Abraham_a_Sancta_Clara.tsv
$.	$.		$.	.		Und gerade in diesem Augenblicke , wo ich seiner nicht dachte , fielen meine Augen auf Tilling	.		Warum läßt sich Tilling nicht sehen ?Und gerade in diesem Augenblicke , wo ich seiner nicht dachte , fielen meine Augen auf Tilling .Ich war doch froh , gekommen zu	4663	17	102345-Suttner__Bertha_von.tsv
$.	$.		$.	.		Es wurde sogar das Gerücht verbreitet , die Soldaten rissen die Häuser nieder , nicht um dem Feuer Einhalt zu tun , sondern um nichts von der Stadt übrig zu lassen	.		römischen Vergangenheit und des römischen Ruhmes .Es wurde sogar das Gerücht verbreitet , die Soldaten rissen die Häuser nieder , nicht um dem Feuer Einhalt zu tun , sondern um nichts von der Stadt übrig zu lassen .« Inzwischen fuhren die Soldaten , unterstützt	4656	31	98460-Sienkiewicz__Henryk.tsv
$.	$.		$.	.		B. T. Dunelm	.		, laßt mich nach Amerika gehen .B. T. Dunelm .Warum mußte er uns verlassen ?	1364	3	102347-Suttner__Bertha_von.tsv
$.	$.		$.	.		Er trug das Glöckchen in der Hand	.		» Ja .Er trug das Glöckchen in der Hand .« » Ja , « antwortete ich	1606	7	79398-May__Karl.tsv
$.	$.		$.	.		Es war doch alles mögliche , was diese Lena erreicht hatte , und eine gute Portion Fleiss und Tüchtigkeit gehörte bei allem Glück dazu , es so weit zu bringen	.		wenigen Monaten in Berlin schon gelernt .Es war doch alles mögliche , was diese Lena erreicht hatte , und eine gute Portion Fleiss und Tüchtigkeit gehörte bei allem Glück dazu , es so weit zu bringen .« wandte Lotte schüchtern ein .	1754	30	23055-Duncker__Dora.tsv
$.	$.		$.	.		Dieser Mann kann mich nicht beleidigen	.		welcher Horde er wohl gehören mag ?Dieser Mann kann mich nicht beleidigen .Das ist gut , sehr gut !	1217	6	79315-May__Karl.tsv
$.	$.		$.	.		Da sagte der Jäger Jürge : › Ach , bittet hier die gute alte Mutter , daß sie doch morgen mit dem Töchterlein ihrer seligen Base bei meinem Rechte zugegen sein mögen ; das wird mir das Herz stärken in meiner letzten Stunde	.		, er wolle mit ihm beten .Da sagte der Jäger Jürge : › Ach , bittet hier die gute alte Mutter , daß sie doch morgen mit dem Töchterlein ihrer seligen Base bei meinem Rechte zugegen sein mögen ; das wird mir das Herz stärken in meiner letzten Stunde .« Er hieß mich zu seiner Köchin	495	43	14643-Brentano__Clemens.tsv
$.	$.		$.	.		Denn wie er keinen Paßport bey dem Gouverneur auf zuweisen hatte / sagte dieser mit einer zwar höflichen doch unanständigen Mine ; er möchte sich so lange gedulten / biß auf gethanen Bericht andre Ordre deswegen vor Sr. Majestät einlieffe / weil ihm bey hoher Lebens-Straffe und sonder Betrachtung des Standes gebothen / diesen Befehl genau nachzukommen	.		die andern Gefangenen vor Renardens Zimmer .Denn wie er keinen Paßport bey dem Gouverneur auf zuweisen hatte / sagte dieser mit einer zwar höflichen doch unanständigen Mine ; er möchte sich so lange gedulten / biß auf gethanen Bericht andre Ordre deswegen vor Sr. Majestät einlieffe / weil ihm bey hoher Lebens-Straffe und sonder Betrachtung des Standes gebothen / diesen Befehl genau nachzukommen .Wie nun Rosantes seinen Fürstlichen Stand offenbahret	1374	57	64549-Hunold__Christian_Friedrich.tsv
$.	$.		$.	.		Serra , ein Meer-Fisch / hat seinen Nahmen von der That / dann Serra heißt ein Sägen : der Fisch aber solle auf dem Rucken so scharpffe Stachlen haben / daß / wann er unter einem Schiff herschwimmt / und sich an selbem sehr starck reibet / es durchschneiden möge	.		dritten Tag wird er uns auferwecken .Serra , ein Meer-Fisch / hat seinen Nahmen von der That / dann Serra heißt ein Sägen : der Fisch aber solle auf dem Rucken so scharpffe Stachlen haben / daß / wann er unter einem Schiff herschwimmt / und sich an selbem sehr starck reibet / es durchschneiden möge .Und dises ist / was der Prophet	8555	50	68510-Kobolt__Willibald.tsv
$.	$.		$.	.		Seine jugendfrische Schönheit übermannte sie , die wahre Liebe hielt ihren Einzug , und hätte nicht ihre königliche Majestät dem im Wege gestanden , so würde sie die verlockenden Bäckchen , die wie zweifrische Apfel schimmerten , sofort abgeküßt haben	.		Anmut eines zuckersüßen kleinen kichernden Backfischs .Seine jugendfrische Schönheit übermannte sie , die wahre Liebe hielt ihren Einzug , und hätte nicht ihre königliche Majestät dem im Wege gestanden , so würde sie die verlockenden Bäckchen , die wie zweifrische Apfel schimmerten , sofort abgeküßt haben .Er war schlank , aufrecht wie eine	12	40	6235-Balzac__Honor__de.tsv
$.	$.		$.	.		Wirklich wurden ihm zwei Jahre später einige Goldproben aus Neu-Süd-Wales zugesendet , und er entschied die Auswanderung einer großen Anzahl Arbeiter aus Cornwallis nach den Goldregionen Neu-Hollands	.		werden ihn wiederfinden , nicht wahr ?Wirklich wurden ihm zwei Jahre später einige Goldproben aus Neu-Süd-Wales zugesendet , und er entschied die Auswanderung einer großen Anzahl Arbeiter aus Cornwallis nach den Goldregionen Neu-Hollands .erwiderte Paganel , und rieb sie heftig	1071	27	107493-Verne__Jules.tsv
$.	$.		$.	.		Das Rotwerden war nun an mir , und ich sagte nichts mehr während der übrigen Zeit , die man am Tische zubrachte	.		aus Reue gern den Knochen verschlungen .Das Rotwerden war nun an mir , und ich sagte nichts mehr während der übrigen Zeit , die man am Tische zubrachte .Ich behielt nun freilich wieder recht in	2678	22	66066-Keller__Gottfried.tsv
$.	$.		$.	.		So kam er mit würdigem Anstande herbei , der Herzogin die Hand zu küssen , die indessen ihren Gemahl , den Herzog , hatte rufen lassen , dem sie , während Don Quixote näher kam , seine Abgesandtschaft erzählte ; und da beide den ersten Teil dieser Historie gelesen hatten und daraus die wunderliche Sinnesart des Don Quixote kannten , so erwarteten sie ihn mit dem größten Vergnügen und der heftigsten Neugier , indem sie sich vornahmen , seiner Laune zu folgen und in allem , was er sagen würde , mit ihm übereinzustimmen , ihn , solange er bei ihnen bliebe , ganz wie einen irrenden Ritter zu behandeln , mit allen jenen Zeremonien , die in den Ritterbüchern gebräuchlich sind , welche sie gelesen hatten und überdies sehr liebten	.		und Höflichkeit bis zum Himmel erhob .So kam er mit würdigem Anstande herbei , der Herzogin die Hand zu küssen , die indessen ihren Gemahl , den Herzog , hatte rufen lassen , dem sie , während Don Quixote näher kam , seine Abgesandtschaft erzählte ; und da beide den ersten Teil dieser Historie gelesen hatten und daraus die wunderliche Sinnesart des Don Quixote kannten , so erwarteten sie ihn mit dem größten Vergnügen und der heftigsten Neugier , indem sie sich vornahmen , seiner Laune zu folgen und in allem , was er sagen würde , mit ihm übereinzustimmen , ihn , solange er bei ihnen bliebe , ganz wie einen irrenden Ritter zu behandeln , mit allen jenen Zeremonien , die in den Ritterbüchern gebräuchlich sind , welche sie gelesen hatten und überdies sehr liebten .« versetzte Don Quixote , » wende	6146	131	17702-Cervantes_Saavedra__Miguel_de.tsv
$.	$.		$.	.		Då drap et sik , dat dem huinen de lampe iutgonk	.		'e : » Ik saihe lecht .Då drap et sik , dat dem huinen de lampe iutgonk .Då sach de hane : » Ik	8	11	71463-Kuhn__Adalbert.tsv
$.	$.		$.	:		Da sagte der Jäger Jürge	:	› Ach , bittet hier die gute alte Mutter , daß sie doch morgen mit dem Töchterlein ihrer seligen Base bei meinem Rechte zugegen sein mögen ; das wird mir das Herz stärken in meiner letzten Stunde .	, er wolle mit ihm beten .Da sagte der Jäger Jürge : › Ach , bittet hier die gute alte Mutter , daß sie doch morgen mit dem Töchterlein ihrer seligen Base bei meinem Rechte zugegen sein mögen ; das wird mir das Herz stärken in meiner letzten Stunde .« Er hieß mich zu seiner Köchin	495	5	14643-Brentano__Clemens.tsv
$.	$.		$.	:		Ich beginne zur Ansicht der Männer zu neigen	:	Was für ein erbärmliches Ding ist doch Frauentugend !	Stimme des Fleisches die des Geistes ?Ich beginne zur Ansicht der Männer zu neigen : Was für ein erbärmliches Ding ist doch Frauentugend !Vermag so ein plötzliches Aufwallen des Blutes	1786	8	27165-Gautier__Th_ophile.tsv
$.	$.		$.	:		Serra , ein Meer-Fisch / hat seinen Nahmen von der That / dann Serra heißt ein Sägen	:	der Fisch aber solle auf dem Rucken so scharpffe Stachlen haben / daß / wann er unter einem Schiff herschwimmt / und sich an selbem sehr starck reibet / es durchschneiden möge .	dritten Tag wird er uns auferwecken .Serra , ein Meer-Fisch / hat seinen Nahmen von der That / dann Serra heißt ein Sägen : der Fisch aber solle auf dem Rucken so scharpffe Stachlen haben / daß / wann er unter einem Schiff herschwimmt / und sich an selbem sehr starck reibet / es durchschneiden möge .Und dises ist / was der Prophet	8555	17	68510-Kobolt__Willibald.tsv
$.	$.		$.	;		Da sagte der Jäger Jürge : › Ach , bittet hier die gute alte Mutter , daß sie doch morgen mit dem Töchterlein ihrer seligen Base bei meinem Rechte zugegen sein mögen	;	das wird mir das Herz stärken in meiner letzten Stunde .	, er wolle mit ihm beten .Da sagte der Jäger Jürge : › Ach , bittet hier die gute alte Mutter , daß sie doch morgen mit dem Töchterlein ihrer seligen Base bei meinem Rechte zugegen sein mögen ; das wird mir das Herz stärken in meiner letzten Stunde .« Er hieß mich zu seiner Köchin	495	32	14643-Brentano__Clemens.tsv
$.	$.		$.	;		Die Sucht , recht ätherisch und erhaben zu werden , hat die Flachheit geboren	;	es ist Alles kahl , glatt , sogar solid langweilig geworden !	genommen für innere und äußere Ausbildung ?Die Sucht , recht ätherisch und erhaben zu werden , hat die Flachheit geboren ; es ist Alles kahl , glatt , sogar solid langweilig geworden !Liebe ist nicht denkbar ohne Hingebung ,	5462	14	110547-Willkomm__Ernst_Adolf.tsv
$.	$.		$.	;		Denn wie er keinen Paßport bey dem Gouverneur auf zuweisen hatte / sagte dieser mit einer zwar höflichen doch unanständigen Mine	;	er möchte sich so lange gedulten / biß auf gethanen Bericht andre Ordre deswegen vor Sr. Majestät einlieffe / weil ihm bey hoher Lebens-Straffe und sonder Betrachtung des Standes gebothen / diesen Befehl genau nachzukommen .	die andern Gefangenen vor Renardens Zimmer .Denn wie er keinen Paßport bey dem Gouverneur auf zuweisen hatte / sagte dieser mit einer zwar höflichen doch unanständigen Mine ; er möchte sich so lange gedulten / biß auf gethanen Bericht andre Ordre deswegen vor Sr. Majestät einlieffe / weil ihm bey hoher Lebens-Straffe und sonder Betrachtung des Standes gebothen / diesen Befehl genau nachzukommen .Wie nun Rosantes seinen Fürstlichen Stand offenbahret	1374	21	64549-Hunold__Christian_Friedrich.tsv
$.	$.		$.	;		So kam er mit würdigem Anstande herbei , der Herzogin die Hand zu küssen , die indessen ihren Gemahl , den Herzog , hatte rufen lassen , dem sie , während Don Quixote näher kam , seine Abgesandtschaft erzählte	;	und da beide den ersten Teil dieser Historie gelesen hatten und daraus die wunderliche Sinnesart des Don Quixote kannten , so erwarteten sie ihn mit dem größten Vergnügen und der heftigsten Neugier , indem sie sich vornahmen , seiner Laune zu folgen und in allem , was er sagen würde , mit ihm übereinzustimmen , ihn , solange er bei ihnen bliebe , ganz wie einen irrenden Ritter zu behandeln , mit allen jenen Zeremonien , die in den Ritterbüchern gebräuchlich sind , welche sie gelesen hatten und überdies sehr liebten .	und Höflichkeit bis zum Himmel erhob .So kam er mit würdigem Anstande herbei , der Herzogin die Hand zu küssen , die indessen ihren Gemahl , den Herzog , hatte rufen lassen , dem sie , während Don Quixote näher kam , seine Abgesandtschaft erzählte ; und da beide den ersten Teil dieser Historie gelesen hatten und daraus die wunderliche Sinnesart des Don Quixote kannten , so erwarteten sie ihn mit dem größten Vergnügen und der heftigsten Neugier , indem sie sich vornahmen , seiner Laune zu folgen und in allem , was er sagen würde , mit ihm übereinzustimmen , ihn , solange er bei ihnen bliebe , ganz wie einen irrenden Ritter zu behandeln , mit allen jenen Zeremonien , die in den Ritterbüchern gebräuchlich sind , welche sie gelesen hatten und überdies sehr liebten .« versetzte Don Quixote , » wende	6146	39	17702-Cervantes_Saavedra__Miguel_de.tsv
$.	$.		$.	?		– Ei , lieber Alter , Ihr lebt also noch	?		jetzt und rief aus : Ei !– Ei , lieber Alter , Ihr lebt also noch ?rief er aus ; Du lügst !	1196	10	104913-Tieck__Ludwig.tsv