DTA-Tag	TT-Tag	MM-TAg	Perceptron-Tag	Lemma	newtag	Prefix	Wort	Suffix	Sentence_neighborhood	sentence_index	index	filename
PTKA	PTKA		PTKA	allzu		Die Schulphilosophie , welche jederzeit das Verdienst hat , alles dasjenige , wornach der Mensch nur fragen kann , nach angenommenen Grundsätzen , in einer beliebten Ordnung , unter bestimmten Rubriken vorzutragen , hatte sich durch das oft Dunkle und Unnützscheinende ihres Inhalts , durch unzeitige Anwendung einer an sich respektabeln Methode und durch die	allzu	große Verbreitung über so viele Gegenstände der Menge fremd , ungenießbar und endlich entbehrlich gemacht .	sich von Verlegern unabhängig zu machen .Die Schulphilosophie , welche jederzeit das Verdienst hat , alles dasjenige , wornach der Mensch nur fragen kann , nach angenommenen Grundsätzen , in einer beliebten Ordnung , unter bestimmten Rubriken vorzutragen , hatte sich durch das oft Dunkle und Unnützscheinende ihres Inhalts , durch unzeitige Anwendung einer an sich respektabeln Methode und durch die allzu große Verbreitung über so viele Gegenstände der Menge fremd , ungenießbar und endlich entbehrlich gemacht .Sie verglichen ihren eignen , sehr mäßigen	6437	55	32619-Goethe__Johann_Wolfgang.tsv
PTKA	PTKA		PTKA	allzu		Ich sollte zwar diesem Buche auch die Merkwürdigkeiten von allerhand Sachen , wie in meinem Studiosi Joviali beygesetzt haben ; weil es aber wider meine Meynung	allzu	groß angewachsen , so habe ich diese hieher gehörigen Merkwürdigkeiten ausgelassen , und aus selben ein besonders Buch , unter dem Titel : Nützliche Zeitanwendung ; oder Auszug der merkwürdigsten Sachen , von den Menschen , Thieren , vermischten Sachen , und unterschiedlichen Kunststücken machen müssen , welchem nun noch ein anders Werklein : Der vorsichtige und nach heutigem Geschmacke wohlerfahrne Speisemeister , sammt einer Anweisung zum Kochen , Tranchiren und einigen sonderheitlichen Komplimenten , mit beygefügten allgemeinen Tischregeln , nachgefolget ist .	Reprimande , Verweis , Ausscheltung .Ich sollte zwar diesem Buche auch die Merkwürdigkeiten von allerhand Sachen , wie in meinem Studiosi Joviali beygesetzt haben ; weil es aber wider meine Meynung allzu groß angewachsen , so habe ich diese hieher gehörigen Merkwürdigkeiten ausgelassen , und aus selben ein besonders Buch , unter dem Titel : Nützliche Zeitanwendung ; oder Auszug der merkwürdigsten Sachen , von den Menschen , Thieren , vermischten Sachen , und unterschiedlichen Kunststücken machen müssen , welchem nun noch ein anders Werklein : Der vorsichtige und nach heutigem Geschmacke wohlerfahrne Speisemeister , sammt einer Anweisung zum Kochen , Tranchiren und einigen sonderheitlichen Komplimenten , mit beygefügten allgemeinen Tischregeln , nachgefolget ist .Virtus post funera vivit .	1710	26	97256-Schreger__Odilo.tsv
PTKA	PTKA		APPRART	am		Natürlich gibt man dieser noch unbewohnten Ansiedlung gleich einen lockenden ,	am	liebsten recht patriotisch klingenden Namen , z.B. Neuwittelsbach , Neugermanien u. s.w .	einem Sumpfe , aus der Erde .Natürlich gibt man dieser noch unbewohnten Ansiedlung gleich einen lockenden , am liebsten recht patriotisch klingenden Namen , z.B. Neuwittelsbach , Neugermanien u. s.w .Da werden im Fabrikbetrieb gleich eine ganze	2496	11	18884-Conrad__Michael_Georg.tsv
PTKA	PTKA		PTKA	am		Das hat man selbst	am	ärgsten , am schlimmsten Feinde anzuerkennen und wird ihn , wenn es möglich ist , hiernach behandeln .	, konnte uns aber nicht verwundern .Das hat man selbst am ärgsten , am schlimmsten Feinde anzuerkennen und wird ihn , wenn es möglich ist , hiernach behandeln .Ich kann sagen , daß sie alle	1290	4	79323-May__Karl.tsv
PTKA	PTKA		PTKA	am		Aber Lärm muß dabei sein ,	am	liebsten Höllenlärm .	Liebe Kinder , diese Römer .Aber Lärm muß dabei sein , am liebsten Höllenlärm .Und das gefällt mir auch .	364	6	22499-Dohm__Hedwig.tsv
PTKA	PTKA		ADV	zu		Kaum bei Monbaça vorüber , sahen sie sich gezwungen , den Sam Raphael zu verbrennen , denn die Mannschaften waren	zu	sehr gelichtet , um drei Fahrzeuge zu bedienen .	neuen Kolonien jedenfalls unermeßliche Schätze bargen .Kaum bei Monbaça vorüber , sahen sie sich gezwungen , den Sam Raphael zu verbrennen , denn die Mannschaften waren zu sehr gelichtet , um drei Fahrzeuge zu bedienen .Am Ufer des Hayna-Flusses hatte ein Sklave	5274	20	107557-Verne__Jules.tsv
PTKA	PTKA		PTKA	zu		L*** war	zu	fein , um nicht alle Vortheile dieser Umstände bei Sara zu benuzen .	einigemal wiederholte , um so werther .L*** war zu fein , um nicht alle Vortheile dieser Umstände bei Sara zu benuzen .Seitdem schlich der Geist der Zwietracht eine	2417	2	64147-Huber__Therese.tsv
PTKA	PTKA		PTKA	zu		replicirte ich , ihr seyd von der gantzen Sache entweder gar zu viel oder gar	zu	wenig unterrichtet ; ich bin die erste Frau des van Steen , und habe noch niemahls einen andern Mann , als ihn , erkannt , auch hat mich der Himmel sonderlich davor bewahret , eines andern Kebs-Weib zu werden , wie es aber um eure eigene Ehre stehet , könnet ihr am allerbesten nachdencken und wissen .	ihr geschiedener mit mir zu verheyrathen .replicirte ich , ihr seyd von der gantzen Sache entweder gar zu viel oder gar zu wenig unterrichtet ; ich bin die erste Frau des van Steen , und habe noch niemahls einen andern Mann , als ihn , erkannt , auch hat mich der Himmel sonderlich davor bewahret , eines andern Kebs-Weib zu werden , wie es aber um eure eigene Ehre stehet , könnet ihr am allerbesten nachdencken und wissen .Ist ihnen etwa nicht wohl ?	1424	15	97159-Schnabel__Johann_Gottfried.tsv
PTKA	PTKA		PTKA	zu		Er aber eilte sogleich nach einer Landspitze an der Au und bat Björn , hinter ihn zu treten ; er dürfe sich aber nicht	zu	weit nach der Seite hin hervorwagen .	sich nieder , um zu schlafen .Er aber eilte sogleich nach einer Landspitze an der Au und bat Björn , hinter ihn zu treten ; er dürfe sich aber nicht zu weit nach der Seite hin hervorwagen .An der Skaptau theilten sie sich .	715	24	3448-Anonym.tsv
PTKA	PTKA		PTKA	zu		Es ist nicht immer der Fall , daß in dem gesunden Körper auch eine gesunde Seele wohnt und sie untergräbt nur	zu	oft , trotz aller Mittel , die äußerlich angewendet werden , von innen heraus die blühenden Wangen und die Fülle der jugendlichen Erscheinung .	spätere Lebensalter nach sich ziehen kann .Es ist nicht immer der Fall , daß in dem gesunden Körper auch eine gesunde Seele wohnt und sie untergräbt nur zu oft , trotz aller Mittel , die äußerlich angewendet werden , von innen heraus die blühenden Wangen und die Fülle der jugendlichen Erscheinung .Denn es gibt kleinere Vergehen , kleinere	65	21	10090-B_chner__Luise.tsv
PTKA	APPR		PTKA	zu		» Ich werde noch ganz andre Ungerechtigkeiten begehen müssen , wenn ich es	zu	etwas gebracht habe , und obendrein genötigt sein , sie hinter gefühlvoller Schönrederei zu verbergen .	» Das ist gar nichts !» Ich werde noch ganz andre Ungerechtigkeiten begehen müssen , wenn ich es zu etwas gebracht habe , und obendrein genötigt sein , sie hinter gefühlvoller Schönrederei zu verbergen .Betroffen sah Julian , was er angerichtet	6368	13	99250-Stendhal.tsv
PTKA	PTKA		PTKA	zu		Kein Zweifel , der » Saint Enoch « befand sich im Polargebiete jenseits der Meerenge ; um wie viele Grade über dem siebzigsten Breitengrade ... das konnte nur durch eine Beobachtung festgestellt werden , die zu der jetzt	zu	weit fortgeschrittenen Tageszeit leider unmöglich war .	wir ihn ohne große Mühe abfangen .Kein Zweifel , der » Saint Enoch « befand sich im Polargebiete jenseits der Meerenge ; um wie viele Grade über dem siebzigsten Breitengrade ... das konnte nur durch eine Beobachtung festgestellt werden , die zu der jetzt zu weit fortgeschrittenen Tageszeit leider unmöglich war .Als dann der » Iving « unter	580	38	107540-Verne__Jules.tsv
PTKA	PTKA		PTKA	zu		Dann zeichneten und rechneten sie weiter an ihren Wohnungs- und Ladenplänen , engagierten Personal und arrangierten Schaufenster , bis es für das Theater viel	zu	spät geworden war .	in dem sie ihren Kaffee tranken .Dann zeichneten und rechneten sie weiter an ihren Wohnungs- und Ladenplänen , engagierten Personal und arrangierten Schaufenster , bis es für das Theater viel zu spät geworden war .« Franz Krieger , So beschäftigt waren	175	24	23055-Duncker__Dora.tsv
PTKA	PTKA		PTKA	zu		Doch das getreueste Kostüm kann nicht die Originalgesichter ersetzen , und vertrödelte man sogar noch extra 100000 Taler für goldne Bischofsmützen , festonierte Chorhemden , buntgestickte Meßgewänder und ähnlichen Kram – so würden doch die protestantisch vernünftigen Nasen , die unter jenen Bischofsmützen hervorprotestieren , die dünnen denkgläubigen Beine , die aus den weißen Spitzen dieser Chorhemden herausgucken , die aufgeklärten Bäuche , denen jene Meßgewänder viel	zu	weit , alles würde unsereinen daran erinnern , daß keine katholische Geistliche , sondern Berliner Weltliche über die Bühne wandeln .	königlichen Opernhause zu Berlin gesehen hat .Doch das getreueste Kostüm kann nicht die Originalgesichter ersetzen , und vertrödelte man sogar noch extra 100000 Taler für goldne Bischofsmützen , festonierte Chorhemden , buntgestickte Meßgewänder und ähnlichen Kram – so würden doch die protestantisch vernünftigen Nasen , die unter jenen Bischofsmützen hervorprotestieren , die dünnen denkgläubigen Beine , die aus den weißen Spitzen dieser Chorhemden herausgucken , die aufgeklärten Bäuche , denen jene Meßgewänder viel zu weit , alles würde unsereinen daran erinnern , daß keine katholische Geistliche , sondern Berliner Weltliche über die Bühne wandeln .Zu diesem Zwecke muß man , wie	630	67	59691-Heine__Heinrich.tsv
PTKA	PTKA		PTKA	zu		« » Nein , denn dazu ist die Zeit	zu	kurz .	nur mit äußerster Vorsicht thun werden .« » Nein , denn dazu ist die Zeit zu kurz .Wenn sie bemerken , daß wir ihnen	8766	9	79312-May__Karl.tsv
PTKA	APPR		ADV	zu		Führt uns jene in eine unabsehbare Weite , so will uns diese	zu	sehr beschränken .	ihnen eher verschleiert als aufgedeckt ward .Führt uns jene in eine unabsehbare Weite , so will uns diese zu sehr beschränken .Da wir durch erstgedachte drei Männer in	2897	12	32618-Goethe__Johann_Wolfgang.tsv
PTKA	APPR		APPR	zu		Blind beherrscht vom Drange , sich bruchlos zu bekennen , war sein Beginn , sein Ende und Anfang von solch jungfräulicher , völlig kompromißloser Seelensauberkeit , das wir Nachwachsenden den Zweifel an der Pflicht	zu	revolutionär sittlichkeitsbildender Mutterschaft unserem annoch kraftlosen Streben nach einem Kosmos von Flugwillen und Erdüberwinderschaft als ein zwar unerläßliches , aber süßes Problem binnentragisch einzuordnen nicht können .	Schultern durch die Achselstücke seines Cutaway .Blind beherrscht vom Drange , sich bruchlos zu bekennen , war sein Beginn , sein Ende und Anfang von solch jungfräulicher , völlig kompromißloser Seelensauberkeit , das wir Nachwachsenden den Zweifel an der Pflicht zu revolutionär sittlichkeitsbildender Mutterschaft unserem annoch kraftlosen Streben nach einem Kosmos von Flugwillen und Erdüberwinderschaft als ein zwar unerläßliches , aber süßes Problem binnentragisch einzuordnen nicht können .Hermaphrodit vom Kopf bis zur Sohle .	674	34	6185-Ball__Hugo.tsv
PTKA	PTKA		PTKA	zu		Aber das wird	zu	arg !	daß sie nicht auseinanderfällt – so !Aber das wird zu arg !Nur dort hinter die Portière !	6588	3	99024-Spielhagen__Friedrich.tsv
PTKA	APPR		ADV	zu		Warum suchte ich nicht durch seine heilige Religion mich abzukühlen und in die selige Fassung zu setzen , in der ich jetzt bin , wo es , wie im Frühling , weder	zu	kalt noch zu warm ist ?	die Zunge an dem Gaumen klebte .Warum suchte ich nicht durch seine heilige Religion mich abzukühlen und in die selige Fassung zu setzen , in der ich jetzt bin , wo es , wie im Frühling , weder zu kalt noch zu warm ist ?ich wünschte nicht , noch solch einen	20573	32	62295-Hippel__Theodor_Gottlieb_von.tsv
PTKA	PTKZU		PTKA	zu		Warum suchte ich nicht durch seine heilige Religion mich abzukühlen und in die selige Fassung zu setzen , in der ich jetzt bin , wo es , wie im Frühling , weder zu kalt noch	zu	warm ist ?	die Zunge an dem Gaumen klebte .Warum suchte ich nicht durch seine heilige Religion mich abzukühlen und in die selige Fassung zu setzen , in der ich jetzt bin , wo es , wie im Frühling , weder zu kalt noch zu warm ist ?ich wünschte nicht , noch solch einen	20573	35	62295-Hippel__Theodor_Gottlieb_von.tsv
PTKA	APPR		PTKA	zu		Wie lange hat sich's nun schon hingezogen , daß die Mark einer Universität entbehrt , weil Euer erlauchter Vater von	zu	vielen andern kleinen lästigen Sorgen gedrückt war .	nicht mit andern Dingen daneben beschäftigen .Wie lange hat sich's nun schon hingezogen , daß die Mark einer Universität entbehrt , weil Euer erlauchter Vater von zu vielen andern kleinen lästigen Sorgen gedrückt war .« » Mein verdammter Mund , der	1902	20	965-Alexis__Willibald.tsv
PTKA	PTKA		PTKA	zu		Gott behüte mich vor der Qual der Reue , wenn sein Herz	zu	spät erwachte !	hierin mit ihm aufnehmen zu können .Gott behüte mich vor der Qual der Reue , wenn sein Herz zu spät erwachte !Sehr erstaunt sind meine Jungen über die	320	12	110384-Wildermuth__Ottilie.tsv
PTKA	PTKA		PTKA	zu		Die Rede war etwas	zu	pathetisch für den Kreis , in welchem sie wirken sollte , aber sie wirkte doch .	geht Euch das an , Tinkeles ?Die Rede war etwas zu pathetisch für den Kreis , in welchem sie wirken sollte , aber sie wirkte doch .Es ist ein weiter Weg , wir	9361	4	27044-Freytag__Gustav.tsv
PTKA	PTKZU		APPR	zu		Gesetzt auch / sie hätten ein wenig	zu	frey und scharff geredet / pflegt man denn eine Biene deßwegen wegzujagen / weil sie einen Stachel führt / und nicht vielmehr an sich zu locken / weil sie mit ihrem Honig uns nützen kan ?	sondern nach ihren Thaten schätzen muß .Gesetzt auch / sie hätten ein wenig zu frey und scharff geredet / pflegt man denn eine Biene deßwegen wegzujagen / weil sie einen Stachel führt / und nicht vielmehr an sich zu locken / weil sie mit ihrem Honig uns nützen kan ?Gnädigster Herr und Vater !	51308	7	78039-Lohenstein__Daniel_Casper_von.tsv
PTKA	APPR		PTKA	zu		Es war um fünfundzwanzig Jahre	zu	früh geboren .	hatte ; sie wollte ihn besitzen .Es war um fünfundzwanzig Jahre zu früh geboren .Er war ihr rätselhaft und unzugänglich ;	2311	5	108454-Wassermann__Jakob.tsv