DTA-Tag	TT-Tag	MM-TAg	Perceptron-Tag	Lemma	newtag	Prefix	Wort	Suffix	Sentence_neighborhood	sentence_index	index	filename
PAV	PROAV		PROAV	dabei		Als hochbedeutsamer Ersatz für die mir entzogene Möglichkeit , meine geistigen Kräfte in anderer Weise im Dienste der Menschheit zu verwerten und mir damit Ehre oder Ruhm vor Menschen zu erwerben , kommt	dabei	die Erkenntnis Gottes und göttlicher Dinge in Betracht , die ich durch die unausgesetzte Berührung mit göttlichen Strahlen erlangt habe .	zur Gewöhnung an derartige Vorstellungen zwingt .Als hochbedeutsamer Ersatz für die mir entzogene Möglichkeit , meine geistigen Kräfte in anderer Weise im Dienste der Menschheit zu verwerten und mir damit Ehre oder Ruhm vor Menschen zu erwerben , kommt dabei die Erkenntnis Gottes und göttlicher Dinge in Betracht , die ich durch die unausgesetzte Berührung mit göttlichen Strahlen erlangt habe .Demnach glaube ich für eine vielleicht nicht	266	33	schreber_nervenkr_nervenkr.tsv
PAV	PROAV		PROAV	dafür		» Zur Strafe	dafür	wurde ich in die Sotnie gesteckt .	Diese steckten das Geld schmunzelnd ein .» Zur Strafe dafür wurde ich in die Sotnie gesteckt .« Er legte zunächst so viel hin	10750	3	may_deuther5_deuther5.tsv
PAV	PROAV		PROAV	daher			Daher	seine Blässe und Nervosität , die schlaflose Nacht und die Aufregung am Morgen .	George hatte den großen Wurf getan .Daher seine Blässe und Nervosität , die schlaflose Nacht und die Aufregung am Morgen .” And Toady asked Briefless and his	917	0	thackera_2jahrma1_2jahrma1.tsv
PAV	PROAV		PROAV	dahin			Dahin	wurden die Pferde geführt .	, entlassen und das Tor geschlossen .Dahin wurden die Pferde geführt .« Als Cornelio aus der Stimme erkannte	5858	0	antholog_italnov2_italnov2.tsv
PAV	NE		PROAV	dahin		« »	Dahin	also führt die praktische Lebensweisheit ?	« » Ei !« » Dahin also führt die praktische Lebensweisheit ?» Nastignac , darf man dem Argwohn	5707	2	balzac_lebensb1_lebensb1.tsv
PAV	PROAV		PROAV	damit		Daß " Jehovah sprach zu Abram " , 1. Mose 12/1 , bedeutet die allererste Weisung ,	damit	hat es die Bewandtnis : Das Geschichtliche ist hier vorbildend , die Worte selbst aber sind ( sinnbildlich ) bezeichnend ; in der Alten Kirche war eine solche Ausdrucksweise , daß sie , wenn etwas wahr war , sagten : Jehovah sprach , oder Jehovah redete , und das bedeutet , es sei so ( wie früher gezeigt worden ) : nachdem aber die ( sinnbildlichen ) Bezeichnungen in Vorbildungen verwandelt worden waren , da redete Jehovah oder der Herr wirklich mit ihnen , und wenn dann gesagt wird : Jehovah sprach , oder Jehovah redete mit einem , so bedeutet es dasselbe wir früher .	, was ohne Erklärung erhellen kann .Daß " Jehovah sprach zu Abram " , 1. Mose 12/1 , bedeutet die allererste Weisung , damit hat es die Bewandtnis : Das Geschichtliche ist hier vorbildend , die Worte selbst aber sind ( sinnbildlich ) bezeichnend ; in der Alten Kirche war eine solche Ausdrucksweise , daß sie , wenn etwas wahr war , sagten : Jehovah sprach , oder Jehovah redete , und das bedeutet , es sei so ( wie früher gezeigt worden ) : nachdem aber die ( sinnbildlichen ) Bezeichnungen in Vorbildungen verwandelt worden waren , da redete Jehovah oder der Herr wirklich mit ihnen , und wenn dann gesagt wird : Jehovah sprach , oder Jehovah redete mit einem , so bedeutet es dasselbe wir früher .4711 .	38025	17	swedborg_mose1_mose1.tsv
PAV	PROAV		PROAV	damit		Als hochbedeutsamer Ersatz für die mir entzogene Möglichkeit , meine geistigen Kräfte in anderer Weise im Dienste der Menschheit zu verwerten und mir	damit	Ehre oder Ruhm vor Menschen zu erwerben , kommt dabei die Erkenntnis Gottes und göttlicher Dinge in Betracht , die ich durch die unausgesetzte Berührung mit göttlichen Strahlen erlangt habe .	zur Gewöhnung an derartige Vorstellungen zwingt .Als hochbedeutsamer Ersatz für die mir entzogene Möglichkeit , meine geistigen Kräfte in anderer Weise im Dienste der Menschheit zu verwerten und mir damit Ehre oder Ruhm vor Menschen zu erwerben , kommt dabei die Erkenntnis Gottes und göttlicher Dinge in Betracht , die ich durch die unausgesetzte Berührung mit göttlichen Strahlen erlangt habe .Demnach glaube ich für eine vielleicht nicht	266	23	schreber_nervenkr_nervenkr.tsv
PAV	PROAV		PROAV	danach		Meiner unglücklichen Tochter bleibt nur Einsamkeit und Zurückgezogenheit als einziges Heil übrig , und	danach	sehnt sie sich auch selbst .	, sie könnte seine Gefühle erraten .Meiner unglücklichen Tochter bleibt nur Einsamkeit und Zurückgezogenheit als einziges Heil übrig , und danach sehnt sie sich auch selbst .Aus der zarten Sorge , womit der	4446	14	bretonne_zeitgeno_zeitgeno.tsv
PAV	PROAV		PROAV	darauf			Darauf	verkündet ihr ein Engel , dass Gott ihr Gebet erhöre .	Thiere haben , sich zu erfreuen .Darauf verkündet ihr ein Engel , dass Gott ihr Gebet erhöre .Fünf Monate vergehen und Anna hat von	7222	0	ebert_litmitt3_litmitt3.tsv
PAV	PROAV		PROAV	darauf		« In diesem Augenblicke und während der Herzog mit dem , was vor seinen Augen vorging , zu sehr beschäftigt war , als daß er hätte	darauf	achten können , was hinter ihm geschah , schlich sich Oliver le Dain hinter den König und flüsterte ihm ins Ohr : » Es ist der Zigeuner Hayraddin Maugrabin !	« – » Amen !« In diesem Augenblicke und während der Herzog mit dem , was vor seinen Augen vorging , zu sehr beschäftigt war , als daß er hätte darauf achten können , was hinter ihm geschah , schlich sich Oliver le Dain hinter den König und flüsterte ihm ins Ohr : » Es ist der Zigeuner Hayraddin Maugrabin !– Nun denn , Dunois , so	3471	26	scott_quentind_quentind.tsv
PAV	PROAV		PROAV	daraus		Daß aber wirklich dieser Stein seine elektrische Polarität der ungleichförmigen Erregbarkeit ( durch Wärme ) verdankt , erhellt	daraus	, daß seine Pole , wenn er erkältet wird , ihre Elektrizitäten vertauschen ; daß also derjenige Pol , der durch positive Erwärmung negativ-elektrisch wurde , durch negative Erwärmung positiv-elektrisch wird .	seine Pole eine ungleiche Wärmekapazität haben .Daß aber wirklich dieser Stein seine elektrische Polarität der ungleichförmigen Erregbarkeit ( durch Wärme ) verdankt , erhellt daraus , daß seine Pole , wenn er erkältet wird , ihre Elektrizitäten vertauschen ; daß also derjenige Pol , der durch positive Erwärmung negativ-elektrisch wurde , durch negative Erwärmung positiv-elektrisch wird .Es ist gewiß , daß der Turmalin	36	18	schellin_weltseel_weltseel.tsv
PAV	PROAV		PROAV	darin		Besonders der Schluß läßt	darin	nichts zu wünschen übrig : › Wie wir hören , war diese von Herrn Professor Weber ganz neu entdeckte Berühmtheit längere Zeit Hauslehrer bei dem Sohne eines der ersten Grundbesitzer unsres Landes , mit dessen Erziehung sie aber durchaus kein glänzendes Resultat erzielte .	Er reichte ihm das Zeitungsblatt hin .Besonders der Schluß läßt darin nichts zu wünschen übrig : › Wie wir hören , war diese von Herrn Professor Weber ganz neu entdeckte Berühmtheit längere Zeit Hauslehrer bei dem Sohne eines der ersten Grundbesitzer unsres Landes , mit dessen Erziehung sie aber durchaus kein glänzendes Resultat erzielte .Einen Willen haben und ihn unter allen	4803	4	wernere_vineta_vineta.tsv
PAV	NN		PROAV	darum			Darum	hatte er beschlossen , die Grafschaft nicht in weltlichem Besitz zu lassen , sondern sie zum Troste seiner Seele einer geistlichen Herrschaft einzuverleiben .	sie sich in Demut beugen müßten .Darum hatte er beschlossen , die Grafschaft nicht in weltlichem Besitz zu lassen , sondern sie zum Troste seiner Seele einer geistlichen Herrschaft einzuverleiben .Bereits Odas ältester Bruder war kinderlos dahin	2590	0	wolff_raubgraf_raubgraf.tsv
PAV	NN		PROAV	darum			Darum	nehmen wir , wenn sich uns Gelegenheit dazu bietet , die Frauen und Töchter der Weißen gefangen und geben sie ihnen gegen ein Lösegeld zurück , für welches wir uns dann kaufen , was wir brauchen .	wir weder Estanzias noch Ranchos besitzen .Darum nehmen wir , wenn sich uns Gelegenheit dazu bietet , die Frauen und Töchter der Weißen gefangen und geben sie ihnen gegen ein Lösegeld zurück , für welches wir uns dann kaufen , was wir brauchen .« » Nun , kaufen können wir	11072	0	may_sendado2_sendado2.tsv
PAV	PROAV		PROAV	darum		Es handelt sich nur	darum	, wann und wie es g'macht werden soll .	nicht anders als Sejad ifjal genannt .Es handelt sich nur darum , wann und wie es g'macht werden soll .» Den sagt er nicht .	2528	4	may_sklaven_0inhalt.tsv
PAV	PROAV		PROAV	darüber		Der König geriet	darüber	in Zorn und schenkte sie einem seiner schwarzen Sklaven , dessen Oberlippe an dem Vorsprung der Nase vorbeiging und dessen Unterlippe auf den Halskragen herabhing ; bei dem Anblick seiner Gestalt wurde selbst die Hexe Sakhr krank , und aus seiner Achselhöhle roch es wie eines Pechquells Gestank .	Was kümmern ihn der Karawane Klagen ?Der König geriet darüber in Zorn und schenkte sie einem seiner schwarzen Sklaven , dessen Oberlippe an dem Vorsprung der Nase vorbeiging und dessen Unterlippe auf den Halskragen herabhing ; bei dem Anblick seiner Gestalt wurde selbst die Hexe Sakhr krank , und aus seiner Achselhöhle roch es wie eines Pechquells Gestank .So daß die Genossen den Finger bald	1433	3	sadi_rosengar_rosengar.tsv
PAV	PROAV		PROAV	davon		Das ist	davon	übrig geblieben !	Verstehst du ?Das ist davon übrig geblieben !» Das ist mein Larsenhof , Inge	4012	2	antholog_meistno2_meistno2.tsv
PAV	PROAV		PROAV	davor		« Zwei Pechfackeln schwankten langsam durch die Finsternis , im Winde wirbelnd und qualmend , auf das Tor zu und hielten zwanzig Schritt	davor	still .	von Madlene , des Wolframsteiners Hausfrau .« Zwei Pechfackeln schwankten langsam durch die Finsternis , im Winde wirbelnd und qualmend , auf das Tor zu und hielten zwanzig Schritt davor still .« hub Ritter Felix nach kurzer Weile	309	23	stratz_madlene_madlene.tsv
PAV	PROAV		PROAV	dazu		Also passen Sie auf , schreiben Sie alles richtig nach : Montag gibt es Speck , Hafergrütze und Kartoffeln , Dienstag : Hafergrütze , Kartoffeln und Speck , Mittwoch : Kartoffeln , Hafergrütze und Speck , Donnerstag : Speck , Kartoffeln und Hafergrütze , Freitag : Hafergrütze , Speck und Kartoffeln , Sonnabend : Kartoffeln , Speck und Hafergrütze , und am Sonntag werden die übriggebliebenen Reste aller dieser verschiedenen Mahlzeiten aufgewärmt , und	dazu	gibt es präserviertes Rindfleisch .	, gerade nach den Zelten zu .Also passen Sie auf , schreiben Sie alles richtig nach : Montag gibt es Speck , Hafergrütze und Kartoffeln , Dienstag : Hafergrütze , Kartoffeln und Speck , Mittwoch : Kartoffeln , Hafergrütze und Speck , Donnerstag : Speck , Kartoffeln und Hafergrütze , Freitag : Hafergrütze , Speck und Kartoffeln , Sonnabend : Kartoffeln , Speck und Hafergrütze , und am Sonntag werden die übriggebliebenen Reste aller dieser verschiedenen Mahlzeiten aufgewärmt , und dazu gibt es präserviertes Rindfleisch .« » Ich ?	3644	74	kraftr_vestali2_vestali2.tsv
PAV	PROAV		PROAV	dazu		Darum nehmen wir , wenn sich uns Gelegenheit	dazu	bietet , die Frauen und Töchter der Weißen gefangen und geben sie ihnen gegen ein Lösegeld zurück , für welches wir uns dann kaufen , was wir brauchen .	wir weder Estanzias noch Ranchos besitzen .Darum nehmen wir , wenn sich uns Gelegenheit dazu bietet , die Frauen und Töchter der Weißen gefangen und geben sie ihnen gegen ein Lösegeld zurück , für welches wir uns dann kaufen , was wir brauchen .« » Nun , kaufen können wir	11072	8	may_sendado2_sendado2.tsv
PAV	PROAV		PROAV	deshalb		Wol verstehe ich nicht , wie ich Dir Schrecken einflößen konnte – aber ich habe ja kein Recht , Dir angenehm zu sein – und vielleicht , weil Du mich nicht bei der Fürstin erwartetest – – « Nur einmal führten sie das Gespräch , was jetzt folgte , und	deshalb	heben wir es aus den täglichen Erzählungen hervor , da es hinreichend zeigt , wie nah sich Guntram den Knaben hatte kommen lassen , wie dieser ihm zum Vertrauten heran gewachsen war .	, daß Du ruhig sein willst .Wol verstehe ich nicht , wie ich Dir Schrecken einflößen konnte – aber ich habe ja kein Recht , Dir angenehm zu sein – und vielleicht , weil Du mich nicht bei der Fürstin erwartetest – – « Nur einmal führten sie das Gespräch , was jetzt folgte , und deshalb heben wir es aus den täglichen Erzählungen hervor , da es hinreichend zeigt , wie nah sich Guntram den Knaben hatte kommen lassen , wie dieser ihm zum Vertrauten heran gewachsen war .« » Aber die , « fuhr	2332	50	paalzow_thyrnau1_thyrnau1.tsv
PAV	ADJA		PROAV	hierzu		Er schrieb also die Adresse auf das kleine Kärtchen und steckte dies in einen	hierzu	bestimmten Rahmen im Innern der Tür .	je zwei beliebigen Stationen sofort finden .Er schrieb also die Adresse auf das kleine Kärtchen und steckte dies in einen hierzu bestimmten Rahmen im Innern der Tür .Es fand sich da das Meisterwerk statistischer	1067	14	lasswitz_auf2plan_auf2plan.tsv
PAV	PROAV		PROAV	trotzdem			Trotzdem	, daß der Bonapartismus tiefe Sympathien im Volke findet und auch die große Zahl der Ehrgeizigen , die sich nicht für eine Idee entscheiden wollen , in sich aufnimmt , trotzdem glaube ich nicht , daß er so bald den Sieg davontragen möchte ; käme er aber zur Herrschaft , so dürfte auch diese nicht von langer Dauer sein , und sie würde , ganz wie die frühere napoleonische Regierung , nur eine kurze Vermittlungsperiode bilden .	großen Fehler durch ihre unzeitige Knickerei .Trotzdem , daß der Bonapartismus tiefe Sympathien im Volke findet und auch die große Zahl der Ehrgeizigen , die sich nicht für eine Idee entscheiden wollen , in sich aufnimmt , trotzdem glaube ich nicht , daß er so bald den Sieg davontragen möchte ; käme er aber zur Herrschaft , so dürfte auch diese nicht von langer Dauer sein , und sie würde , ganz wie die frühere napoleonische Regierung , nur eine kurze Vermittlungsperiode bilden .Aber es ist nicht dieser libertizide Napoleon	375	0	heine_lutetia_lutetia.tsv
PAV	PROAV		PROAV	trotzdem		Trotzdem , daß der Bonapartismus tiefe Sympathien im Volke findet und auch die große Zahl der Ehrgeizigen , die sich nicht für eine Idee entscheiden wollen , in sich aufnimmt ,	trotzdem	glaube ich nicht , daß er so bald den Sieg davontragen möchte ; käme er aber zur Herrschaft , so dürfte auch diese nicht von langer Dauer sein , und sie würde , ganz wie die frühere napoleonische Regierung , nur eine kurze Vermittlungsperiode bilden .	großen Fehler durch ihre unzeitige Knickerei .Trotzdem , daß der Bonapartismus tiefe Sympathien im Volke findet und auch die große Zahl der Ehrgeizigen , die sich nicht für eine Idee entscheiden wollen , in sich aufnimmt , trotzdem glaube ich nicht , daß er so bald den Sieg davontragen möchte ; käme er aber zur Herrschaft , so dürfte auch diese nicht von langer Dauer sein , und sie würde , ganz wie die frühere napoleonische Regierung , nur eine kurze Vermittlungsperiode bilden .Aber es ist nicht dieser libertizide Napoleon	375	31	heine_lutetia_lutetia.tsv
PAV	ADV		PROAV	übereinander		rief Miussow und schlug vor Aufregung die Beine abwechselnd	übereinander	.	analog den Bischöfen in ihrem Sprengel .rief Miussow und schlug vor Aufregung die Beine abwechselnd übereinander .» Das ist ja der reinste Ultramontanismus	436	9	dostojew_karamaso_karamaso.tsv