DTA-Tag	TT-Tag	MM-TAg	Perceptron-Tag	Lemma	newtag	Prefix	Wort	Suffix	Sentence_neighborhood	sentence_index	index	filename
PRELS	PRELS		PRELS	die		« Die Leute strömten immer zahlreicher , je näher man der Kirche kam , denn an Pfingsten , wenn die Sonne schön warm scheinet , wagt so manches alte Mütterli ,	das	durch Kalte und Kot nicht mehr kam , noch so gerne einen Kirchgang und labet seine Seele , die auch gerne da oben wäre an des Herrn Mahl ; es weiß nicht , was der Herr im nächsten Winter mit ihm vorhat , es sucht , wo es kann , den Herrn , damit wenn der Tod kommt , der Herr es finde .	froh , wenn er weg wäre .« Die Leute strömten immer zahlreicher , je näher man der Kirche kam , denn an Pfingsten , wenn die Sonne schön warm scheinet , wagt so manches alte Mütterli , das durch Kalte und Kot nicht mehr kam , noch so gerne einen Kirchgang und labet seine Seele , die auch gerne da oben wäre an des Herrn Mahl ; es weiß nicht , was der Herr im nächsten Winter mit ihm vorhat , es sucht , wo es kann , den Herrn , damit wenn der Tod kommt , der Herr es finde .Christen forderte nun Rücksichten für diese Schwäche	1271	31	gotthelf_geldgeis_geldgeis.tsv
PRELS	PRELS		PRELS	die		Möge sein Wein nicht die Eigenschaft jenes Getränkes haben ,	das	die Zauberjungfrau im berühmten Oldenburger Horn unserm Ahnherrn , dem Grafen Otto darbot .	, so stehe ich zu Diensten .Möge sein Wein nicht die Eigenschaft jenes Getränkes haben , das die Zauberjungfrau im berühmten Oldenburger Horn unserm Ahnherrn , dem Grafen Otto darbot .Mühsam rang der Graf nach Fassung ,	3710	10	bechstei_dunkelgr_dunkelgr.tsv
PRELS	PRELS		PRELS	die		Vor der Dreizehner-Versammlung stand ein frischer , vollwangiger , noch recht junger Mann von schlanker Statur mit hellem , goldrotem Haar , ein etwa Fünfundzwanzigjähriger , von	dem	man einen Vortrag über die enorme Zuträglichkeit englischer Turnspiele erwartet hätte , der aber sprach über Nikolaus Lenau .	hebbt ji ni ook Lotinsch leehrt ?Vor der Dreizehner-Versammlung stand ein frischer , vollwangiger , noch recht junger Mann von schlanker Statur mit hellem , goldrotem Haar , ein etwa Fünfundzwanzigjähriger , von dem man einen Vortrag über die enorme Zuträglichkeit englischer Turnspiele erwartet hätte , der aber sprach über Nikolaus Lenau .» Nu sieh mal , wenn ji	1584	27	ernst_huempeld_huempeld.tsv
PRELS	ART		PRELS	die		Die edle Kraft der Rückerinnerung Ermattete nur in dem tiefen Sand Des langen Weges ,	den	ich hab durchmessen ; Kaum daß manchmal durch seltne Wolkenrisse Ein flüchtges Blitzen mir den alten Schauplatz Versunkner Tage wundersam erleuchtet .	Ein Fürst war ich ?Die edle Kraft der Rückerinnerung Ermattete nur in dem tiefen Sand Des langen Weges , den ich hab durchmessen ; Kaum daß manchmal durch seltne Wolkenrisse Ein flüchtges Blitzen mir den alten Schauplatz Versunkner Tage wundersam erleuchtet .– Ein König einst , Ulmon mein	4513	15	moerike_nolten_nolten.tsv
PRELS	PRELS		PRELS	die		« – » Glücklich die Kinder , welche in den Armen ihrer Eltern sterben « , sagte Oswald , » und an dem Herzen dessen ,	der	ihnen das Leben gab , auch den Tod empfangen ; so verliert selbst dieser seinen Stachel .	das fast noch ganz erhalten ist .« – » Glücklich die Kinder , welche in den Armen ihrer Eltern sterben « , sagte Oswald , » und an dem Herzen dessen , der ihnen das Leben gab , auch den Tod empfangen ; so verliert selbst dieser seinen Stachel .Den Geliebten da , sich gegenüber zu	2977	26	stael_corinna_corinna.tsv
PRELS	PRELS		PRELS	die		Vor der Dreizehner-Versammlung stand ein frischer , vollwangiger , noch recht junger Mann von schlanker Statur mit hellem , goldrotem Haar , ein etwa Fünfundzwanzigjähriger , von dem man einen Vortrag über die enorme Zuträglichkeit englischer Turnspiele erwartet hätte ,	der	aber sprach über Nikolaus Lenau .	hebbt ji ni ook Lotinsch leehrt ?Vor der Dreizehner-Versammlung stand ein frischer , vollwangiger , noch recht junger Mann von schlanker Statur mit hellem , goldrotem Haar , ein etwa Fünfundzwanzigjähriger , von dem man einen Vortrag über die enorme Zuträglichkeit englischer Turnspiele erwartet hätte , der aber sprach über Nikolaus Lenau .» Nu sieh mal , wenn ji	1584	40	ernst_huempeld_huempeld.tsv
PRELS	PRELS		PRELS	die		Ihr faßtet Verdacht im ersten Augenblick und Eure Stafette mit der Anfrage , ob ich in Wien oder wo sonst zu finden sei , erreichte mich selbst und ich hatte über den unglücklichen Plan des Barons keinen Zweifel mehr , als ich las : » es sei ein junger Mann hier eingetroffen ,	der	sich für den Grafen von Lacy ausgebe .	hier , als ich erwarten konnte .Ihr faßtet Verdacht im ersten Augenblick und Eure Stafette mit der Anfrage , ob ich in Wien oder wo sonst zu finden sei , erreichte mich selbst und ich hatte über den unglücklichen Plan des Barons keinen Zweifel mehr , als ich las : » es sei ein junger Mann hier eingetroffen , der sich für den Grafen von Lacy ausgebe .Seine Abreise ohne Abschied verhinderte meinen beabsichtigten	1244	53	paalzow_thyrnau2_thyrnau2.tsv
PRELS	PRELS		PRELS	die		Und Helmut ,	der	so tief in den Kosmos zu schauen wußte , würde sich dann auch zum Vergeben hindurchringen , wenn auch einstweilen noch Aufregungen hemmend wirkten .	, das jetzt in Abendsonne lächelte .Und Helmut , der so tief in den Kosmos zu schauen wußte , würde sich dann auch zum Vergeben hindurchringen , wenn auch einstweilen noch Aufregungen hemmend wirkten .« raunte Mister Friedrich , auf den	2411	3	wille_maschmen_maschmen.tsv
PRELS	PRELS		PRELS	die		Trotzdem , daß der Bonapartismus tiefe Sympathien im Volke findet und auch die große Zahl der Ehrgeizigen ,	die	sich nicht für eine Idee entscheiden wollen , in sich aufnimmt , trotzdem glaube ich nicht , daß er so bald den Sieg davontragen möchte ; käme er aber zur Herrschaft , so dürfte auch diese nicht von langer Dauer sein , und sie würde , ganz wie die frühere napoleonische Regierung , nur eine kurze Vermittlungsperiode bilden .	großen Fehler durch ihre unzeitige Knickerei .Trotzdem , daß der Bonapartismus tiefe Sympathien im Volke findet und auch die große Zahl der Ehrgeizigen , die sich nicht für eine Idee entscheiden wollen , in sich aufnimmt , trotzdem glaube ich nicht , daß er so bald den Sieg davontragen möchte ; käme er aber zur Herrschaft , so dürfte auch diese nicht von langer Dauer sein , und sie würde , ganz wie die frühere napoleonische Regierung , nur eine kurze Vermittlungsperiode bilden .Aber es ist nicht dieser libertizide Napoleon	375	18	heine_lutetia_lutetia.tsv
PRELS	PRELS		PRELS	die		« Die Leute strömten immer zahlreicher , je näher man der Kirche kam , denn an Pfingsten , wenn die Sonne schön warm scheinet , wagt so manches alte Mütterli , das durch Kalte und Kot nicht mehr kam , noch so gerne einen Kirchgang und labet seine Seele ,	die	auch gerne da oben wäre an des Herrn Mahl ; es weiß nicht , was der Herr im nächsten Winter mit ihm vorhat , es sucht , wo es kann , den Herrn , damit wenn der Tod kommt , der Herr es finde .	froh , wenn er weg wäre .« Die Leute strömten immer zahlreicher , je näher man der Kirche kam , denn an Pfingsten , wenn die Sonne schön warm scheinet , wagt so manches alte Mütterli , das durch Kalte und Kot nicht mehr kam , noch so gerne einen Kirchgang und labet seine Seele , die auch gerne da oben wäre an des Herrn Mahl ; es weiß nicht , was der Herr im nächsten Winter mit ihm vorhat , es sucht , wo es kann , den Herrn , damit wenn der Tod kommt , der Herr es finde .Christen forderte nun Rücksichten für diese Schwäche	1271	50	gotthelf_geldgeis_geldgeis.tsv
PRELS	ART		PRELS	die		Ja damals – Morgen , wenn ich erwache , erster Feiertag , spitzenfrische Morgenröte und draußen Kinder ,	die	stolz und neidesfroh die Vorzüge ihrer Puppen spazieren führen und minderbeglückten , weniger bedachten Gespielinnen gegenüber preisen .	Und ein purpurnes Laken von Disteln .Ja damals – Morgen , wenn ich erwache , erster Feiertag , spitzenfrische Morgenröte und draußen Kinder , die stolz und neidesfroh die Vorzüge ihrer Puppen spazieren führen und minderbeglückten , weniger bedachten Gespielinnen gegenüber preisen .Dummheit , erhabene Göttin , Unsere Patronin	11	18	hille_ichbin_ichbin.tsv
PRELS	PRELS		PRELS	die		Gleichzeitig pilgerten drei einzelne Schläge von Sankt Nikolai in alle Fernen hinein , drei einzelne Schläge ,	die	sich in gemessenen Intervallen aneinander reihten , was andeuten sollte : in einer Stunde wird Christian Franz Malthus begraben .	Zeiger der Rathausuhr rückte auf zwei .Gleichzeitig pilgerten drei einzelne Schläge von Sankt Nikolai in alle Fernen hinein , drei einzelne Schläge , die sich in gemessenen Intervallen aneinander reihten , was andeuten sollte : in einer Stunde wird Christian Franz Malthus begraben .Der Kopf kroch in die Schultern zurück	2171	17	lauff_sinter_sinter.tsv
PRELS	PRELS		PRELS	die		Und diese Kunst uns Lehrlingen ,	die	wir ein so steifes schweizerisches Mundwerk hatten und so gar keinen Schwung in der Einbildungskraft und so gar keinen Wortvorrat , beizubringen , war eine noch viel größere Kunst .	, ohne etwas davon zu verstehen .Und diese Kunst uns Lehrlingen , die wir ein so steifes schweizerisches Mundwerk hatten und so gar keinen Schwung in der Einbildungskraft und so gar keinen Wortvorrat , beizubringen , war eine noch viel größere Kunst .Überhaupt ward hauptsächlich darauf gesehen , daß	4250	6	gotthelf_schulmei_schulmei.tsv
PRELS	PRELS		PRELS	die		Unter dem Eindruck der Begeisterung ,	die	das Volk wie ein Sturm durchbraust hat , ist ein Gesetz zu stände gekommen , welches die bisherige Lücke der Verfassung ergänzt , die Pflicht des Staates , die vaterländischen Kunstdenkmäler zu erhalten und die Kunst überhaupt zu unterstützen , anerkennt und schöne Grundlagen für den Bau eines Nationalmuseums geschaffen hat .	hat seine Rede Kraft und Saft !Unter dem Eindruck der Begeisterung , die das Volk wie ein Sturm durchbraust hat , ist ein Gesetz zu stände gekommen , welches die bisherige Lücke der Verfassung ergänzt , die Pflicht des Staates , die vaterländischen Kunstdenkmäler zu erhalten und die Kunst überhaupt zu unterstützen , anerkennt und schöne Grundlagen für den Bau eines Nationalmuseums geschaffen hat .» Unser Pfarrer aber , « sprechen	2229	6	heer_notvest_notvest.tsv
PRELS	PRELS		PRELS	was		« In diesem Augenblicke und während der Herzog mit dem ,	was	vor seinen Augen vorging , zu sehr beschäftigt war , als daß er hätte darauf achten können , was hinter ihm geschah , schlich sich Oliver le Dain hinter den König und flüsterte ihm ins Ohr : » Es ist der Zigeuner Hayraddin Maugrabin !	« – » Amen !« In diesem Augenblicke und während der Herzog mit dem , was vor seinen Augen vorging , zu sehr beschäftigt war , als daß er hätte darauf achten können , was hinter ihm geschah , schlich sich Oliver le Dain hinter den König und flüsterte ihm ins Ohr : » Es ist der Zigeuner Hayraddin Maugrabin !– Nun denn , Dunois , so	3471	11	scott_quentind_quentind.tsv
PRELS	PWS		PWS	was		Gleichzeitig pilgerten drei einzelne Schläge von Sankt Nikolai in alle Fernen hinein , drei einzelne Schläge , die sich in gemessenen Intervallen aneinander reihten ,	was	andeuten sollte : in einer Stunde wird Christian Franz Malthus begraben .	Zeiger der Rathausuhr rückte auf zwei .Gleichzeitig pilgerten drei einzelne Schläge von Sankt Nikolai in alle Fernen hinein , drei einzelne Schläge , die sich in gemessenen Intervallen aneinander reihten , was andeuten sollte : in einer Stunde wird Christian Franz Malthus begraben .Der Kopf kroch in die Schultern zurück	2171	25	lauff_sinter_sinter.tsv
PRELS	PWS		PWS	was		Du weißt ,	was	die Leute sagen werden .	Ich habe mir alles unterwegs überlegt .Du weißt , was die Leute sagen werden .Dann wanderte er langsam durch die Straße	1841	3	bruun_byge2_byge2.tsv
PRELS	PRELS		PWS	was		» Erzähle mir alles ,	was	.	dem Bankeinbruch schien ihm sehr nahezugehen .» Erzähle mir alles , was .Price aufs neue .	1252	5	wallacee_toechter_toechter.tsv
PRELS	PWS		PWS	was		Diesem allem nach / und weil man im gemeinen Sprichwort zusagen pflegt / Es lasse sich auch wol eines Königs Gut verthun / so möchte ich gern von jemand vernemmen / auff	was	Weis und Weg solches geschehen möchte ?	übermachter Bezahlung ) genügen lassen muß .Diesem allem nach / und weil man im gemeinen Sprichwort zusagen pflegt / Es lasse sich auch wol eines Königs Gut verthun / so möchte ich gern von jemand vernemmen / auff was Weis und Weg solches geschehen möchte ?Jhr denckt gewiß ihr führet Mist auß	12	32	grimmels_plutonis_plutonis.tsv
PRELS	PWS		PWS	was		Eines ,	was	er ihr auch nicht gesagt hat , hat sie kombiniert : Oha .	durchs Telephon auch noch erzählen sollen .Eines , was er ihr auch nicht gesagt hat , hat sie kombiniert : Oha .Und deshalb kann dieses Buch , das	794	2	kraus_grosszei_grosszei.tsv
PRELS	PRELS		PRELS	welche		Wiewohl die Feinde mehr wichen , als getrieben wurden : denn hinter ihnen lagen Hügel , auf	welche	sich die hinteren Glieder in voller Ordnung sicher zurückzogen .	der Tribunen zur Einsage zu stimmen .Wiewohl die Feinde mehr wichen , als getrieben wurden : denn hinter ihnen lagen Hügel , auf welche sich die hinteren Glieder in voller Ordnung sicher zurückzogen .Ihr vorzüglichstes Augenmerk sei , Lilybäum zu	29764	17	livius_roemisch_roemisch.tsv
PRELS	PRELS		PRELS	welche		« – » Glücklich die Kinder ,	welche	in den Armen ihrer Eltern sterben « , sagte Oswald , » und an dem Herzen dessen , der ihnen das Leben gab , auch den Tod empfangen ; so verliert selbst dieser seinen Stachel .	das fast noch ganz erhalten ist .« – » Glücklich die Kinder , welche in den Armen ihrer Eltern sterben « , sagte Oswald , » und an dem Herzen dessen , der ihnen das Leben gab , auch den Tod empfangen ; so verliert selbst dieser seinen Stachel .Den Geliebten da , sich gegenüber zu	2977	7	stael_corinna_corinna.tsv
PRELS	PRELS		PRELS	welche		und der Kultus ,	welcher	ihnen ohne Zweifel im Heidentume zukam , scheint sich selbst auf das Mittelalter übertragen zu haben .	und da der Sonne freien Durchgang .und der Kultus , welcher ihnen ohne Zweifel im Heidentume zukam , scheint sich selbst auf das Mittelalter übertragen zu haben .Wahrscheinlich gehören sie zu der Gruppe der	1956	4	masius_ndtland_ndtland.tsv
PRELS	PRELS		PRELS	welche		Unter dem Eindruck der Begeisterung , die das Volk wie ein Sturm durchbraust hat , ist ein Gesetz zu stände gekommen ,	welches	die bisherige Lücke der Verfassung ergänzt , die Pflicht des Staates , die vaterländischen Kunstdenkmäler zu erhalten und die Kunst überhaupt zu unterstützen , anerkennt und schöne Grundlagen für den Bau eines Nationalmuseums geschaffen hat .	hat seine Rede Kraft und Saft !Unter dem Eindruck der Begeisterung , die das Volk wie ein Sturm durchbraust hat , ist ein Gesetz zu stände gekommen , welches die bisherige Lücke der Verfassung ergänzt , die Pflicht des Staates , die vaterländischen Kunstdenkmäler zu erhalten und die Kunst überhaupt zu unterstützen , anerkennt und schöne Grundlagen für den Bau eines Nationalmuseums geschaffen hat .» Unser Pfarrer aber , « sprechen	2229	22	heer_notvest_notvest.tsv
PRELS	PRELS		PRELS	welche		Darum nehmen wir , wenn sich uns Gelegenheit dazu bietet , die Frauen und Töchter der Weißen gefangen und geben sie ihnen gegen ein Lösegeld zurück , für	welches	wir uns dann kaufen , was wir brauchen .	wir weder Estanzias noch Ranchos besitzen .Darum nehmen wir , wenn sich uns Gelegenheit dazu bietet , die Frauen und Töchter der Weißen gefangen und geben sie ihnen gegen ein Lösegeld zurück , für welches wir uns dann kaufen , was wir brauchen .« » Nun , kaufen können wir	11072	28	may_sendado2_sendado2.tsv