DTA-Tag	TT-Tag	MM-TAg	Perceptron-Tag	Lemma	newtag	Prefix	Wort	Suffix	Sentence_neighborhood	sentence_index	index	filename
PPER	PPER		PPER	du			Du	bist es mehr vielleicht als ich .	Ein sechsfüßiger jambischer Vers .Du bist es mehr vielleicht als ich .V. 6 .	1449	0	plautus_menaechm_menaechm.tsv
PPER	PPER		PPER	du		‹ » Kind , Würmle , « suchte sie die Kleine zu trösten , » was fallt	dir	denn ein – wer wird so weine , dummes Dingele – « Sie schöpfte Atem : » Jetz isch 's Kätterle lang tot ; ihr ältster Bub hat's Häusle und e Stub voller Kinder .	« bat die Frau .‹ » Kind , Würmle , « suchte sie die Kleine zu trösten , » was fallt dir denn ein – wer wird so weine , dummes Dingele – « Sie schöpfte Atem : » Jetz isch 's Kätterle lang tot ; ihr ältster Bub hat's Häusle und e Stub voller Kinder .Es ist nicht auszudenken , was aus	459	17	villinge_rebaechl_rebaechl.tsv
PPER	PPER		PPER	er		Als	er	in die Nähe des Hotels » Preußische Krone « gekommen war , wurde die Tür aufgerissen , und der Kreisbaumeister Mulvert sprang als Anführer einiger Männer torkelnd auf die Straße .	auch etwas wie kalter Triumph enthielt .Als er in die Nähe des Hotels » Preußische Krone « gekommen war , wurde die Tür aufgerissen , und der Kreisbaumeister Mulvert sprang als Anführer einiger Männer torkelnd auf die Straße .Die Witwe des Umgekommenen saß wie entgeistert	1369	1	stehr_maechler_maechler.tsv
PPER	PPER		PPER	er		Wehe aber , wenn die Gesellschaft , die sich da im Weinhaus zusammenfand , ihm nicht genehm war , wenn beschränkte , spießige Köpfe an der Tafelrunde ihn störten , dann muß	er	vollständig unerträglich gewesen sein , einen ganz fürchterlichen Gebrauch von seiner Kunst , Fratzen zu schneiden , Leute in Verlegenheit zu bringen , zu erschrecken , gemacht haben .	nichts tun als nippen und gähnen .Wehe aber , wenn die Gesellschaft , die sich da im Weinhaus zusammenfand , ihm nicht genehm war , wenn beschränkte , spießige Köpfe an der Tafelrunde ihn störten , dann muß er vollständig unerträglich gewesen sein , einen ganz fürchterlichen Gebrauch von seiner Kunst , Fratzen zu schneiden , Leute in Verlegenheit zu bringen , zu erschrecken , gemacht haben .Im Grunde ist natürlich immer Hoffmann selbst	976	32	benjamin_radio_radio.tsv
PPER	PPER		PPER	er		Wehe aber , wenn die Gesellschaft , die sich da im Weinhaus zusammenfand ,	ihm	nicht genehm war , wenn beschränkte , spießige Köpfe an der Tafelrunde ihn störten , dann muß er vollständig unerträglich gewesen sein , einen ganz fürchterlichen Gebrauch von seiner Kunst , Fratzen zu schneiden , Leute in Verlegenheit zu bringen , zu erschrecken , gemacht haben .	nichts tun als nippen und gähnen .Wehe aber , wenn die Gesellschaft , die sich da im Weinhaus zusammenfand , ihm nicht genehm war , wenn beschränkte , spießige Köpfe an der Tafelrunde ihn störten , dann muß er vollständig unerträglich gewesen sein , einen ganz fürchterlichen Gebrauch von seiner Kunst , Fratzen zu schneiden , Leute in Verlegenheit zu bringen , zu erschrecken , gemacht haben .Im Grunde ist natürlich immer Hoffmann selbst	976	14	benjamin_radio_radio.tsv
PPER	PPER		PPER	er		Sie nannte	ihn	» mein Junge « .	» Demnächst gibts ja eine Wiederholung !Sie nannte ihn » mein Junge « .Manchmal werden Sie sich doch meiner erinnern	6623	2	flaubert_bovary_bovary.tsv
PPER	PPER		PPER	er		Wehe aber , wenn die Gesellschaft , die sich da im Weinhaus zusammenfand , ihm nicht genehm war , wenn beschränkte , spießige Köpfe an der Tafelrunde	ihn	störten , dann muß er vollständig unerträglich gewesen sein , einen ganz fürchterlichen Gebrauch von seiner Kunst , Fratzen zu schneiden , Leute in Verlegenheit zu bringen , zu erschrecken , gemacht haben .	nichts tun als nippen und gähnen .Wehe aber , wenn die Gesellschaft , die sich da im Weinhaus zusammenfand , ihm nicht genehm war , wenn beschränkte , spießige Köpfe an der Tafelrunde ihn störten , dann muß er vollständig unerträglich gewesen sein , einen ganz fürchterlichen Gebrauch von seiner Kunst , Fratzen zu schneiden , Leute in Verlegenheit zu bringen , zu erschrecken , gemacht haben .Im Grunde ist natürlich immer Hoffmann selbst	976	27	benjamin_radio_radio.tsv
PPER	PPER		PPER	er		Beide , Selmann und Tobias , waren vor allen Dingen geschäftig ,	ihn	loszumachen , und schnitten mit Messern so lange , bis alle Bande entzwei waren .	« – Tobias Knaut !Beide , Selmann und Tobias , waren vor allen Dingen geschäftig , ihn loszumachen , und schnitten mit Messern so lange , bis alle Bande entzwei waren .Ein so unbeweglicher lange anhaltender Blick mußte	4068	12	wezel_knaut_knaut.tsv
PPER	PPER		FM	es		‹ » Kind , Würmle , « suchte sie die Kleine zu trösten , » was fallt dir denn ein – wer wird so weine , dummes Dingele – « Sie schöpfte Atem : » Jetz isch	's	Kätterle lang tot ; ihr ältster Bub hat's Häusle und e Stub voller Kinder .	« bat die Frau .‹ » Kind , Würmle , « suchte sie die Kleine zu trösten , » was fallt dir denn ein – wer wird so weine , dummes Dingele – « Sie schöpfte Atem : » Jetz isch 's Kätterle lang tot ; ihr ältster Bub hat's Häusle und e Stub voller Kinder .Es ist nicht auszudenken , was aus	459	37	villinge_rebaechl_rebaechl.tsv
PPER	PPER		PPER	es		Du bist	es	mehr vielleicht als ich .	Ein sechsfüßiger jambischer Vers .Du bist es mehr vielleicht als ich .V. 6 .	1449	2	plautus_menaechm_menaechm.tsv
PPER	PPER		PPER	ich		– Aber ich würde doch lieber ein Dutzend Burschen zum Frühstück peitschen lassen , bis ihnen das Blut in die Schuhe läuft , als daß	ich	Euch erschrecken wollte , Täubchen .	ist ein heiliger Derwisch der Christen !– Aber ich würde doch lieber ein Dutzend Burschen zum Frühstück peitschen lassen , bis ihnen das Blut in die Schuhe läuft , als daß ich Euch erschrecken wollte , Täubchen .Sie haben Mahadrö und dich gerettet !	3843	25	retcliff_sonora_sonora.tsv
PPER	PPER		PPER	ich		Du bist es mehr vielleicht als	ich	.	Ein sechsfüßiger jambischer Vers .Du bist es mehr vielleicht als ich .V. 6 .	1449	6	plautus_menaechm_menaechm.tsv
PPER	PPER		PPER	ich		« Erstes Kapitel Womit meine Lebensgeschichte eingeleitet wird Meine vielfachen Bitten , mir die Angabe der Ursache zu einer an ihr vorher nie bemerkten Gemüthsaufregung nicht länger vorzuenthalten , fanden nach langem Widerstande Eingang in ihr Ohr , und	ich	erfuhr Folgendes : daß ihr Verlobter ihr am Morgen begegnet habe , als sie von einer Standesperson aus unserer Kundschaft auf dem Wege Behufs neuer Bestellungen angesprochen worden .	Kauflustiger , so leicht verirren konnte .« Erstes Kapitel Womit meine Lebensgeschichte eingeleitet wird Meine vielfachen Bitten , mir die Angabe der Ursache zu einer an ihr vorher nie bemerkten Gemüthsaufregung nicht länger vorzuenthalten , fanden nach langem Widerstande Eingang in ihr Ohr , und ich erfuhr Folgendes : daß ihr Verlobter ihr am Morgen begegnet habe , als sie von einer Standesperson aus unserer Kundschaft auf dem Wege Behufs neuer Bestellungen angesprochen worden .Bedeutende Summen an die verschiedenen Behörden gespendet	1055	39	kohn_jgilblas_jgilblas.tsv
PPER	PPER		PPER	ich		» Höre , Cäsar ,	ich	hoffe , du lädtst den Herrn Abbé Loraux zum Diner ein !	Mein Bruder !» Höre , Cäsar , ich hoffe , du lädtst den Herrn Abbé Loraux zum Diner ein !» Mein Bruder !	1455	5	balzac_birottea_birottea.tsv
PPER	PPER		PRF	ich		« Erstes Kapitel Womit meine Lebensgeschichte eingeleitet wird Meine vielfachen Bitten ,	mir	die Angabe der Ursache zu einer an ihr vorher nie bemerkten Gemüthsaufregung nicht länger vorzuenthalten , fanden nach langem Widerstande Eingang in ihr Ohr , und ich erfuhr Folgendes : daß ihr Verlobter ihr am Morgen begegnet habe , als sie von einer Standesperson aus unserer Kundschaft auf dem Wege Behufs neuer Bestellungen angesprochen worden .	Kauflustiger , so leicht verirren konnte .« Erstes Kapitel Womit meine Lebensgeschichte eingeleitet wird Meine vielfachen Bitten , mir die Angabe der Ursache zu einer an ihr vorher nie bemerkten Gemüthsaufregung nicht länger vorzuenthalten , fanden nach langem Widerstande Eingang in ihr Ohr , und ich erfuhr Folgendes : daß ihr Verlobter ihr am Morgen begegnet habe , als sie von einer Standesperson aus unserer Kundschaft auf dem Wege Behufs neuer Bestellungen angesprochen worden .Bedeutende Summen an die verschiedenen Behörden gespendet	1055	12	kohn_jgilblas_jgilblas.tsv
PPER	PPER		PPER	ihr		– Aber ich würde doch lieber ein Dutzend Burschen zum Frühstück peitschen lassen , bis ihnen das Blut in die Schuhe läuft , als daß ich	Euch	erschrecken wollte , Täubchen .	ist ein heiliger Derwisch der Christen !– Aber ich würde doch lieber ein Dutzend Burschen zum Frühstück peitschen lassen , bis ihnen das Blut in die Schuhe läuft , als daß ich Euch erschrecken wollte , Täubchen .Sie haben Mahadrö und dich gerettet !	3843	26	retcliff_sonora_sonora.tsv
PPER	PPER		PPER	sie			Sie	nannte ihn » mein Junge « .	» Demnächst gibts ja eine Wiederholung !Sie nannte ihn » mein Junge « .Manchmal werden Sie sich doch meiner erinnern	6623	0	flaubert_bovary_bovary.tsv
PPER	PPER		PPER	sie		‹ » Kind , Würmle , « suchte sie die Kleine zu trösten , » was fallt dir denn ein – wer wird so weine , dummes Dingele – «	Sie	schöpfte Atem : » Jetz isch 's Kätterle lang tot ; ihr ältster Bub hat's Häusle und e Stub voller Kinder .	« bat die Frau .‹ » Kind , Würmle , « suchte sie die Kleine zu trösten , » was fallt dir denn ein – wer wird so weine , dummes Dingele – « Sie schöpfte Atem : » Jetz isch 's Kätterle lang tot ; ihr ältster Bub hat's Häusle und e Stub voller Kinder .Es ist nicht auszudenken , was aus	459	30	villinge_rebaechl_rebaechl.tsv
PPER	PPER		PPER	sie		– Aber ich würde doch lieber ein Dutzend Burschen zum Frühstück peitschen lassen , bis	ihnen	das Blut in die Schuhe läuft , als daß ich Euch erschrecken wollte , Täubchen .	ist ein heiliger Derwisch der Christen !– Aber ich würde doch lieber ein Dutzend Burschen zum Frühstück peitschen lassen , bis ihnen das Blut in die Schuhe läuft , als daß ich Euch erschrecken wollte , Täubchen .Sie haben Mahadrö und dich gerettet !	3843	15	retcliff_sonora_sonora.tsv
PPER	PPER		PPER	sie		Und	ihr	kam die Frage , warum der Geliebte nicht hier sein könnte , in diesen Räumen , statt des anderen , für den ihr Herz längst erstorben war .	stieg ihr unwillkürlich Stassingks Bild auf .Und ihr kam die Frage , warum der Geliebte nicht hier sein könnte , in diesen Räumen , statt des anderen , für den ihr Herz längst erstorben war .Dann , Maria , wirft Du vielleicht	483	1	ompteda_maria_maria.tsv
PPER	PPER		PPOSAT	sie		« Erstes Kapitel Womit meine Lebensgeschichte eingeleitet wird Meine vielfachen Bitten , mir die Angabe der Ursache zu einer an	ihr	vorher nie bemerkten Gemüthsaufregung nicht länger vorzuenthalten , fanden nach langem Widerstande Eingang in ihr Ohr , und ich erfuhr Folgendes : daß ihr Verlobter ihr am Morgen begegnet habe , als sie von einer Standesperson aus unserer Kundschaft auf dem Wege Behufs neuer Bestellungen angesprochen worden .	Kauflustiger , so leicht verirren konnte .« Erstes Kapitel Womit meine Lebensgeschichte eingeleitet wird Meine vielfachen Bitten , mir die Angabe der Ursache zu einer an ihr vorher nie bemerkten Gemüthsaufregung nicht länger vorzuenthalten , fanden nach langem Widerstande Eingang in ihr Ohr , und ich erfuhr Folgendes : daß ihr Verlobter ihr am Morgen begegnet habe , als sie von einer Standesperson aus unserer Kundschaft auf dem Wege Behufs neuer Bestellungen angesprochen worden .Bedeutende Summen an die verschiedenen Behörden gespendet	1055	20	kohn_jgilblas_jgilblas.tsv
PPER	PPOSAT		PPOSAT	sie		« Erstes Kapitel Womit meine Lebensgeschichte eingeleitet wird Meine vielfachen Bitten , mir die Angabe der Ursache zu einer an ihr vorher nie bemerkten Gemüthsaufregung nicht länger vorzuenthalten , fanden nach langem Widerstande Eingang in ihr Ohr , und ich erfuhr Folgendes : daß ihr Verlobter	ihr	am Morgen begegnet habe , als sie von einer Standesperson aus unserer Kundschaft auf dem Wege Behufs neuer Bestellungen angesprochen worden .	Kauflustiger , so leicht verirren konnte .« Erstes Kapitel Womit meine Lebensgeschichte eingeleitet wird Meine vielfachen Bitten , mir die Angabe der Ursache zu einer an ihr vorher nie bemerkten Gemüthsaufregung nicht länger vorzuenthalten , fanden nach langem Widerstande Eingang in ihr Ohr , und ich erfuhr Folgendes : daß ihr Verlobter ihr am Morgen begegnet habe , als sie von einer Standesperson aus unserer Kundschaft auf dem Wege Behufs neuer Bestellungen angesprochen worden .Bedeutende Summen an die verschiedenen Behörden gespendet	1055	46	kohn_jgilblas_jgilblas.tsv
PPER	PPER		PPER	sie		‹ » Kind , Würmle , « suchte	sie	die Kleine zu trösten , » was fallt dir denn ein – wer wird so weine , dummes Dingele – « Sie schöpfte Atem : » Jetz isch 's Kätterle lang tot ; ihr ältster Bub hat's Häusle und e Stub voller Kinder .	« bat die Frau .‹ » Kind , Würmle , « suchte sie die Kleine zu trösten , » was fallt dir denn ein – wer wird so weine , dummes Dingele – « Sie schöpfte Atem : » Jetz isch 's Kätterle lang tot ; ihr ältster Bub hat's Häusle und e Stub voller Kinder .Es ist nicht auszudenken , was aus	459	8	villinge_rebaechl_rebaechl.tsv
PPER	PPER		PPER	sie		« Erstes Kapitel Womit meine Lebensgeschichte eingeleitet wird Meine vielfachen Bitten , mir die Angabe der Ursache zu einer an ihr vorher nie bemerkten Gemüthsaufregung nicht länger vorzuenthalten , fanden nach langem Widerstande Eingang in ihr Ohr , und ich erfuhr Folgendes : daß ihr Verlobter ihr am Morgen begegnet habe , als	sie	von einer Standesperson aus unserer Kundschaft auf dem Wege Behufs neuer Bestellungen angesprochen worden .	Kauflustiger , so leicht verirren konnte .« Erstes Kapitel Womit meine Lebensgeschichte eingeleitet wird Meine vielfachen Bitten , mir die Angabe der Ursache zu einer an ihr vorher nie bemerkten Gemüthsaufregung nicht länger vorzuenthalten , fanden nach langem Widerstande Eingang in ihr Ohr , und ich erfuhr Folgendes : daß ihr Verlobter ihr am Morgen begegnet habe , als sie von einer Standesperson aus unserer Kundschaft auf dem Wege Behufs neuer Bestellungen angesprochen worden .Bedeutende Summen an die verschiedenen Behörden gespendet	1055	53	kohn_jgilblas_jgilblas.tsv
PPER	PPER		PPER	wir			Wir	Kinder und Krischan hatten die ganze Unterhaltung schweigend angehört .	Und dabei spuckte er aus .Wir Kinder und Krischan hatten die ganze Unterhaltung schweigend angehört .« sagte mein Bruder Heinrich , der	47	0	niese_vanehren_vanehren.tsv