DTA-Tag	TT-Tag	MM-TAg	Perceptron-Tag	Lemma	newtag	Prefix	Wort	Suffix	Sentence_neighborhood	sentence_index	index	filename
VVPP	VVPP		VVPP	anhören		Wir Kinder und Krischan hatten die ganze Unterhaltung schweigend	angehört	.	Und dabei spuckte er aus .Wir Kinder und Krischan hatten die ganze Unterhaltung schweigend angehört .« sagte mein Bruder Heinrich , der	47	9	niese_vanehren_vanehren.tsv
VVPP	VVPP		VVPP	ansprechen		« Erstes Kapitel Womit meine Lebensgeschichte eingeleitet wird Meine vielfachen Bitten , mir die Angabe der Ursache zu einer an ihr vorher nie bemerkten Gemüthsaufregung nicht länger vorzuenthalten , fanden nach langem Widerstande Eingang in ihr Ohr , und ich erfuhr Folgendes : daß ihr Verlobter ihr am Morgen begegnet habe , als sie von einer Standesperson aus unserer Kundschaft auf dem Wege Behufs neuer Bestellungen	angesprochen	worden .	Kauflustiger , so leicht verirren konnte .« Erstes Kapitel Womit meine Lebensgeschichte eingeleitet wird Meine vielfachen Bitten , mir die Angabe der Ursache zu einer an ihr vorher nie bemerkten Gemüthsaufregung nicht länger vorzuenthalten , fanden nach langem Widerstande Eingang in ihr Ohr , und ich erfuhr Folgendes : daß ihr Verlobter ihr am Morgen begegnet habe , als sie von einer Standesperson aus unserer Kundschaft auf dem Wege Behufs neuer Bestellungen angesprochen worden .Bedeutende Summen an die verschiedenen Behörden gespendet	1055	66	kohn_jgilblas_jgilblas.tsv
VVPP	VVPP		VVPP	aufreissen		Als er in die Nähe des Hotels » Preußische Krone « gekommen war , wurde die Tür	aufgerissen	, und der Kreisbaumeister Mulvert sprang als Anführer einiger Männer torkelnd auf die Straße .	auch etwas wie kalter Triumph enthielt .Als er in die Nähe des Hotels » Preußische Krone « gekommen war , wurde die Tür aufgerissen , und der Kreisbaumeister Mulvert sprang als Anführer einiger Männer torkelnd auf die Straße .Die Witwe des Umgekommenen saß wie entgeistert	1369	17	stehr_maechler_maechler.tsv
VVPP	VVPP		VVPP	begegnen		« Erstes Kapitel Womit meine Lebensgeschichte eingeleitet wird Meine vielfachen Bitten , mir die Angabe der Ursache zu einer an ihr vorher nie bemerkten Gemüthsaufregung nicht länger vorzuenthalten , fanden nach langem Widerstande Eingang in ihr Ohr , und ich erfuhr Folgendes : daß ihr Verlobter ihr am Morgen	begegnet	habe , als sie von einer Standesperson aus unserer Kundschaft auf dem Wege Behufs neuer Bestellungen angesprochen worden .	Kauflustiger , so leicht verirren konnte .« Erstes Kapitel Womit meine Lebensgeschichte eingeleitet wird Meine vielfachen Bitten , mir die Angabe der Ursache zu einer an ihr vorher nie bemerkten Gemüthsaufregung nicht länger vorzuenthalten , fanden nach langem Widerstande Eingang in ihr Ohr , und ich erfuhr Folgendes : daß ihr Verlobter ihr am Morgen begegnet habe , als sie von einer Standesperson aus unserer Kundschaft auf dem Wege Behufs neuer Bestellungen angesprochen worden .Bedeutende Summen an die verschiedenen Behörden gespendet	1055	49	kohn_jgilblas_jgilblas.tsv
VVPP	VVPP		VVPP	begehen		« Dann stürzte sie wiederum , als habe sie ein Unrecht gegen Paaker	begangen	, zu dem Leichnam zurück , neben dem sie zusammensank .	Nebsecht , « rief ein Unterbefehlshaber .« Dann stürzte sie wiederum , als habe sie ein Unrecht gegen Paaker begangen , zu dem Leichnam zurück , neben dem sie zusammensank .Und wäre das Postament dort Mena's Zelt	5207	13	ebers_uarda_uarda.tsv
VVPP	VVPP		VVPP	beruhigen		Der Graf , die Komtesse , Amalie waren	beruhigt	.	deren Patrouille die Reisenden eskortiert hatte .Der Graf , die Komtesse , Amalie waren beruhigt .Schlagen Sie ein zu dem Bunde ...	3558	8	alexis_cabanis_cabanis.tsv
VVPP	VVFIN		VVPP	beziehen		Hier wohnte unten eine Kinderhälterin unehelicher Sprossen , die an dem erworbenen Monatsgeld langsam zu Tode hungerte , das obere wohnungsähnliche Gelaß hatte der Große Geist	bezogen	.	soeben gekreuzten anspruchsvollen Bürgerzeile nichts nachgab .Hier wohnte unten eine Kinderhälterin unehelicher Sprossen , die an dem erworbenen Monatsgeld langsam zu Tode hungerte , das obere wohnungsähnliche Gelaß hatte der Große Geist bezogen .Der Straßenzug des Sandgangs lief quer über	271	26	barlach_gestmond_gestmond.tsv
VVPP	VVPP		VVPP	bitten		Ich habe Dich in meinem Brief um häufige und ausführliche Nachricht	gebeten	über alles , was im Hauptquartier vorgeht ; schreibe mir oft , aber ich beschwöre Dich , schreibe mir nie die Wahrheit , schreibe mir nichts von dem , was wirklich dort geschieht , nichts von dem , was ihr hofft und fürchtet – nur das eine , daß Du lebst und meiner gedenkst .	die Hände des abgehenden Kuriers legt .Ich habe Dich in meinem Brief um häufige und ausführliche Nachricht gebeten über alles , was im Hauptquartier vorgeht ; schreibe mir oft , aber ich beschwöre Dich , schreibe mir nie die Wahrheit , schreibe mir nichts von dem , was wirklich dort geschieht , nichts von dem , was ihr hofft und fürchtet – nur das eine , daß Du lebst und meiner gedenkst .« rief Pawjel , seinen Handjar weit	2491	11	meding_plewna_plewna.tsv
VVPP	VVFIN		VVPP	durchsuchen		« » Wir haben das ganze Schloß	durchsucht	, das Mittelgebäude sowohl wie die drei Türme dort , denn zu allen von außen sichtbaren Zimmern derselben führten Treppen und Korridore .	Mon dieu !« » Wir haben das ganze Schloß durchsucht , das Mittelgebäude sowohl wie die drei Türme dort , denn zu allen von außen sichtbaren Zimmern derselben führten Treppen und Korridore .« » Wie , das tut er	635	7	galen_jasmund2_jasmund2.tsv
VVPP	VVPP		VVPP	einleiten		« Erstes Kapitel Womit meine Lebensgeschichte	eingeleitet	wird Meine vielfachen Bitten , mir die Angabe der Ursache zu einer an ihr vorher nie bemerkten Gemüthsaufregung nicht länger vorzuenthalten , fanden nach langem Widerstande Eingang in ihr Ohr , und ich erfuhr Folgendes : daß ihr Verlobter ihr am Morgen begegnet habe , als sie von einer Standesperson aus unserer Kundschaft auf dem Wege Behufs neuer Bestellungen angesprochen worden .	Kauflustiger , so leicht verirren konnte .« Erstes Kapitel Womit meine Lebensgeschichte eingeleitet wird Meine vielfachen Bitten , mir die Angabe der Ursache zu einer an ihr vorher nie bemerkten Gemüthsaufregung nicht länger vorzuenthalten , fanden nach langem Widerstande Eingang in ihr Ohr , und ich erfuhr Folgendes : daß ihr Verlobter ihr am Morgen begegnet habe , als sie von einer Standesperson aus unserer Kundschaft auf dem Wege Behufs neuer Bestellungen angesprochen worden .Bedeutende Summen an die verschiedenen Behörden gespendet	1055	6	kohn_jgilblas_jgilblas.tsv
VVPP	ADJD		VVPP	entfernen		Wir waren an einer Stelle , wo die deutsche Linie nur 45 Meter	entfernt	war .	hier bald dort in unsere Reihen .Wir waren an einer Stelle , wo die deutsche Linie nur 45 Meter entfernt war .Jetzt waren wir nichts als willenloses Werkzeug	2769	13	paasche_kirsch_kirsch.tsv
VVPP	NN		VVPP	entfesseln		Chor : Nicht hilf den Menschen fürder über alles Maß , Des eignen Unheils unbekümmert ; denn ich bin Der festen Hoffnung , daß du einst noch , dieser Qual	Entfesselt	, nicht von mindrer Macht wirst sein denn Zeus .	dem Götterknecht , kein Wort gegönnt !Chor : Nicht hilf den Menschen fürder über alles Maß , Des eignen Unheils unbekümmert ; denn ich bin Der festen Hoffnung , daß du einst noch , dieser Qual Entfesselt , nicht von mindrer Macht wirst sein denn Zeus .Drum wirst du Hüter dieses öden Felsens	239	30	aischylo_promethe_promethe.tsv
VVPP	VVPP		VVPP	entschließen		Auch er ist , sobald er an Gott und Unsterblichkeit glaubt , sofort	entschlossen	, nur noch der Unsterblichkeit zu leben : » einen halben Kompromiß nehm ich nicht an !	Held , beginnt durchaus als Pascal .Auch er ist , sobald er an Gott und Unsterblichkeit glaubt , sofort entschlossen , nur noch der Unsterblichkeit zu leben : » einen halben Kompromiß nehm ich nicht an !Diese Versöhnung mit der Wirklichkeit , mit	2883	13	bahr_kritik_kritik.tsv
VVPP	VVPP		VVPP	ersterben		Und ihr kam die Frage , warum der Geliebte nicht hier sein könnte , in diesen Räumen , statt des anderen , für den ihr Herz längst	erstorben	war .	stieg ihr unwillkürlich Stassingks Bild auf .Und ihr kam die Frage , warum der Geliebte nicht hier sein könnte , in diesen Räumen , statt des anderen , für den ihr Herz längst erstorben war .Dann , Maria , wirft Du vielleicht	483	27	ompteda_maria_maria.tsv
VVPP	VVPP		VVPP	ersticken		Wie ich genauer hinsehe , erkenne ich in allen Dingen dieselbe Schwermut , jeder Menschenblick ist ängstlich und falsch , jeder Ton gebrochen ... Auf allen Dingen liegt ein grauer Nebel , der jedes Licht verdeckt und jede Freude	erstickt	.	Wir fahren immer weiter und weiter .Wie ich genauer hinsehe , erkenne ich in allen Dingen dieselbe Schwermut , jeder Menschenblick ist ängstlich und falsch , jeder Ton gebrochen ... Auf allen Dingen liegt ein grauer Nebel , der jedes Licht verdeckt und jede Freude erstickt .Daß er ein Mensch war , der	1600	39	antholog_pfeiffen_pfeiffen.tsv
VVPP	VVPP		VVPP	finden		Darab erzählte , daß man Schehanna in dem Viertel der Eingeborenen	gefunden	hatte – hilflos und verstört , von Tür zu Tür schwankend , um nach ihrer Mutter zu fragen .	er wieder seiner Stimme Herr wurde .Darab erzählte , daß man Schehanna in dem Viertel der Eingeborenen gefunden hatte – hilflos und verstört , von Tür zu Tür schwankend , um nach ihrer Mutter zu fragen .Aber laßt uns den Todeskampf kurz machen	1893	11	bruun_unbgott2_unbgott2.tsv
VVPP	VVPP		VVPP	fortgehen		Sobald Rasumichin	fortgegangen	war , stand Raskolnikow auf , wandte sich zum Fenster , rannte dann bald gegen die eine , bald gegen die andre Wand an , als hätte er die Enge seines Kämmerchens vergessen , … und setzte sich wieder auf das Sofa .	« » Ach ja , ja !Sobald Rasumichin fortgegangen war , stand Raskolnikow auf , wandte sich zum Fenster , rannte dann bald gegen die eine , bald gegen die andre Wand an , als hätte er die Enge seines Kämmerchens vergessen , … und setzte sich wieder auf das Sofa .Ach , mein Gott !	12991	2	dostojew_schuldsu_schuldsu.tsv
VVPP	ADJA		VVPP	gebrechen		Wie ich genauer hinsehe , erkenne ich in allen Dingen dieselbe Schwermut , jeder Menschenblick ist ängstlich und falsch , jeder Ton	gebrochen	... Auf allen Dingen liegt ein grauer Nebel , der jedes Licht verdeckt und jede Freude erstickt .	Wir fahren immer weiter und weiter .Wie ich genauer hinsehe , erkenne ich in allen Dingen dieselbe Schwermut , jeder Menschenblick ist ängstlich und falsch , jeder Ton gebrochen ... Auf allen Dingen liegt ein grauer Nebel , der jedes Licht verdeckt und jede Freude erstickt .Daß er ein Mensch war , der	1600	22	antholog_pfeiffen_pfeiffen.tsv
VVPP	VVPP		VVPP	kommen		Als er in die Nähe des Hotels » Preußische Krone «	gekommen	war , wurde die Tür aufgerissen , und der Kreisbaumeister Mulvert sprang als Anführer einiger Männer torkelnd auf die Straße .	auch etwas wie kalter Triumph enthielt .Als er in die Nähe des Hotels » Preußische Krone « gekommen war , wurde die Tür aufgerissen , und der Kreisbaumeister Mulvert sprang als Anführer einiger Männer torkelnd auf die Straße .Die Witwe des Umgekommenen saß wie entgeistert	1369	11	stehr_maechler_maechler.tsv
VVPP	VVPP		VVPP	machen		Wehe aber , wenn die Gesellschaft , die sich da im Weinhaus zusammenfand , ihm nicht genehm war , wenn beschränkte , spießige Köpfe an der Tafelrunde ihn störten , dann muß er vollständig unerträglich gewesen sein , einen ganz fürchterlichen Gebrauch von seiner Kunst , Fratzen zu schneiden , Leute in Verlegenheit zu bringen , zu erschrecken ,	gemacht	haben .	nichts tun als nippen und gähnen .Wehe aber , wenn die Gesellschaft , die sich da im Weinhaus zusammenfand , ihm nicht genehm war , wenn beschränkte , spießige Köpfe an der Tafelrunde ihn störten , dann muß er vollständig unerträglich gewesen sein , einen ganz fürchterlichen Gebrauch von seiner Kunst , Fratzen zu schneiden , Leute in Verlegenheit zu bringen , zu erschrecken , gemacht haben .Im Grunde ist natürlich immer Hoffmann selbst	976	59	benjamin_radio_radio.tsv
VVPP	ADJD		ADJD	schwanken		Darab erzählte , daß man Schehanna in dem Viertel der Eingeborenen gefunden hatte – hilflos und verstört , von Tür zu Tür	schwankend	, um nach ihrer Mutter zu fragen .	er wieder seiner Stimme Herr wurde .Darab erzählte , daß man Schehanna in dem Viertel der Eingeborenen gefunden hatte – hilflos und verstört , von Tür zu Tür schwankend , um nach ihrer Mutter zu fragen .Aber laßt uns den Todeskampf kurz machen	1893	22	bruun_unbgott2_unbgott2.tsv
VVPP	VVPP		VVPP	stillen		Sie hätte gern die Neugier	gestillt	, die in ihr lebendig wurde , aber Wicho schob sie vor den Hag hinaus und schloß hinter ihr das Tor .	kam Heilwig von den Ställen her .Sie hätte gern die Neugier gestillt , die in ihr lebendig wurde , aber Wicho schob sie vor den Hag hinaus und schloß hinter ihr das Tor .Wicho sprang hinaus auf die offene Lände	5152	5	ganghofe_martinsk_martinsk.tsv
VVPP	ADJD		ADJD	torkeln		Als er in die Nähe des Hotels » Preußische Krone « gekommen war , wurde die Tür aufgerissen , und der Kreisbaumeister Mulvert sprang als Anführer einiger Männer	torkelnd	auf die Straße .	auch etwas wie kalter Triumph enthielt .Als er in die Nähe des Hotels » Preußische Krone « gekommen war , wurde die Tür aufgerissen , und der Kreisbaumeister Mulvert sprang als Anführer einiger Männer torkelnd auf die Straße .Die Witwe des Umgekommenen saß wie entgeistert	1369	28	stehr_maechler_maechler.tsv
VVPP	VVPP		VVPP	verdecken		Wie ich genauer hinsehe , erkenne ich in allen Dingen dieselbe Schwermut , jeder Menschenblick ist ängstlich und falsch , jeder Ton gebrochen ... Auf allen Dingen liegt ein grauer Nebel , der jedes Licht	verdeckt	und jede Freude erstickt .	Wir fahren immer weiter und weiter .Wie ich genauer hinsehe , erkenne ich in allen Dingen dieselbe Schwermut , jeder Menschenblick ist ängstlich und falsch , jeder Ton gebrochen ... Auf allen Dingen liegt ein grauer Nebel , der jedes Licht verdeckt und jede Freude erstickt .Daß er ein Mensch war , der	1600	35	antholog_pfeiffen_pfeiffen.tsv
VVPP	VVPP		VVPP	vergessen		Sobald Rasumichin fortgegangen war , stand Raskolnikow auf , wandte sich zum Fenster , rannte dann bald gegen die eine , bald gegen die andre Wand an , als hätte er die Enge seines Kämmerchens	vergessen	, … und setzte sich wieder auf das Sofa .	« » Ach ja , ja !Sobald Rasumichin fortgegangen war , stand Raskolnikow auf , wandte sich zum Fenster , rannte dann bald gegen die eine , bald gegen die andre Wand an , als hätte er die Enge seines Kämmerchens vergessen , … und setzte sich wieder auf das Sofa .Ach , mein Gott !	12991	35	dostojew_schuldsu_schuldsu.tsv