DTA-Tag	TT-Tag	MM-TAg	Perceptron-Tag	Lemma	newtag	Prefix	Wort	Suffix	Sentence_neighborhood	sentence_index	index	filename
VVINF	VVINF		VVINF	bedenken		Der Präsident erteilte jedoch Kozina eine strenge Rüge und fügte hinzu , dass nach allem , was bisher sichergestellt wurde , die Choden sich ihrer Obrigkeit gegenüber wie Rebellen benommen haben , und insbesondere er , Kozina , möge	bedenken	, was hier auf dem Spiele stehe .	und verschwand dann in der Menge .Der Präsident erteilte jedoch Kozina eine strenge Rüge und fügte hinzu , dass nach allem , was bisher sichergestellt wurde , die Choden sich ihrer Obrigkeit gegenüber wie Rebellen benommen haben , und insbesondere er , Kozina , möge bedenken , was hier auf dem Spiele stehe .Der Greis hob die Hand und segnete	3059	39	jirasek_chodisch_chodisch.tsv
VVINF	VVINF		VVINF	befreien		Wenn ihr › Nüchternen ‹ doch nicht in so törichter Weise glaubtet , das Geheimnis des Seins von seinem Schleier	befreien	zu können .	, seines Eigentums wäre niemand sicher .Wenn ihr › Nüchternen ‹ doch nicht in so törichter Weise glaubtet , das Geheimnis des Seins von seinem Schleier befreien zu können .» Wie kannst du im Ernste solche	119	20	lasswitz_erz_nullpnk2.tsv
VVINF	VVINF		VVFIN	bramarbasieren		In Italien , mochte der aus Venedig	bramarbasieren	, weiß jeder Anfänger besser Bescheid .	seinen dunklen Andeutungen nicht recht klug .In Italien , mochte der aus Venedig bramarbasieren , weiß jeder Anfänger besser Bescheid .Ihm sollte er nicht alle Entwürfe willig	1337	7	pastor_duerer_duerer.tsv
VVINF	VVFIN		VVINF	emporschlagen		Besonders ein Wort des Vorsitzenden drang Diethelm ins Herz , denn er hatte gesagt : Ein Verbrechen , das ungesühnt in der Seele ruht , gleicht dem Brand in einem Kohlenbergwerk ; man stopft es zu und will das Feuer ersticken , aber es brennt weiter , unterirdisch , ungesehen , und eine Öffnung , die sich auftut , läßt die Flamme	emporschlagen	.	» Da hilft kein ' Sympathie .Besonders ein Wort des Vorsitzenden drang Diethelm ins Herz , denn er hatte gesagt : Ein Verbrechen , das ungesühnt in der Seele ruht , gleicht dem Brand in einem Kohlenbergwerk ; man stopft es zu und will das Feuer ersticken , aber es brennt weiter , unterirdisch , ungesehen , und eine Öffnung , die sich auftut , läßt die Flamme emporschlagen .Hat mein Vater verkauft ?	1525	62	auerbach_diethelm_diethelm.tsv
VVINF	VVPP		VVINF	erfahren		Warum wollt Ihr denn bloß wissen , worin des Christen Bestimmung und Beruf bestehe , warum nicht vor Allem	erfahren	, was des Menschen würdig ist ?	Zuhörer in Menge um sich versammeln !Warum wollt Ihr denn bloß wissen , worin des Christen Bestimmung und Beruf bestehe , warum nicht vor Allem erfahren , was des Menschen würdig ist ?Laßt die Lehrer , die man Prediger	91	19	stirner_texte_gegenwor.tsv
VVINF	VVINF		VVINF	erhalten		Livius gibt zwar nur einen Grund seiner Verstellung an , nämlich den , in Sicherheit zu leben und sich sein Erbe zu	erhalten	.	Schlacht nahm ihr Feuer noch zu .Livius gibt zwar nur einen Grund seiner Verstellung an , nämlich den , in Sicherheit zu leben und sich sein Erbe zu erhalten .Denn wenn ihnen der Sieg nicht beim	4164	22	machiave_itagesch_itagesch.tsv
VVINF	VVINF		VVINF	erkiesen		Prinz Biribinker , sagte die Hummel , wenn sie Langeweile haben , so versichere ich sie , daß es mir noch schlimmer geht : Die Fee Melisotte , unsre Königin , hat mir seit etlichen Wochen die Ehre angethan , mich zu ihrem Liebling zu	erkiesen	; aber ich gestehe ihnen , daß ich der Last meines Amtes nicht gewachsen bin .	Sapperment !Prinz Biribinker , sagte die Hummel , wenn sie Langeweile haben , so versichere ich sie , daß es mir noch schlimmer geht : Die Fee Melisotte , unsre Königin , hat mir seit etlichen Wochen die Ehre angethan , mich zu ihrem Liebling zu erkiesen ; aber ich gestehe ihnen , daß ich der Last meines Amtes nicht gewachsen bin .Sey es so , weil ihrs für	886	45	wieland_sylvio_sylvio.tsv
VVINF	VVINF		VVINF	ersticken		Besonders ein Wort des Vorsitzenden drang Diethelm ins Herz , denn er hatte gesagt : Ein Verbrechen , das ungesühnt in der Seele ruht , gleicht dem Brand in einem Kohlenbergwerk ; man stopft es zu und will das Feuer	ersticken	, aber es brennt weiter , unterirdisch , ungesehen , und eine Öffnung , die sich auftut , läßt die Flamme emporschlagen .	» Da hilft kein ' Sympathie .Besonders ein Wort des Vorsitzenden drang Diethelm ins Herz , denn er hatte gesagt : Ein Verbrechen , das ungesühnt in der Seele ruht , gleicht dem Brand in einem Kohlenbergwerk ; man stopft es zu und will das Feuer ersticken , aber es brennt weiter , unterirdisch , ungesehen , und eine Öffnung , die sich auftut , läßt die Flamme emporschlagen .Hat mein Vater verkauft ?	1525	40	auerbach_diethelm_diethelm.tsv
VVINF	VVINF		VVINF	fallen		Wo blieb da der Schutzengel , der ungesehen kein Haar von unserm Haupte	fallen	läßt ?	die andern Opfer jener blutigen Mainacht ?Wo blieb da der Schutzengel , der ungesehen kein Haar von unserm Haupte fallen läßt ?Hat Gott nicht zugelassen , daß euer	2598	13	dahn_julian_julian.tsv
VVINF	VVFIN		VVINF	finden		« » Sie haben recht , « sagte er mit flüsternder Stimme , » sehen Sie nach , ob Sie das Gesuchte	finden	.	dessen vornehm nachlässiger und degagierter Haltung .« » Sie haben recht , « sagte er mit flüsternder Stimme , » sehen Sie nach , ob Sie das Gesuchte finden .Daneben berichtete man ausführlich von der Begegnung	3685	22	meding_euromine_euromine.tsv
VVINF	VVFIN		VVINF	halten		Ich dachte das große Spital müßte ihn locken , und ich wenigstens würde ihn für eine Person erster Linie	halten	.	1825-1882 ) , Kliniker in Heidelberg .Ich dachte das große Spital müßte ihn locken , und ich wenigstens würde ihn für eine Person erster Linie halten .Weber , den ich sehr wenig kenne	1608	19	ebstein_arztbrie_arztbrie.tsv
VVINF	VVFIN		VVINF	knallen		An Staub und Hitze und brüllende Ochsen und Kaffern , die mit langen Peitschen	knallen	, und an eine üppige Matratze im Wagen , auf der der Ouwbaas liegt .	der richtige Ausdruck für so etwas ?An Staub und Hitze und brüllende Ochsen und Kaffern , die mit langen Peitschen knallen , und an eine üppige Matratze im Wagen , auf der der Ouwbaas liegt .– Auf Pad ?	2408	14	faber_tausend_tausend.tsv
VVINF	VVINF		VVINF	kommen		Die Alte sagte zu ihm , er solle auf ihren Sohn warten , er werde bald	kommen	.	Bauer ging wieder zu den Winden .Die Alte sagte zu ihm , er solle auf ihren Sohn warten , er werde bald kommen .« – Da sprach zu ihm der	2029	16	dietrich_russmaer_russmaer.tsv
VVINF	VVINF		VVINF	leben		Livius gibt zwar nur einen Grund seiner Verstellung an , nämlich den , in Sicherheit zu	leben	und sich sein Erbe zu erhalten .	Schlacht nahm ihr Feuer noch zu .Livius gibt zwar nur einen Grund seiner Verstellung an , nämlich den , in Sicherheit zu leben und sich sein Erbe zu erhalten .Denn wenn ihnen der Sieg nicht beim	4164	16	machiave_itagesch_itagesch.tsv
VVINF	VVINF		VVINF	locken		Ich dachte das große Spital müßte ihn	locken	, und ich wenigstens würde ihn für eine Person erster Linie halten .	1825-1882 ) , Kliniker in Heidelberg .Ich dachte das große Spital müßte ihn locken , und ich wenigstens würde ihn für eine Person erster Linie halten .Weber , den ich sehr wenig kenne	1608	7	ebstein_arztbrie_arztbrie.tsv
VVINF	VVINF		VVINF	machen		Um den Riegel am Hudson für Clinton zu verstärken , eine Wegnahme Westpoints völlig unmöglich zu	machen	, hatte Steuben von Washington Befehl erhalten , aus der in Westpoint , Fishhill und der umliegenden zweiten , sehr starken Division neun Bataillone Riflemen auszuheben , von denen vier Bataillone unter General Howe südlich an den Hudson vorgeschoben werden sollten , fünf Bataillone aber direkt zu Washingtons Hauptarmee zu stoßen hätten .	« fragte er .Um den Riegel am Hudson für Clinton zu verstärken , eine Wegnahme Westpoints völlig unmöglich zu machen , hatte Steuben von Washington Befehl erhalten , aus der in Westpoint , Fishhill und der umliegenden zweiten , sehr starken Division neun Bataillone Riflemen auszuheben , von denen vier Bataillone unter General Howe südlich an den Hudson vorgeschoben werden sollten , fünf Bataillone aber direkt zu Washingtons Hauptarmee zu stoßen hätten .– » Willst du den Brief mir	5514	16	brachvog_steuben_steuben.tsv
VVINF	VVINF		VVINF	marschieren		Nun solle ich sehen , rief sie , wie sie	marschieren	könne , und schlug einen Schritt ein , den ich sogleich zu mäßigen suchte .	Aber nein !Nun solle ich sehen , rief sie , wie sie marschieren könne , und schlug einen Schritt ein , den ich sogleich zu mäßigen suchte .Ich sagte aber , das gäbe sich	5080	10	kuegelgn_altmann_altmann.tsv
VVINF	VVINF		VVINF	mäßigen		Nun solle ich sehen , rief sie , wie sie marschieren könne , und schlug einen Schritt ein , den ich sogleich zu	mäßigen	suchte .	Aber nein !Nun solle ich sehen , rief sie , wie sie marschieren könne , und schlug einen Schritt ein , den ich sogleich zu mäßigen suchte .Ich sagte aber , das gäbe sich	5080	23	kuegelgn_altmann_altmann.tsv
VVINF	VVINF		VVINF	sehen		Nun solle ich	sehen	, rief sie , wie sie marschieren könne , und schlug einen Schritt ein , den ich sogleich zu mäßigen suchte .	Aber nein !Nun solle ich sehen , rief sie , wie sie marschieren könne , und schlug einen Schritt ein , den ich sogleich zu mäßigen suchte .Ich sagte aber , das gäbe sich	5080	3	kuegelgn_altmann_altmann.tsv
VVINF	VVINF		VVINF	stoßen		Um den Riegel am Hudson für Clinton zu verstärken , eine Wegnahme Westpoints völlig unmöglich zu machen , hatte Steuben von Washington Befehl erhalten , aus der in Westpoint , Fishhill und der umliegenden zweiten , sehr starken Division neun Bataillone Riflemen auszuheben , von denen vier Bataillone unter General Howe südlich an den Hudson vorgeschoben werden sollten , fünf Bataillone aber direkt zu Washingtons Hauptarmee zu	stoßen	hätten .	« fragte er .Um den Riegel am Hudson für Clinton zu verstärken , eine Wegnahme Westpoints völlig unmöglich zu machen , hatte Steuben von Washington Befehl erhalten , aus der in Westpoint , Fishhill und der umliegenden zweiten , sehr starken Division neun Bataillone Riflemen auszuheben , von denen vier Bataillone unter General Howe südlich an den Hudson vorgeschoben werden sollten , fünf Bataillone aber direkt zu Washingtons Hauptarmee zu stoßen hätten .– » Willst du den Brief mir	5514	67	brachvog_steuben_steuben.tsv
VVINF	VVFIN		VVINF	verhelfen		» Wenn die Chinesen wirklich in ihrem Recht gefährdet sind , sollen sie sich an mich wenden , und ich werde ihnen dazu	verhelfen	.	Spatzen aus einem Feld scheuchen würde .» Wenn die Chinesen wirklich in ihrem Recht gefährdet sind , sollen sie sich an mich wenden , und ich werde ihnen dazu verhelfen .In allen anderen Ländern der Welt wurde	10696	23	gerstaec_gold_gold.tsv
VVINF	VVINF		VVINF	verstärken		Um den Riegel am Hudson für Clinton zu	verstärken	, eine Wegnahme Westpoints völlig unmöglich zu machen , hatte Steuben von Washington Befehl erhalten , aus der in Westpoint , Fishhill und der umliegenden zweiten , sehr starken Division neun Bataillone Riflemen auszuheben , von denen vier Bataillone unter General Howe südlich an den Hudson vorgeschoben werden sollten , fünf Bataillone aber direkt zu Washingtons Hauptarmee zu stoßen hätten .	« fragte er .Um den Riegel am Hudson für Clinton zu verstärken , eine Wegnahme Westpoints völlig unmöglich zu machen , hatte Steuben von Washington Befehl erhalten , aus der in Westpoint , Fishhill und der umliegenden zweiten , sehr starken Division neun Bataillone Riflemen auszuheben , von denen vier Bataillone unter General Howe südlich an den Hudson vorgeschoben werden sollten , fünf Bataillone aber direkt zu Washingtons Hauptarmee zu stoßen hätten .– » Willst du den Brief mir	5514	8	brachvog_steuben_steuben.tsv
VVINF	VVINF		VVINF	wenden		» Wenn die Chinesen wirklich in ihrem Recht gefährdet sind , sollen sie sich an mich	wenden	, und ich werde ihnen dazu verhelfen .	Spatzen aus einem Feld scheuchen würde .» Wenn die Chinesen wirklich in ihrem Recht gefährdet sind , sollen sie sich an mich wenden , und ich werde ihnen dazu verhelfen .In allen anderen Ländern der Welt wurde	10696	16	gerstaec_gold_gold.tsv
VVINF	VVINF		VVINF	wissen		Warum wollt Ihr denn bloß	wissen	, worin des Christen Bestimmung und Beruf bestehe , warum nicht vor Allem erfahren , was des Menschen würdig ist ?	Zuhörer in Menge um sich versammeln !Warum wollt Ihr denn bloß wissen , worin des Christen Bestimmung und Beruf bestehe , warum nicht vor Allem erfahren , was des Menschen würdig ist ?Laßt die Lehrer , die man Prediger	91	5	stirner_texte_gegenwor.tsv
VVINF	VVFIN		VVINF	wohnen		30. welche sind jenseit des Jordans , der Straße nach gegen der Sonne Niedergang , im Lande der Kanaaniter , die auf dem Blachfelde	wohnen	, Gilgal gegenüber , bei dem Hain More .	ist , was gewiß geschehen wird .30. welche sind jenseit des Jordans , der Straße nach gegen der Sonne Niedergang , im Lande der Kanaaniter , die auf dem Blachfelde wohnen , Gilgal gegenüber , bei dem Hain More .15. Ich ermahne euch aber , liebe	28912	24	luther_bibel_bibel.tsv